AuthorID,Author,Date,Content,Attachments,Reactions
"474936118786129940","perantau98","2025-06-27T09:15:48.2120000+00:00","I mean look at Anwar, scandal after the same sodomy scandal but with different people. Yusoff Rawther case is not the first sodomy case. Mahathir vs Anwar is behind the scenes, Anwar took down the late Daim till his grave on corruption, while Mahathir might be funding Yusoff Rawther.","",""
"474936118786129940","perantau98","2025-06-27T09:18:43.7120000+00:00","Try and explore Malaysian politics, give your opinion. Between 31 August and 20 September. If you don’t want to touch about that since it requires manpower to research, try do live commentary on the state of affairs on the Sabah state elections.","",""
"605452468284817427","buzzer9229","2025-06-27T09:18:46.6250000+00:00","The saga between Mahathir and Anwar is legendary and how it spans almost 30 years","",""
"605452468284817427","buzzer9229","2025-06-27T09:19:18.4580000+00:00","What are some Malaysian social issues a lot of Gen Zs and Millennials are facing that could be solved in the realm of politics?","",""
"474936118786129940","perantau98","2025-06-27T09:19:27.5180000+00:00","Yes, this can be touched. If you can hook up with Khairy Jamaluddin, you will get exposure in Malaysian politics.","",""
"474936118786129940","perantau98","2025-06-27T09:20:27.5730000+00:00","Interesting question, mostly wtv millenials and gen z wants PH promised but the current gov went back on their words.","",""
"474936118786129940","perantau98","2025-06-27T09:22:38.0470000+00:00","If I were you, I would hook myself up with Khairy Jamaluddin, ex-parliamentarian, ex-minister, ex UMNO youth chief, contender of the UMNO Presidency. Pretty open to collab, he joined one obscure podcast in Singapore. He also touches on Indonesian politics. He is your gateway to Malaysian politics. He is very open to collab especially since you’ve made your mark bro.","",""
"605452468284817427","buzzer9229","2025-06-27T09:22:44.9670000+00:00","Maybe like the same thing Indonesians are facing?
-Difficult social mobility
-Wealth and power access
-Expensive cost of politics
-Job insecurity
-Mental health crisis
-Educational inequality
-Performative activism and politicking","",""
"474936118786129940","perantau98","2025-06-27T09:23:05.6410000+00:00","He is currently on his own podcast called Keluar Sekejap.","",""
"474936118786129940","perantau98","2025-06-27T09:24:57.3570000+00:00","Malaysia is just rising cost of living and medical cost with stagnant wages right now. Brain drain. Rising taxes.","",""
"474936118786129940","perantau98","2025-06-27T09:38:56.7840000+00:00","Racism, hahahaha this one would be a hot topic.

The rest you mentioned applies at a regional level but many don’t care. Let me address one by one why the issues you mentioned are not really touched on in Malaysia:

-Social mobility (Many programmes and initiatives to help Malaysians to leave their income group plus many scaled up) upward social mobility is pretty decent in Malaysia. Except for Sabahans as there are stateless people in Sabah.
-Wealth and power access (Malaysian youths are encouraged to join politics actually, many programmes are there supporting their access to join the administration or be the opposing voice)
-Expensive cost of politics (Unsure, political funding has no enactment so can’t really view who lobby’s for what, rather we have more bloated redundant gov agencies to feed those who have supported the gov (can check Pantau Kuasa by IDEAS Malaysia)
-Mental health crisis (the youth really are facing it but we have mental health programmes and access is very easy to meet a gov psychiatrist)
-Educational inequality (Anwar’s gov just solved one which is the Matriculation college entrance quotas are no longer based on race if you’re a high performer/achiever however, there is a scholarship opportunity crisis and how we still have a 100% bumiputera university but this is gonna be complicated as this needs to touch on the social contract and the constitution, need to be well-read to be fair and not parrot liberal talking points as even the more liberal gov which we have today can’t do anything on this)
-Performative activism and politicking (Mixed reaction, Fahmi Reza is still doing wtv he wants but he is banned from flying overseas, we have many pundits and buzzers for every political parties and NGOs to do this)
-Politicking (given but died down a little except for giving Zahid Hamidi a post as minister and he is known to be corrupted and Najib receiving a DNAA(Discharge not amounting to Acquittal) on his second SRC trial.","",""
"474936118786129940","perantau98","2025-06-27T09:40:28.2830000+00:00","The only thing that will make you go viral in Malaysia is to show that Malaysia’s promised reforms are not uphold, nepotism under Anwar Ibrahim, the ministry of reform is lead by a minister from UMNO and not from the party that always shout “Reformasi” which is PKR, the irony of it. @Buzzer beneran","",""
"474936118786129940","perantau98","2025-06-27T09:42:18.5870000+00:00","Other than that, highly recommend for you to check out Keluar Sekejap podcast by Khairy Jamaluddin. He is open for collabs.","",""
"605452468284817427","buzzer9229","2025-06-27T09:56:52.9520000+00:00","So it's just racism and nepotism?","",""
"474936118786129940","perantau98","2025-06-27T10:03:35.9060000+00:00","Yup, and promises unfulfilled. Plus, a lot of censorship and this is hypocritical as the current minister of media was last time anti-censorship and a keyboard warrior on twitter against Najib.","",""
"605452468284817427","buzzer9229","2025-06-27T10:10:30.0500000+00:00","Hmm ok","",""
"605452468284817427","buzzer9229","2025-06-27T10:10:36.9540000+00:00","What do Malaysians think of Indonesian politics?","",""
"605452468284817427","buzzer9229","2025-06-27T10:10:46.8000000+00:00","What do Malaysians think of the Based(less) Indonesian Show?","",""
"474936118786129940","perantau98","2025-06-27T12:40:35.1380000+00:00","Messy as hell. Ngl, very different system. My personal opinion, too much to learn and is not forgiving for underdogs. Very family, clan and tribal driven from my perspective.","",""
"474936118786129940","perantau98","2025-06-27T12:42:02.0000000+00:00","From what I have gathered, we Malaysians will call it syok. Easy to understand and fun. Not every dynamic we will understand.","",""
"474936118786129940","perantau98","2025-06-27T12:46:22.9450000+00:00","In Malaysia, nepotism and being tribal helps but there are many people who became leading politicians of the country without that. The Malays are usually influenced by who they are inspired by and love to be within that circle of influence. Not really might is right type of leadership.","",""
"474936118786129940","perantau98","2025-06-27T12:48:57.7330000+00:00","The Malays love a good underdog story. To gain support and loyalty is to be inspired and a cult like leader to the Malays.","",""
"605452468284817427","buzzer9229","2025-06-27T14:51:34.8830000+00:00","Well the thing about Indonesia is that Indonesia values social cohesion and harmony","",""
"605452468284817427","buzzer9229","2025-06-27T14:51:54.8170000+00:00","A president like Jokowi and Soeharto will be considered a more mature compromise","",""
"605452468284817427","buzzer9229","2025-06-27T14:52:35.4910000+00:00","While a president like Mahathir or Tunku Abdul Rahman, the former will be considered elitist and distant while the other will be considered too cerebral","",""
"474936118786129940","perantau98","2025-06-27T15:48:12.2720000+00:00","I realize Indonesians who are too cerebral are too nerdy and doesn’t command the audience, even Rocky Gerung and Gita Wirjawan. Meaning by commanding the audience is that, there is no trash talk. Mahathir is a trash talker. Indonesians maybe are too polite but there needs to be trash talk like calling out political rivals like you really mean that you’re fighting. I don’t see smart Indonesians doing that. Trash talk and beating expectations command respect.","",""
"605452468284817427","buzzer9229","2025-06-27T15:56:46.0080000+00:00","The only one we can trash talk is president and DPR","",""
"474936118786129940","perantau98","2025-06-27T15:57:40.0510000+00:00","Sorry let me rephrase, Indonesian politicians but in general Indonesians that are very smart.","",""
"605452468284817427","buzzer9229","2025-06-27T15:57:53.4870000+00:00","It doesn't mean that it's a hindrance to our democracy, Indonesia derives its strength through harmony, criticism could come from dialogue too it doesn't have to be public.","",""
"605452468284817427","buzzer9229","2025-06-27T15:58:39.7570000+00:00","In general, politics in Indonesia is still very relational","",""
"605452468284817427","buzzer9229","2025-06-27T15:58:55.5790000+00:00","You don't trash someone down because one day you might need them to build a coalition","",""
"605452468284817427","buzzer9229","2025-06-27T15:59:04.5220000+00:00","Anies trashed a lot of people and jumped here and there","",""
"605452468284817427","buzzer9229","2025-06-27T15:59:12.0970000+00:00","He almost went to prison lmao","",""
"474936118786129940","perantau98","2025-06-27T15:59:41.2630000+00:00","Understood. This is the better way. Just saying, your politicians are boring but there are so many political fuckery. Malaysian politicians are entertaining. Always provide a show. Be it smart or stupid, there will always be consistent drama","",""
"474936118786129940","perantau98","2025-06-27T16:00:02.0870000+00:00","Could be nothing personal.","",""
"605452468284817427","buzzer9229","2025-06-27T16:00:09.8290000+00:00","There's more manuevering in Indonesian politics","",""
"605452468284817427","buzzer9229","2025-06-27T16:00:27.7450000+00:00","The impression is that you don't wanna be seen as wrong","",""
"605452468284817427","buzzer9229","2025-06-27T16:00:37.0690000+00:00","If someone trashes you in public you're thought of as wrong","",""
"474936118786129940","perantau98","2025-06-27T16:01:19.2550000+00:00","Yup, plus your parties are pretty much can be not in favour of you though you are representing them. You can have as an individual, alliance with other parties.","",""
"474936118786129940","perantau98","2025-06-27T16:03:09.4890000+00:00","Hmmm, Mahathir started many of this. Anwar Ibrahim exposed Rahim Thambycheek as a pedophile though it is a debate that the underage girl was a set up. Then Rahim Thambycheek will start the long lines of honey traps for Anwar on multiple sodomy cases.","",""
"474936118786129940","perantau98","2025-06-27T16:05:29.3990000+00:00","Then many public debates held between politicians since the Anwar Ibrahim vs Shabery Cheek. There was KJ vs Rafizi, Anwar vs Najib, Rafizi vs some random PAS guy. I tell you, it is very entertaining.","",""
"474936118786129940","perantau98","2025-06-27T16:06:08.7760000+00:00","But don’t they know that the public’s attention span is limited?","",""
"605452468284817427","buzzer9229","2025-06-27T16:07:04.0090000+00:00","Well ofc, Malaysians have enough wisdom to understand that when a politician has an idea that is wrong, it could be improved or there is a lack of foresight which could be mitigated through more research and hearings.","",""
"474936118786129940","perantau98","2025-06-27T16:07:09.8280000+00:00","Mahathir wasn’t into blackmailing but he was invested in calling Anwar gay.","",""
"605452468284817427","buzzer9229","2025-06-27T16:07:59.5260000+00:00","Indonesia on the other hand, having an idea that is wrong makes you look like you're incompetent, no matter how much research you done to correct your mistakes, your error will be a black mark on your profile.","",""
"474936118786129940","perantau98","2025-06-27T16:08:26.4090000+00:00","Even among the elites?","",""
"474936118786129940","perantau98","2025-06-27T16:09:27.8300000+00:00","Malaysians love to participate in debates. English, Malay, Mandarin, Arabic and Tamil debate competitions in school are common.","",""
"605452468284817427","buzzer9229","2025-06-27T16:09:28.5330000+00:00","Yes because here in Indonesia, the strongest currency for a politician is trust. If you're wrong, trust is broken.","",""
"605452468284817427","buzzer9229","2025-06-27T16:09:37.0630000+00:00","Obv","",""
"474936118786129940","perantau98","2025-06-27T16:09:42.7700000+00:00","Damn","",""
"605452468284817427","buzzer9229","2025-06-27T16:09:47.8270000+00:00","Westminster culture bleeds into Malay life","",""
"605452468284817427","buzzer9229","2025-06-27T16:10:17.2830000+00:00","Indonesia sees its leaders as demigods
Malaysia sees its leaders as managers","",""
"474936118786129940","perantau98","2025-06-27T16:10:31.4900000+00:00","Yeah, we won Cambridge and Oxford uni debate championships once.","",""
"605452468284817427","buzzer9229","2025-06-27T16:10:50.3090000+00:00","Indonesia, if you're wrong you are immediately untrustworthy. This is why I am seen as untrustworthy because a lot of people think my takes are wrong.","",""
"474936118786129940","perantau98","2025-06-27T16:11:13.4030000+00:00","Malaysia except Kelantan. But our religious politicians are not as dumb as Gus and Habibs in Indonesia.","",""
"474936118786129940","perantau98","2025-06-27T16:11:26.2360000+00:00","I see","",""
"605452468284817427","buzzer9229","2025-06-27T16:11:31.4580000+00:00","Gus and Habibs aren't politicians bro","",""
"605452468284817427","buzzer9229","2025-06-27T16:11:40.9890000+00:00","Some Gus and Habibs are","",""
"605452468284817427","buzzer9229","2025-06-27T16:12:02.4590000+00:00","They distrust Indah too cause she sees her takes as wrong","",""
"605452468284817427","buzzer9229","2025-06-27T16:12:26.0160000+00:00","And nobody wants to correct us publicly because they don't really see it as *factually* wrong but more *morally* wrong","",""
"474936118786129940","perantau98","2025-06-27T16:12:43.3190000+00:00","Understood, sorry maybe I didn’t mean politicians but politically motivated preachers and their religious party reps. They are dumb and command influence. But your Gus and Habibs are next level.","",""
"474936118786129940","perantau98","2025-06-27T16:13:29.0870000+00:00","Ahhh, morally wrong is tough to combat. The crowd in Indonesia ain’t that forgiving?","",""
"605452468284817427","buzzer9229","2025-06-27T16:13:53.7580000+00:00","Ok so here's why me and Indah's takes are seen as morally wrong in Indonesia","",""
"474936118786129940","perantau98","2025-06-27T16:14:23.7700000+00:00","What happened to innocent till proven guilty or a good old debate bro who will just say you’re wrong and show his take and why? Sort of a dialogue.","",""
"474936118786129940","perantau98","2025-06-27T16:14:46.6570000+00:00","I’m listening, through my eyes.","",""
"474936118786129940","perantau98","2025-06-27T16:17:44.7250000+00:00","Really hope that one day Buzzer can collab with these 2.","https://cdn.discordapp.com/attachments/1349057306624790609/1388191582817095690/IMG_5385.jpg?ex=69968ee8&is=69953d68&hm=2e77678af95b5978134250d8574d1a511a4715fec09b4c53c1b630e0e9a476f7&",""
"474936118786129940","perantau98","2025-06-27T16:18:43.6870000+00:00","Khairy Jamaludin, guy on the left as Minangkabau roots.","",""
"605452468284817427","buzzer9229","2025-06-27T16:18:45.8970000+00:00","-Indah's takes are based on Californian liberal thinking (despite Indah being a left leaning libertarian not liberal) which is very incompatible with Indonesian society. Her takes disrupts religion, social mores, tradition and even modesty. It offends Indonesian morality but many Indonesians know its one of Indonesia's problems.
-My takes are rooted on authoritarian technocratic lens (think LKY, Mahathir, FDR, Deng), which invariably stamps democracy and many disrupts many groups, which could create discord in a harmonious Indonesian society. My viewpoints are considered forceful, replacing trust, democracy and the interpersonal element of Indonesia.","",""
"474936118786129940","perantau98","2025-06-27T16:20:15.2540000+00:00","Which I think, your take is right for Indonesia. Indonesia works best under an authoritarian and not under democracy like how the West wants us to be.","",""
"605452468284817427","buzzer9229","2025-06-27T16:20:39.5460000+00:00","Many people know that our way of thinking is consistent and factual, rooted on concerns over Indonesian issues, it's just the way we approach Indonesian problems feels wrong for Indonesians despite it being a way:
-Many people are not ready of Indah's Western approach
-Many people question the sincerity of my authoritarian approach","",""
"605452468284817427","buzzer9229","2025-06-27T16:20:55.2000000+00:00","Idk about that, Indonesians are allergic and traumatized over authoritarianism","",""
"605452468284817427","buzzer9229","2025-06-27T16:21:00.2330000+00:00","Due to Soeharto remember","",""
"605452468284817427","buzzer9229","2025-06-27T16:21:25.2730000+00:00","My takes basically would take Indonesia back to what they fear will happen","",""
"474936118786129940","perantau98","2025-06-27T16:21:36.0910000+00:00","I think Soeharto was a necessary evil.","",""
"474936118786129940","perantau98","2025-06-27T16:22:19.4910000+00:00","But he didn’t finesse properly. Plus hogging too much wealth when he could focus on redesigning Indonesian Industrial policies.","",""
"605452468284817427","buzzer9229","2025-06-27T16:22:41.1560000+00:00","Well in order to progress society you need to disrupt things right","",""
"605452468284817427","buzzer9229","2025-06-27T16:22:48.6460000+00:00","Sometimes demographies that are there are no longer ther","",""
"474936118786129940","perantau98","2025-06-27T16:22:51.3020000+00:00","I know for a fact that Indonesia, like Iran, can produce mass scale cheap drones.","",""
"605452468284817427","buzzer9229","2025-06-27T16:22:57.3800000+00:00","Indonesia is really afraid of disruption","",""
"605452468284817427","buzzer9229","2025-06-27T16:23:26.3340000+00:00","And me and Indah both of our takes bring disruption into Indonesia, which is why a lot of people consider our takes untrustworthy","",""
"474936118786129940","perantau98","2025-06-27T16:24:35.1730000+00:00","Ngl, it also won’t fly well in Malaysia if you start touching on Islam, the racial harmony and the royal institutions. But, you can have civil discussions and debates a lot of the times.","",""
"474936118786129940","perantau98","2025-06-27T16:26:23.6400000+00:00","Malaysians still has that fear in them, but, we are beginning to open up and the Economist started to view us as a maturing democracy despite on the ground racial and religious propaganda is still being played like a cherokee drum in the middle of a marching parade.","",""
"474936118786129940","perantau98","2025-06-27T16:27:57.3650000+00:00","Unlike Singapore, Malaysia has more democratic freedom.","",""
"605452468284817427","buzzer9229","2025-06-27T16:33:30.8320000+00:00","Malaysia is a maturing democracy","",""
"474936118786129940","perantau98","2025-07-05T00:54:59.5760000+00:00","Happy 4th of July","",""
"892623309437542451","johnthesentientautomobile","2025-07-05T08:12:48.7610000+00:00","I've finally done it","",""
"892623309437542451","johnthesentientautomobile","2025-07-05T08:12:50.4850000+00:00","https://www.instagram.com/reel/DLe-laHJK1P/?igsh=bWE3cHBlZHBtaTlu","",""
"892623309437542451","johnthesentientautomobile","2025-07-05T08:13:06.8190000+00:00","I have found the cringiest Instagram user in Malaysia","",""
"892623309437542451","johnthesentientautomobile","2025-07-05T08:13:39.2380000+00:00","This little punk posts one of those ""sigma male grindset"" content","",""
"892623309437542451","johnthesentientautomobile","2025-07-05T08:13:53.9950000+00:00","But people can't stop making fun of his accent","",""
"474936118786129940","perantau98","2025-07-11T15:23:42.3300000+00:00","Yesterday, Mahathir turned 100","",""
"605452468284817427","buzzer9229","2025-07-11T19:31:45.6180000+00:00","i know","",""
"605452468284817427","buzzer9229","2025-07-11T19:31:50.0260000+00:00","insane how old this guy is","",""
"605452468284817427","buzzer9229","2025-07-11T19:31:54.8790000+00:00","outlived every peer","",""
"1268106650200444992",".sirmuda","2025-07-12T02:59:20.9160000+00:00","Bro outlived lizzie II","",""
"1268106650200444992",".sirmuda","2025-07-12T03:55:58.1580000+00:00","Wake up everyone. Some Government members have intervene in this server","",""
"474936118786129940","perantau98","2025-07-12T04:36:25.4830000+00:00","Wanna visit his legacy project in Putrajaya to give a glance on what IKN will look like?","",""
"973225500073926666","raden_patah.","2025-07-12T05:43:56.5000000+00:00","@Melayunesian [2020-2025]🪦","",""
"741102379054792756","indonesien.","2025-07-12T05:45:47.7490000+00:00","?","",""
"741102379054792756","indonesien.","2025-07-12T05:45:58.5210000+00:00","Putrajaya looks better af","",""
"741102379054792756","indonesien.","2025-07-12T05:46:10.0610000+00:00","What a legend","",""
"474936118786129940","perantau98","2025-07-12T06:19:06.2450000+00:00","@Melayunesian [2020-2025]🪦 @Raden","https://cdn.discordapp.com/attachments/1349057306624790609/1393476747722358875/IMG_5653.png?ex=6996029a&is=6994b11a&hm=e5b26dd77b33c6dc88e02c380edc1fccacc5cec6280cbbc548e49ed249f2a240&",""
"474936118786129940","perantau98","2025-07-12T06:22:19.4200000+00:00","Mengeluh sukma luar biasa,
Pelangi kalbu mengenang rindu,
Merawat duka deruan rasa,
Pelangi seteru jalanlah aku.","",""
"741102379054792756","indonesien.","2025-07-12T06:36:16.4210000+00:00","Lmao","",""
"605452468284817427","buzzer9229","2025-07-12T06:58:28.4620000+00:00","he says turning 100 made him a bit scared","",""
"605452468284817427","buzzer9229","2025-07-12T06:58:56.3350000+00:00","Idk if this is a blessing for him to be able to live long enough to see Malaysia prosper","",""
"605452468284817427","buzzer9229","2025-07-12T06:59:10.5550000+00:00","Or a curse, living long enough to suffer more and more","",""
"1268106650200444992",".sirmuda","2025-07-14T03:09:39.6240000+00:00","","https://cdn.discordapp.com/attachments/1349057306624790609/1394153848334979133/Screenshot_2025-07-14-11-09-15-92.jpg?ex=69967ef3&is=69952d73&hm=cc45b7e5266f346ad422abc043b860c38145ae3ccbea4d4c07f707805202cb02&",""
"741102379054792756","indonesien.","2025-07-14T12:54:50.1260000+00:00","Bruh what","",""
"474936118786129940","perantau98","2025-07-14T23:20:53.9200000+00:00","Can’t beat this alpha.","https://cdn.discordapp.com/attachments/1349057306624790609/1394458665871741099/v14044g50000d1nnqsnog65t3c3o4pg0.mov?ex=69964955&is=6994f7d5&hm=23302074b42241dd0bc3b971da03ece8eee02dba27ee72522acc03761a90000e&","🔥 (1)"
"741102379054792756","indonesien.","2025-07-16T12:41:11.6160000+00:00","Mahatir?","",""
"741102379054792756","indonesien.","2025-07-16T12:41:20.5520000+00:00","My man","",""
"741102379054792756","indonesien.","2025-07-16T12:41:28.6800000+00:00","Panjang umur 🙏🏻","",""
"741102379054792756","indonesien.","2025-07-18T12:01:08.4170000+00:00","Assalamualaikum","",""
"741102379054792756","indonesien.","2025-07-18T12:01:19.8890000+00:00","To y'all Malaysians.....","",""
"741102379054792756","indonesien.","2025-07-18T12:01:31.0750000+00:00","Which states y'all live?","",""
"474936118786129940","perantau98","2025-07-20T04:24:23.3950000+00:00","Negeri Sembilan","",""
"474936118786129940","perantau98","2025-07-20T04:24:43.8320000+00:00","Today I discovered that there are Batak and Sunda Malaysians.","",""
"741102379054792756","indonesien.","2025-07-21T00:39:32.6750000+00:00","I see","",""
"741102379054792756","indonesien.","2025-07-21T00:39:51.9120000+00:00","One of your ministers is an example","",""
"474936118786129940","perantau98","2025-07-21T02:59:57.8630000+00:00","Mandailing, not Batak","",""
"474936118786129940","perantau98","2025-07-21T03:00:24.3740000+00:00","My grab rider is a Muslim Batak with Harahap as his surname.","",""
"892623309437542451","johnthesentientautomobile","2025-07-22T09:55:40.9200000+00:00","Hari Sarawak guys","",""
"741102379054792756","indonesien.","2025-07-22T23:06:24.5730000+00:00","I thought Mandailing were a sub-ethnic of the Batak ppl?","",""
"474936118786129940","perantau98","2025-07-22T23:13:40.7100000+00:00","U do know many Mandailing won’t admit to that.","",""
"741102379054792756","indonesien.","2025-07-22T23:20:35.9660000+00:00","I had 2 Mandailing friends but he doesn't mind if he was known being Batak","",""
"741102379054792756","indonesien.","2025-07-22T23:20:36.7580000+00:00","Also","",""
"741102379054792756","indonesien.","2025-07-22T23:21:09.7500000+00:00","Ever heard Raditya Dika? The Indonesian Comedian, and novelist?","",""
"474936118786129940","perantau98","2025-07-22T23:22:16.2410000+00:00","No, just say what you want bro","",""
"741102379054792756","indonesien.","2025-07-22T23:22:30.5980000+00:00","Ah well","",""
"741102379054792756","indonesien.","2025-07-22T23:23:02.0190000+00:00","Yea. Same. He's more like, proud for being called ""Batak"" while he was a Mandailing","",""
"474936118786129940","perantau98","2025-07-22T23:23:26.1960000+00:00","","https://cdn.discordapp.com/attachments/1349057306624790609/1397358408033898577/IMG_5864.png?ex=699649ee&is=6994f86e&hm=de220f2c737ba3b50242747109bd6f3d032bbba28bc64955c93151f957fe41e0&",""
"741102379054792756","indonesien.","2025-07-22T23:24:15.8210000+00:00","Oh this","",""
"474936118786129940","perantau98","2025-07-22T23:24:37.9700000+00:00","But that is beside the point actually, other than Mandailing, I don’t see any other Batak sub-ethnic group like actual Malaysian Bataks","",""
"741102379054792756","indonesien.","2025-07-22T23:25:47.8830000+00:00","Somehow Batak ppl *esspecially Christians* really felt pride about their ethnic heritage unlike the muslims. And even they saw Muslims ""isn't equal"" towards Christian Batak","",""
"474936118786129940","perantau98","2025-07-22T23:28:24.9290000+00:00","Mhmm","",""
