AuthorID,Author,Date,Content,Attachments,Reactions
"691626449743904810","lotso125","2025-11-21T07:16:29.6610000+00:00","I'm aware that i do enjoy many things and i want to yap more in this channel, so.... yeah cool thx","https://cdn.discordapp.com/attachments/1441326388891226122/1441326389230829650/yapping.jpg?ex=6996100d&is=6994be8d&hm=bb9b084cce3e8469f965f6107d50b79ef7295a429ad7f0870764a4073a5daa17&","❤️ (10)"
"265355459454566402","shiawase6946","2025-11-21T07:21:54.8680000+00:00",":paham:","",""
"891545423238537236","murzzbow","2025-11-21T07:27:57.0130000+00:00","","https://cdn.discordapp.com/attachments/1441326388891226122/1441329271644754010/20251120_175633.jpg?ex=699612bc&is=6994c13c&hm=aa9a1ac1e2b8a4161a6e11b31188f7e0eb73b1f907cff43cfc43e3a932cc4940&","💀 (1)"
"691626449743904810","lotso125","2025-11-21T07:32:58.2310000+00:00","I actually hate Acme De La Vie (ADLV), and its all because of those ugly ahh obnoxious ahh bear graphic in the front of the t-shirt type of things. Pertama kali gue melihat ADLV itu maybe di sosmed, and that time, ADLV lagi viral banget di korea. i saw those bear pictures on those tees and all i know is that i hate their design. apa ya... JELEK aja gitu? seems to be very lazy with the design and really have no artistic value in my eyes. one way to another, ADLV mulai masuk indonesia and i do still hate it at that time lol. harganya pun gabisa gue justifikasi, because like wdym 1 kaos ADLV harganya bisa nyentuh 1 million???? crazy asf. this hatred juga mulai menyebar di pertemanan gue bcs i always told em about HOW I HATE THIS SPECIFIC BRAND, dan how all my friends always joking around buying their tees for me

HOWEVER, tiba-tiba beberapa bulan lalu w melihat collaboration between ADLV and gundam, and it's DOPE ASF???? like, HOLUP NOW ADLV I DUNNO U CAN BE COOL LIKE THIS? like, i saw all of the articles of the collab and i must say, i'm kinda tempted to buy one of them joints. its not tacky at all, the brand logo doesn't interfere with the gundam design, and C'MON NOW ITS GUNDAM?????? THAT SHID COOL ASF!

This collab actually makes me look at ADLV in different light, since they could pull a drip like this. even though i still hate their actual design and/or basic tees, i do rate this collab highly and let's see if ADLV can justify their price tags again with another collaborations like this one.","https://cdn.discordapp.com/attachments/1441326388891226122/1441330534406946816/25FW-TP-ZP-CO-GDU-BLK6.webp?ex=699613ea&is=6994c26a&hm=13c977c7a818833900148e4f426366a8e959b496a646a8a20e91fece4ff7fd6a&",""
"691626449743904810","lotso125","2025-11-21T07:36:23.6670000+00:00","Changed the channel name: Lotso Menyukai ini","",""
"1064369916351889448","fellowmen","2025-11-21T08:39:00.4880000+00:00","if you like ADLV, then may i suggest you aime leon dore? it is a good brand","",""
"691626449743904810","lotso125","2025-11-21T08:56:24.4370000+00:00","i will say, aime leon dore is also basic bcs most of their designs is just the logo itself (ofc with the infamous uncommon colourways but thats not the point lol) but their design and concepts is just very classic, with a clean model and good fabrics as well, in which i can't say the same about ADLV. i've tried wearing both (not buying ofc) and ADLV shirt feels like a cheap garment u can get at tukang sablon konveksi, whch doesn't reflect their price tags. thats why i hate the brand. the only thing that makes me think twice abt ADLV is their collab with gundam lol.

oiya for aime leon dore, i want ur jordans x ALD but not the jordan 2 pls thx","",""
"1064369916351889448","fellowmen","2025-11-21T08:56:54.3710000+00:00","ALD x NB is nice too","",""
"1064369916351889448","fellowmen","2025-11-21T08:57:07.7670000+00:00","how about Kith?","",""
"1064369916351889448","fellowmen","2025-11-21T08:57:19.5480000+00:00","Kith is nice","",""
"1064369916351889448","fellowmen","2025-11-21T08:57:47.1640000+00:00","the way they do marketing is pretty superb","",""
"691626449743904810","lotso125","2025-11-21T09:00:09.5900000+00:00","KITH is always a good thing to look at, especially their collaborations with sport teams and organizations like NBA and MLB. Ronnie really tried and successfully combine daily fits with peoples interest but make it subtle/ ""gak norak"" i'd say. really good execution everytime and i have no complaints towards the brand","",""
"1064369916351889448","fellowmen","2025-11-21T09:00:26.5440000+00:00","you know your things lotso","",""
"1064369916351889448","fellowmen","2025-11-21T09:00:44.6550000+00:00","how about neighborhood, or maybe japan fashion subculture","",""
"691626449743904810","lotso125","2025-11-21T09:01:32.4810000+00:00","same goes to the marketing. i guess they stay true to their culture as ""street wear"" instead of trying so hard to be a ""luxury"" things people didn't wanna see. that's why they're successful in the communities and brands like palace and supreme tried their marketing strategies. they do benefitted from that tho","",""
"1064369916351889448","fellowmen","2025-11-21T09:01:59.4440000+00:00","Palace x Docmarts juga a sight to see ga sih?","",""
"1064369916351889448","fellowmen","2025-11-21T09:02:52.8200000+00:00","luxury street wear is a thing tho","",""
"691626449743904810","lotso125","2025-11-21T09:02:55.2310000+00:00","yup. im actually talking abt those joints as well lmao. i knowwww palace is a skateboard brand, but the way that they're executing the docmart collab is AMAZING. their articles are creative and fresh. great job fr","",""
"691626449743904810","lotso125","2025-11-21T09:04:29.9780000+00:00","it is, but i guess people these days want those items to be separate. we saw brands like fendi x pokemon or LV x supreme did well on the market. but nowadays brands like Fear of God or Amiri suffers from the brandings bcs its hard to place them on either box juga. cmiiw","",""
"1064369916351889448","fellowmen","2025-11-21T09:05:05.3510000+00:00","do you hunt on stockx lotso?","",""
"691626449743904810","lotso125","2025-11-21T09:09:35.3540000+00:00","eh, i'd say japanese brands do their own things and every brands are different from one another. they have their own niche, community, and market that will and should be separated from western street brands. susahnya untuk kategorisasi brand jepang tuh cuma karena how diverse they are, dan lebih banyak brand kecil yang thriving daripada brand besar. how many people u know are talking abt shids like hysteric glamour or visvim or beams? it's not bcs they're unpopular, tapi karena mereka kurang exposure dan wanna keep it that way. maybe one of the more famous japanese brand di barat tuh sesuatu kaya BAPE family, issey miyake and Y3? lemme know if im wrong tho","",""
"691626449743904810","lotso125","2025-11-21T09:09:54.5110000+00:00","HAHAHAHAHAHA NGGAAAA i dont hv the patience and money unfortunately lol","",""
"1064369916351889448","fellowmen","2025-11-21T09:12:52.9910000+00:00","we will see lotso","",""
"691626449743904810","lotso125","2025-11-21T09:13:03.9300000+00:00","wdym lol","",""
"1064369916351889448","fellowmen","2025-11-21T09:13:05.4780000+00:00","spill your loots here if you find it","",""
"691626449743904810","lotso125","2025-11-21T09:13:33.7910000+00:00","i guess i will in the future. i don't rly like to talk abt my grails like that but we'll see lol","",""
"691626449743904810","lotso125","2025-11-21T09:13:51.8630000+00:00","gaboleh pamer kak dosa 🙏","",""
"691626449743904810","lotso125","2025-11-21T09:13:57.1260000+00:00","wkwkwk","",""
"1064369916351889448","fellowmen","2025-11-21T09:14:06.6880000+00:00","bukan pamer","",""
"1064369916351889448","fellowmen","2025-11-21T09:14:23.3250000+00:00","tapi memotivasi mabased server biar fashion sense dipertajam","",""
"1064369916351889448","fellowmen","2025-11-21T09:14:29.3260000+00:00","kan loots","",""
"691626449743904810","lotso125","2025-11-21T09:15:07.5750000+00:00","WKWKWKWKWK paham","",""
"691626449743904810","lotso125","2025-11-21T09:15:25.7420000+00:00","so far the intentions of the forum cuma buat jadi ""tong sampah"" w ajasih","",""
"691626449743904810","lotso125","2025-11-21T09:15:38.7650000+00:00","bcs i do wanna talk abt weird things i found fascinating lol","",""
"1064369916351889448","fellowmen","2025-11-21T09:15:47.9530000+00:00","aman","",""
"1064369916351889448","fellowmen","2025-11-21T09:16:02.5810000+00:00","i will be watching you losto, show your loots","",""
"691626449743904810","lotso125","2025-11-21T09:16:10.6230000+00:00","wkwkwkwkwkw one day","",""
"691626449743904810","lotso125","2025-11-22T03:23:30.3120000+00:00","NFL Scorigami: taking scorekeeping to another level.

So.... I stumbled upon this thing when I was researching about how much different variation you can get from every NFL game, and this happened because NFL have a different points depending on how you score on the game. For those of you that didn't know, there are different points that u can get in a game, such as 6 point for touchdown, 3 for field goal/kicking, and 1 point for successful kick after a touchdown. From various combinations, we can deduct on how popular certain score is, and which score is not as popular.

Scorigami itself  is a concept thought up by American Journalist and Humorist Jon Bois. It is the art of building final scores that have never happened before in NFL history. Due to the unique nature of how points are scored in American Football, where it is impossible to score 1 point on its own, as well as the rarity of the 2 point safety and 8 point touchdown and 2 point conversion, there are a lot of scores that are possible, but have never happened.

After I know all about scorigami, I started to check the website, reddit thread, and social medias regarding is there any updates toward the scorigami. I remember the last updates to the scorigami is on November 16, 2025 when the Buffalo Bills win against Tampa Bay Buccaneers with the score of 44 - 32.  When I saw the recent update to the scorigami, I feel... hyped(?) for no reason. I feel like scorigami in a way is just another type of collectibles, since you can never guess and predict the outcome of the game. There are more ""common"" scores like 20 - 17, which occurred like 298 times and 27 - 24 that occurred 240 times, but yeah there are also some ""rarer"" scores and unique/SSR games that only happened once in a lifetime (for now) that just add more layer to scorigami itself. All and all, I like scorigami, collecting things are cool, and NFL please ban tush push ❤️","https://cdn.discordapp.com/attachments/1441326388891226122/1441630142899421236/518384214_10172561320770271_4908495346655839254_n.jpg?ex=69968232&is=699530b2&hm=8b9230c511905a55793157bd94193a06ccf995b2bdc065ac8b30cdc99f149899&",""
"691626449743904810","lotso125","2025-11-23T16:40:45.7910000+00:00","I've done my research, and i present you: the most european non-european countries.

basically, it's a list of countries that not particularly  a part of or a member of european union, but they're participating in a lot of things that ties to european politics and cultures (yes it's pointless but bear with me pls). some of the reason why these countries are participating in european thingy is because they want to join some better league, or the big boy league bcs they feel like they could be profited or compete on a higher level. institutions like Council of Europe (CoE) is open for countries outside of EU as long as they're following EU's protocol about various things such as human rights and contributions to the institutions. they could be an observer countries or actively helping to the cause of CoE itself. 

other things like the UEFA Champions League (UCL) and Eurobasket also open for countries that want to join, and thats why countries like Israel and teams like Fenerbache can compete to win UEFA trophies. a lot of times they join UEFA or European Sport League because they feel like ""too good"" in their own region and/or rejected from the said region. all and all, a lot of these countries are trying to fight because these trophies seems to be more ""prestige"" and cool (?) by default.

Without further ado, this is the list of those said countries. lemme know if there are any wrong input or things that could be added. thankyou!","https://cdn.discordapp.com/attachments/1441326388891226122/1442193167708324052/image.png?ex=6996944d&is=699542cd&hm=fe55f90092bf1ffb18e7b142c4ccb5178be51936c63229e2aa441e8158097485&",""
"1327306698838245499","k1mcchii","2025-11-24T00:33:47.9850000+00:00","Kazakhstan being not invited to the function is crazy 🥀","",""
"691626449743904810","lotso125","2025-11-24T04:23:31.2990000+00:00","lho padahal kan daftar tinggal daftar saja (kalo kuat lawan real madrid)","",""
"691626449743904810","lotso125","2025-11-24T15:01:18.4960000+00:00","dad shoes are great not because they're comfortable, but also because their silhouettes are sick af. lemme explain.

so for a couple of months now, i've been obsessed with chunky shoes or ""dad"" shoes. i personally think that they always looks cool in a flawless, effortless way. i do also find how easy it is to mix and match dad shoes to my usual outfits. even though a lot of people also points out things like ""Y2K aesthetics"" and ""boomer vibes"" with the shoes, me personally looks at it in a nostalgic way, how a lot of older streetwear and brands used to create a lot of shoes with this type of silhouettes as well. it keep reminds me of the day where yeezy drops are a hype and a moment of itself, and also the core foundation of skateboarding culture as well, since a lot of skateboard shoes are also chunky.

but i do have some ick about those chunky shoes, especially when they're overdoing it. what i mean is silhouettes that just didn't make any sense and just ugly to begin with. i'm talking about FILA Disruptors, Converse Run Star Motion, UGGs, and those pink Crocs Clogs. wdym they deserve a spot in a chunky shoes tier? in the world where Yeezy 700 and NB 990 exist, i don't think that they belong in the same ""genes"". i do agree that those shoes are chunky af and also gives u some height, but chunky shoes is not always about that. chunky shoes (despite being called ugly shoes) is a culture of its own, have their old-school silhouettes, and also need to give you those ""nostalgic"" feelings when ur wearing it, so if your favorite shoes are listed before, sorry to say that they're not a chunky/ dad shoes in my book.

all and all, i'll say that dad shoes are great, not every chunky shoes can be categorized into dad shoes, and i hate and love you kardashians to popularized this style of shoe ❤️ .

my top 5 of dad shoes (rn):
- Adidas Ozweego
- Nike Vomero
- Asics Gel Kayano 14 (and jjjjound collab!)
- Yeezy 700 & 500
- NB 1906R, 2002R, and 530 (hehe i can't choose)","https://cdn.discordapp.com/attachments/1441326388891226122/1442530526421581865/2_98926493-e333-47d0-920a-783ae365d501.webp?ex=69967cfe&is=69952b7e&hm=4936fe2d5e73fee46e5ae11d49dc2832dbcfc5f589d9330c4f0420e96810910a&",""
"563984376585781268","rsnz09","2025-11-24T15:08:50.7900000+00:00","mmm gel kayano","","🔥 (1)"
"563984376585781268","rsnz09","2025-11-24T15:10:39.6330000+00:00","anti yearning yearning club","",""
"425585007906783232","gksubrata","2025-11-26T04:41:33.6340000+00:00","@Lotso thoughts on the new ronaldinho tiempo sneakers","",""
"691626449743904810","lotso125","2025-11-26T04:51:25.5480000+00:00","okee nanti w ketik ya","",""
"691626449743904810","lotso125","2025-11-28T07:33:45.2470000+00:00","sbb abis cuti sakit but here goes

1. even though this is the 3rd time nike re-released the ronaldinho tiempo, you can always feel the subtle difference in between every release. for this 2025 release, you get the small chain with the ""R"" lace jewel. other subtle design is the gradient on the midsole and studs and also metallic gold swoosh, which really makes this shoe feels more special in every way.

2. they also create the lifestyle version of the shoe, which is very dope. although i must say, i **do** aware that people who bought the lifestyle version often wear that joints to small cafes in menteng and listening bar in senopati, but everytime nike or other shoe brand make a lifestyle version out of their football cleats, its always a pleasure to see. example: T90 silver bullet (yes no more explanations thx). so yeah.... other than ""oooohhh its not the true habitat of the shoes"" i have nothing more to say regarding how cool the lifestyle version is.

3. this shoes is re-released once every 10 years (dated back to 2005). idk how many times nike will re-release this tiempo again, but if ur thinking abt getting this shoes, i suggest get it now bcs u'll never know when nike will re-released it again in the future.","",""
"691626449743904810","lotso125","2025-11-30T05:20:53.5690000+00:00","because of me getting bedrest for some days, i realized that i missed some of lego's older, own franchises.

i collect various types of legos since i was a little kid, and i remember those days where lego have their own franchises that is unique and also very cool to see, such as Bionicles, Hero Factories, Power Miner, and Mars Missions. these days, the only lego's franchise that still kinda survived is the ninjago franchise which, isn't that bad in my opinion, but probably bcs it's not there when i was a little, i have little to no interest for that specific franchise. these days if we're talking about legos, we all can agree that its getting more realistic as they taken more realistic license like the monalisa, fender (the guitar brand), and nintendo. those collab isn't bad at all, but sometimes i just missed my old franchises y'know? those janky-wasteland robot look that bionicle, or the mecha/zoid look of the hero factories is also very eye-catching for me, even till this day. 

basically, the short reason why lego are discontinuing those franchises is because the re-launch for it are flopped. the other reason why is because lego didn't want to make another mold for their parts. since legos are made from plastic and molded with a machine, every piece have their own unique mold. if they want to create another ""unique"" molds like what they do to bionicle parts like their head, torso and feets, they need to spend more money just to create a unique mold for (almost) every part, and its not good economically. lego also share that they always trying to put existing mold/shape into sets and trying to be as unique as possible. thats why u can found sausage shape in titanic set, frog in sakura tree set, and lego hat in cactus set. lego also trying to commit to long term sustainability project starting in 2024, by choosing more sustainable materials, use recyclable packaging, and reduce greenhouse emission.","",""
"691626449743904810","lotso125","2025-11-30T05:21:00.7980000+00:00","all and all, thats why the old franchises is not gonna be back sooner or later. i do hope that one day there'll be some way to ""revive"" the old sets, but for now, im gonna collect my money to buy the nissan skyline or the S2K set *sigh*","",""
"563984376585781268","rsnz09","2025-11-30T07:26:25.5220000+00:00","bionicles 🔥","",""
"691626449743904810","lotso125","2025-12-01T07:39:41.8220000+00:00","benar","",""
"691626449743904810","lotso125","2025-12-01T09:08:30.7490000+00:00","Adidas NMD is the start of sneaker craze for my generation, and it was cool for that moment. i remember back in 2015 when adidas put us in a chokehold when they dropped both Adidas NMD in the original red and blue, and also dropping the triple white ultra boost. the resell price of NMD itself is also wild, since i remember this dude on Instagram bought the shoe from a reseller for 1000 USD, bcs it was THAT hype. after the initial hype itself, adidas also dropped more color for the NMD, but the OG still the one sticks in my memory like a sore thumb. it was that good at that time. one thing that adidas failed to foresee about the NMD craze is that:

1. the hype was there, but the second drop for the OG colorway takes too long and ppl already moving on to another trend
2. adidas didn't create ""scarcity"" for the drop, making sure that everyone can get a pair and didn't qualify it as a ""grail"" on their second drop.
3. other brand (specifically air jordan) already crowned as the goat shoe brand at that time, and adidas couldn't compete with that.

Adidas eventually drop the second silhouette for NMD with the OG color and everything, but it was too late (and the silhouette is ugly too imho). sneakers already becoming a bigger market and Nike is leading far and beyond with other hits like Air Jordan 11 ""Space Jam"" or even Nike Kobe 6 ""The Grinch"". All and All, rest in peace NMD. you were the hype shoes fore father in my generation.","https://cdn.discordapp.com/attachments/1441326388891226122/1444978457552621578/102738_01.jpg.webp?ex=69962a4e&is=6994d8ce&hm=54604282e1fbfdcf1e6c2d5d15e387f10f87a1208a39283c369e9ab39c91a60f&",""
"563984376585781268","rsnz09","2025-12-01T09:37:23.6610000+00:00","temenku pas smp jirr","",""
"563984376585781268","rsnz09","2025-12-01T09:37:28.9270000+00:00","NMD sama ultraboost","",""
"691626449743904810","lotso125","2025-12-01T09:38:04.1870000+00:00","ikr. it was the IT shoes of the 2015s","",""
"691626449743904810","lotso125","2025-12-01T09:38:11.9050000+00:00","bro must be him back in the day lmao","",""
"563984376585781268","rsnz09","2025-12-01T09:38:13.6610000+00:00","so real","",""
"563984376585781268","rsnz09","2025-12-01T09:38:21.7910000+00:00","horkay jirr","",""
"691626449743904810","lotso125","2025-12-01T09:40:34.1720000+00:00","even in indonesia, i remember both NMD and ultra boost were priced almost at 3 million or smth. it wasnt cheap lmao","",""
"563984376585781268","rsnz09","2025-12-01T09:40:48.1560000+00:00","tul","",""
"425585007906783232","gksubrata","2025-12-01T10:10:08.2420000+00:00","Spongebob stan smith

Thoughts?","",""
"563984376585781268","rsnz09","2025-12-01T10:10:34.0460000+00:00","would cop for shits and giggles","",""
"425585007906783232","gksubrata","2025-12-01T10:11:16.6220000+00:00","They actually look sick tho. It’s a simple black latex stan smith","",""
"563984376585781268","rsnz09","2025-12-01T10:11:43.5140000+00:00","id cop either of the 2 tbh","",""
"425585007906783232","gksubrata","2025-12-01T10:11:44.5230000+00:00","","https://cdn.discordapp.com/attachments/1441326388891226122/1444994369802342410/IMG_3106.webp?ex=69963920&is=6994e7a0&hm=bd0e2abeca7d356c7454950682a93f9ce87354b65df43bf72bb3a4a2ffdd89be&",""
"425585007906783232","gksubrata","2025-12-01T10:11:50.8930000+00:00","Looks so nice","",""
"563984376585781268","rsnz09","2025-12-01T10:11:55.6820000+00:00","clean","",""
"425585007906783232","gksubrata","2025-12-01T10:11:59.9110000+00:00","Asli","",""
"425585007906783232","gksubrata","2025-12-01T10:12:07.7610000+00:00","Brown shorts, white socks","",""
"425585007906783232","gksubrata","2025-12-01T10:12:19.6020000+00:00","Anchor ones with th red and blue lining","",""
"425585007906783232","gksubrata","2025-12-01T10:12:22.6590000+00:00","Would wear ngl","",""
"563984376585781268","rsnz09","2025-12-01T10:12:59.1740000+00:00","i think i could rock a oversized shirt and shorts with that shoes","",""
"563984376585781268","rsnz09","2025-12-01T10:13:04.7610000+00:00","or a hoodie + shorts","",""
"458504213203255324",".magurotuna","2025-12-01T10:16:24.7860000+00:00","omg    i want these so badly","",""
"425585007906783232","gksubrata","2025-12-01T10:16:53.8780000+00:00","Asli","",""
"691626449743904810","lotso125","2025-12-01T10:36:41.7530000+00:00","its a very realistic spongebob shoe","",""
"691626449743904810","lotso125","2025-12-01T10:36:46.5110000+00:00","its so whimsical","",""
"691626449743904810","lotso125","2025-12-01T10:36:53.8230000+00:00","i actually like it lmao","",""
"425585007906783232","gksubrata","2025-12-01T10:38:23.2020000+00:00","Then my follow up, do you know any other clothing brands that makes merch from actual shows that looks like the items in the show?

And i mean **not put a print of the show on the shirt** *rhem UNIQLO*","",""
"691626449743904810","lotso125","2025-12-01T11:00:43.6010000+00:00","i know a couple actually. here are some example of anime and brand collaborations that look just like what the character are wearing in the anime itself

- Nike Air Max 95 QS x Yu-Gi-Oh ""Joey Wheeler""
- Coach x Michael B Jordan ""Naruto"" collab (especially the pants and jounin jacket)
- Jimmy Choo x Sailor Moon (peep the red boots!)
- (not an official collab but the resemblance is uncanny) MSCHF ""Astro Boy"" Big Red Boots","",""
"691626449743904810","lotso125","2025-12-01T11:01:04.7290000+00:00","i think thats some of it that i could remember from the top of my head. lemme know if i missed any~","",""
"1064369916351889448","fellowmen","2025-12-01T12:46:52.4150000+00:00","How do you rate adidas megaride lotso?","",""
"691626449743904810","lotso125","2025-12-01T13:10:23.9810000+00:00","the midsole kinda reminds me to the nike shox tbh, and i guess it also have the same function as well. if the question is whether i like it or not, i'll say it feels like a cheap copy and i don't really like it lol.","",""
"691626449743904810","lotso125","2025-12-01T13:18:48.1780000+00:00","oh yea, i do love nike shox for some reason. especially the ricardo tisci, skepta, and martine rose collab","",""
"1327306698838245499","k1mcchii","2025-12-01T15:31:24.6580000+00:00","Waiter waiter!

1 rambling of “Lotso menyukai ini”","",""
"691626449743904810","lotso125","2025-12-01T15:32:24.5890000+00:00","TUNGGU BESOK YAH KAWAN KAWAN","",""
"691626449743904810","lotso125","2025-12-01T15:32:33.6070000+00:00","DAILY POST YA INI NIATNYA","",""
"1064369916351889448","fellowmen","2025-12-02T02:26:22.3470000+00:00","https://www.instagram.com/reel/DRrfNTbDGhK/?utm_source=ig_web_copy_link&igsh=NTc4MTIwNjQ2YQ==","",""
