AuthorID,Author,Date,Content,Attachments,Reactions
"983629435850854441","ukrainumedved","2025-04-03T23:51:21.0970000+00:00","So, if the government printed money, then give it to the people, but they would need to tax the people. So, it's like giving money, then taking money like how banks work, you zip some monney there, then take it when needed","",""
"983629435850854441","ukrainumedved","2025-04-03T23:52:12.0280000+00:00","This forum is more of a.... shower thought, so take this forum with a grain of salt.","",""
"753466051869802556","island_doge","2025-04-09T17:09:40.4520000+00:00","I mean what you explained is literally the fact","",""
"753466051869802556","island_doge","2025-04-09T17:13:50.4220000+00:00","Some has finally realized that the Bank is a sly business, but without it the economy plummets.","",""
"753466051869802556","island_doge","2025-04-09T17:16:54.5550000+00:00","Some people have said this, but i'm kinda neutral about this opinion. Whether it's good or bad, sometimes you need both of them to make nothing to be something","",""
"983629435850854441","ukrainumedved","2025-04-10T14:42:31.2690000+00:00","Ah.","",""
