AuthorID,Author,Date,Content,Attachments,Reactions
"753112518658097183","p3d_pilot","2025-05-25T14:03:56.7910000+00:00","","https://cdn.discordapp.com/attachments/1342873250354565150/1376199111682035802/IMG_20250524_135916.jpg?ex=69966f8c&is=69951e0c&hm=0885181b30a8ce5935cf30f733cc2a933e4e99da8e17ec2c0a90ee4f168fdeea&,https://cdn.discordapp.com/attachments/1342873250354565150/1376199111933562921/IMG_20250524_135932.jpg?ex=69966f8c&is=69951e0c&hm=f35cba1c16366c48c56a1ed88e1600181df8aac2486032a9f713f70d4596dbcc&",""
"753112518658097183","p3d_pilot","2025-05-25T14:04:40.8590000+00:00","Itasha F30 320i with Bronya and Itasha (I forgot what car) with Tohsaka Rin & Ishtar on the other side","",""
"736550209068335135",".ayab","2025-05-25T14:12:11.7380000+00:00","Aint no fuckin way!!!","",""
"736550209068335135",".ayab","2025-05-25T14:12:18.8330000+00:00","No ni","",""
"736550209068335135",".ayab","2025-05-25T14:12:20.9320000+00:00","No","",""
"736550209068335135",".ayab","2025-05-25T14:12:21.6150000+00:00","No","",""
"736550209068335135",".ayab","2025-05-25T14:12:22.3750000+00:00","No","",""
"736550209068335135",".ayab","2025-05-25T14:12:25.9100000+00:00","Wtf??!?!!+!","",""
"890070769089015808","tianhikari","2025-05-25T23:48:14.1890000+00:00","Are you quoting Kendrick Lamar or what","",""
"891545423238537236","murzzbow","2025-05-26T03:00:55.7390000+00:00","https://www.youtube.com/watch?v=w3383ELGuLs","",""
"766280136332410920","ekast237707","2025-05-26T04:30:47.1430000+00:00","This is a corpo... Sad","",""
"766280136332410920","ekast237707","2025-05-26T04:30:49.8480000+00:00","https://youtu.be/gFv2FQmZjLk?si=4M50lgmKjL-TfOEl","",""
"766280136332410920","ekast237707","2025-05-26T14:08:11.3810000+00:00","Tenkaichi Budokan itu di Bali, semua mangaka idola nya Akira Toriyama, Naruto, One Piece..","",""
"766280136332410920","ekast237707","2025-05-26T14:08:26.4140000+00:00","One Piece, We are, siapa kita? Indonesia","",""
"766280136332410920","ekast237707","2025-05-26T14:08:31.0040000+00:00","https://youtube.com/shorts/LXME-Nx4wqI?si=8OPTexUAgm5QisUC","",""
"580702177006190595","ashiapmanman","2025-05-26T14:54:07.8580000+00:00","it was good but NOT ANIME OF THE YEAR GOOD","",""
"580702177006190595","ashiapmanman","2025-05-26T14:54:20.0740000+00:00","crashouts should be allowed for today","",""
"736550209068335135",".ayab","2025-05-26T14:54:20.8540000+00:00","https://mangadex.org/title/e7a429d4-4273-4f38-b112-8c288bc74eaf/ikari-shinji-no-himegoto

@Leon","",""
"580702177006190595","ashiapmanman","2025-05-26T14:54:22.3100000+00:00","and today only","",""
"736550209068335135",".ayab","2025-05-26T14:54:44.3030000+00:00","Im still mad solo leveling won","",""
"891545423238537236","murzzbow","2025-05-26T14:54:58.6770000+00:00","ykw it's bad when gigguk is malding lmao","",""
"580702177006190595","ashiapmanman","2025-05-26T14:56:57.6470000+00:00","this might be the moment where garnt his years if monk training just because of sung jin woo aura farminv","",""
"143747199677890561","yo_yoji","2025-05-27T08:26:07.7270000+00:00","","https://cdn.discordapp.com/attachments/1342873250354565150/1376838872692035668/378341160_10223402914328399_1990339640796506757_n.jpg?ex=6996205f&is=6994cedf&hm=39d4b26e0f4a8478ee4b10663634a56932b0faaaaf1e33bc373c805c86e7d770&",""
"766280136332410920","ekast237707","2025-05-28T13:13:25.8990000+00:00","TSUNAMI Youtuber 🌊🌀","",""
"766280136332410920","ekast237707","2025-05-28T13:13:28.6880000+00:00","https://www.youtube.com/live/PqVTb9wkF5Y?si=thLC6VAT0tw50N2R","",""
"690886708207681576","azkaryhns.","2025-05-28T16:21:33.3500000+00:00","I wanna make a poll of something funny in this chat room","",""
"690886708207681576","azkaryhns.","2025-05-28T16:22:05.5620000+00:00","","",""
"690886708207681576","azkaryhns.","2025-05-28T16:23:04.7190000+00:00","Cuz I've seen some silly online discourse that says Code Geass is not a mecha anime while they're clearly fighting with robots","",""
"736550209068335135",".ayab","2025-05-28T16:29:01.4430000+00:00","Most gundams are just poltical thirller diguised as mech animes","",""
"736550209068335135",".ayab","2025-05-28T16:29:32.4850000+00:00","The only way to get a hold on the general public with your message i guess","",""
"1205583169428922401","f4rtl0rd","2025-05-28T16:34:14.1700000+00:00","I think that lots of mecha animes are politics but make it robots fighting","",""
"1205583169428922401","f4rtl0rd","2025-05-28T16:34:24.2380000+00:00","Oh yeah","",""
"690886708207681576","azkaryhns.","2025-05-28T16:37:34.8670000+00:00","Honestly, for Gundam, their Mecha name is so memorable and marketable so it kinda overshadowed the political scene 

Code Geass however, I can't even remember their Mecha names, only the stuff that's been going on in the series","",""
"765195078092062741","someforgottentoramers7670","2025-05-28T16:39:51.3170000+00:00","yeah,  some Popular Anime Mecha+Politics looks good as if a match in heaven even better than most Isekai+Politics  (I wonder why?)","",""
"736550209068335135",".ayab","2025-05-28T16:41:01.7990000+00:00","Then theres attack on titan","",""
"690886708207681576","azkaryhns.","2025-05-28T16:41:50.9720000+00:00","Maybe we're getting used to war with modern gadgets/vehicle therefore we think Mecha are a good war instrument in political scene and not horses and trinkets","",""
"1205583169428922401","f4rtl0rd","2025-05-28T16:42:04.4200000+00:00","Isekai + politics are good tho","",""
"736550209068335135",".ayab","2025-05-28T16:42:08.9290000+00:00","No","",""
"736550209068335135",".ayab","2025-05-28T16:42:20.1730000+00:00","Give me an example of ome good politics in isekais","",""
"1205583169428922401","f4rtl0rd","2025-05-28T16:42:23.2640000+00:00","Overlord politics are good","",""
"1205583169428922401","f4rtl0rd","2025-05-28T16:42:36.3260000+00:00","Skeleton magic king conquering the world","",""
"736550209068335135",".ayab","2025-05-28T16:42:36.8010000+00:00","No just. No","",""
"1205583169428922401","f4rtl0rd","2025-05-28T16:42:47.9040000+00:00","Through conspiracy & internal state manipulations","",""
"690886708207681576","azkaryhns.","2025-05-28T16:42:54.2670000+00:00","Tensura politics is kinda funny tho","",""
"1205583169428922401","f4rtl0rd","2025-05-28T16:42:58.5040000+00:00","Its a conspiracy theorist wet dreams","",""
"736550209068335135",".ayab","2025-05-28T16:43:01.2100000+00:00","Real","",""
"736550209068335135",".ayab","2025-05-28T16:43:17.6080000+00:00","Oh  i just remembered!!!","",""
"736550209068335135",".ayab","2025-05-28T16:43:22.5750000+00:00","Escaflowne!!!","",""
"1205583169428922401","f4rtl0rd","2025-05-28T16:43:44.7190000+00:00","How abt No Game No Life","",""
"690886708207681576","azkaryhns.","2025-05-28T16:44:41.5540000+00:00","Oh yeah almost forgot that NGNL is kinda a politic Anime","",""
"1205583169428922401","f4rtl0rd","2025-05-28T16:46:06.2920000+00:00","It is in a way","",""
"690886708207681576","azkaryhns.","2025-05-28T16:46:10.3420000+00:00","I haven't watched this one, isn't it also a Mecha anime?","",""
"736550209068335135",".ayab","2025-05-28T16:46:21.9720000+00:00","Wait yojou senki has a good politcs","",""
"765195078092062741","someforgottentoramers7670","2025-05-28T16:46:24.8900000+00:00","Good point, I do like how they do politics justice there, meanwhile politics in most Isekai looks like a wishy-washy way that mostly boils down to *In the end, the no matter how good those villains scheming in dark are, they are no match for our supposedly briliant and Op Isekai Mc!!*","",""
"736550209068335135",".ayab","2025-05-28T16:46:27.7880000+00:00","How can i forgot lol","",""
"736550209068335135",".ayab","2025-05-28T16:46:47.8520000+00:00","Yep, very old mecha isekai anime","",""
"736550209068335135",".ayab","2025-05-28T16:47:42.1170000+00:00","I just watch the anime to be pretentious lol","",""
"690886708207681576","azkaryhns.","2025-05-28T16:49:37.0780000+00:00","I almost stated that I can't hardly think of a Mecha anime that's just for fun and giggles

Then I remembered that Doraemon, in some way, is considered a mecha","",""
"690886708207681576","azkaryhns.","2025-05-28T16:50:21.2870000+00:00","And Cyborg Kuro-chan.... I think...","",""
"690886708207681576","azkaryhns.","2025-05-28T16:52:02.8300000+00:00","Astro boy is still political 
(Especially in Urasawa's Pluto)","",""
"736550209068335135",".ayab","2025-05-28T17:07:34.0010000+00:00","Keroro?","",""
"736550209068335135",".ayab","2025-05-28T17:07:48.4630000+00:00","Wait power ranger","",""
"690886708207681576","azkaryhns.","2025-05-28T17:09:43.6270000+00:00","It's a 50:50 cuz I know Keroro's obsession with Gundam led to the team having a Mecha, but they didn't use it on a daily basis/every episode","",""
"690886708207681576","azkaryhns.","2025-05-28T17:16:04.0270000+00:00","Yea I could say Power Rangers could be a Mecha by their way using the zords every time. 

But still a Tokusatsu at heart","",""
"756858165647245373","revwuzhere","2025-05-28T17:16:49.7930000+00:00","wdyall think abt akame ga kill politics","",""
"1205583169428922401","f4rtl0rd","2025-05-28T19:44:31.4770000+00:00","Theres only little politics in Akame Ga Kill tho","",""
"1205583169428922401","f4rtl0rd","2025-05-28T19:44:46.7300000+00:00","Only, kill others for power","",""
"1327306698838245499","k1mcchii","2025-05-29T10:59:59.2720000+00:00","","https://cdn.discordapp.com/attachments/1342873250354565150/1377602368329486507/FB_IMG_1748224495658.jpg?ex=6996446f&is=6994f2ef&hm=34c4de52585078159893213ac9cd3e0b13564ad6d4a536015a614c93963dcb17&",""
"1327306698838245499","k1mcchii","2025-05-29T11:00:05.6660000+00:00","Crunchyroll anime awards are getting new low","",""
"1327306698838245499","k1mcchii","2025-05-29T11:00:08.6160000+00:00","What an ASS","",""
"1327306698838245499","k1mcchii","2025-05-29T11:01:07.3540000+00:00","Im late but this is ASS as fuc*","",""
"891545423238537236","murzzbow","2025-05-29T11:02:20.5680000+00:00","@Kim the reaction that summed it all up","",""
"1327306698838245499","k1mcchii","2025-05-29T11:05:27.9970000+00:00","Like how FRIEREN or dungeon meshi got beat by it","",""
"1327306698838245499","k1mcchii","2025-05-29T11:05:37.8940000+00:00","This is horrid takes","",""
"890070769089015808","tianhikari","2025-05-29T12:05:48.5560000+00:00","F Cruchyroll atp","",""
"890070769089015808","tianhikari","2025-05-29T12:05:51.4130000+00:00","Im going pirate","",""
"766280136332410920","ekast237707","2025-05-29T12:13:54.2880000+00:00","Man","",""
"766280136332410920","ekast237707","2025-05-29T12:14:00.4280000+00:00","Knight mere","",""
"766280136332410920","ekast237707","2025-05-29T12:14:18.9640000+00:00","Guren mk","",""
"766280136332410920","ekast237707","2025-05-29T12:14:28.3210000+00:00","Gawain","",""
"766280136332410920","ekast237707","2025-05-29T12:14:43.4210000+00:00","All the knight of the rounds","",""
"766280136332410920","ekast237707","2025-05-29T12:15:19.7410000+00:00","Code gess is not political mecha","",""
"766280136332410920","ekast237707","2025-05-29T12:15:38.2480000+00:00","It is sunrise want to. Milk money","",""
"766280136332410920","ekast237707","2025-05-29T12:15:54.5040000+00:00","Thats why they use Clamp","",""
"766280136332410920","ekast237707","2025-05-29T12:16:39.4820000+00:00","Clamp make Magic knight Rayearth","",""
"766280136332410920","ekast237707","2025-05-29T12:18:13.2650000+00:00","Escaflowne,Patlabor, Magic knight Rayearth is anime trying all genre to.make money not have feminise political message","",""
"766280136332410920","ekast237707","2025-05-29T12:18:39.4590000+00:00","First its Sailormoon succed in the west","",""
"766280136332410920","ekast237707","2025-05-29T12:19:14.0440000+00:00","Then Inuyasha and Cardcaptor Sakura","",""
"766280136332410920","ekast237707","2025-05-29T12:19:42.6070000+00:00","It is all about money and definition of succed, overseas succed","",""
"766280136332410920","ekast237707","2025-05-29T12:21:00.9000000+00:00","And people in west still. Oppres their feminin side","",""
"766280136332410920","ekast237707","2025-05-29T12:21:27.0870000+00:00","So it must be shock to see anime, female lead mc","",""
"766280136332410920","ekast237707","2025-05-29T12:21:45.3270000+00:00","It is easier to.make money,","",""
"766280136332410920","ekast237707","2025-05-29T12:22:43.9590000+00:00","Classroom of the elite, phsyco pass, monster","",""
"766280136332410920","ekast237707","2025-05-29T12:23:18.3980000+00:00","Their have their own political and philosophy cal stance","",""
"766280136332410920","ekast237707","2025-05-29T12:23:26.8100000+00:00","Death note","",""
"766280136332410920","ekast237707","2025-05-29T12:24:14.7330000+00:00","If it is not Mainstream, or mass produce, thats political stance i think","",""
"1327306698838245499","k1mcchii","2025-05-29T13:34:33.0480000+00:00","That’s a lot of yap","",""
"690886708207681576","azkaryhns.","2025-05-29T16:22:19.4890000+00:00","","",""
"766280136332410920","ekast237707","2025-05-29T21:07:19.0190000+00:00","Yap can only be a yap if people dont care","",""
"766280136332410920","ekast237707","2025-05-29T21:07:40.5880000+00:00","This is political anime for real","",""
"766280136332410920","ekast237707","2025-05-29T21:08:21.1170000+00:00","If you want to be toleran person, this should watch, there is Bali in here, at least in fashion","",""
"766280136332410920","ekast237707","2025-05-29T21:08:26.7290000+00:00","https://youtu.be/UL5i-oh_0IE?si=nxOpdUZKuEln84NU","",""
"766280136332410920","ekast237707","2025-05-29T21:55:32.0910000+00:00","HxH stage act di Osaka","",""
"766280136332410920","ekast237707","2025-05-29T21:55:35.0120000+00:00","https://youtu.be/TQjZl4AOHeQ?si=-ROEfdWqwDCvgO0l","",""
"736550209068335135",".ayab","2025-05-30T04:27:25.5460000+00:00","Yoo!!!!","",""
"766280136332410920","ekast237707","2025-05-30T04:59:40.4460000+00:00","Right","",""
"766280136332410920","ekast237707","2025-05-30T04:59:57.7930000+00:00","Who is the father of haruhi","",""
"766280136332410920","ekast237707","2025-05-30T05:00:21.5330000+00:00","That s the point, cool","",""
"766280136332410920","ekast237707","2025-06-02T11:08:27.0270000+00:00","Aot copy Code Geass?, Solo lepeling dan hunter x hunter, tidak ada ide yang baru lagi, terinspirasi mungkin??...","",""
"766280136332410920","ekast237707","2025-06-02T11:08:29.8260000+00:00","https://youtube.com/shorts/AGH_i3vRb18?si=BKJTeZhk6QGmw5DQ","",""
"766280136332410920","ekast237707","2025-06-04T03:20:28.3120000+00:00","Nice positive lyrics","",""
"766280136332410920","ekast237707","2025-06-04T03:20:31.4680000+00:00","https://youtu.be/rq4VIpNVJgA?si=2CwTnq5O9NgX94oH","",""
"766280136332410920","ekast237707","2025-06-04T04:47:53.8220000+00:00","Don't use other than letter and number to make youtube channel, underline is nope to youtube search","",""
"766280136332410920","ekast237707","2025-06-04T04:47:57.5350000+00:00","https://youtu.be/TZMi2N_3Oik?si=fBk7F676PdP92Ppl","",""
"226662955142348800","tyastro","2025-06-04T16:09:15.5310000+00:00","anybody watch isekai this stuff is so good","https://cdn.discordapp.com/attachments/1342873250354565150/1379854525942468789/MV5BMGFiNzEwNTAtNGQ4Ni00YWZmLWFmNjEtNmZjOGNhMWFhYzgwXkEyXkFqcGc.png?ex=69968ceb&is=69953b6b&hm=54175c1a4edde257a26779c10f67a91da2106dfdd5094a17b65aa98b39bd2bf8&",""
"766280136332410920","ekast237707","2025-06-04T18:33:43.4510000+00:00","Yess i see that one year ago, its soo chill at the Biggining and escalate well, what a beauty slimey cute show, the weakest tamer begin pick up trash","",""
"766280136332410920","ekast237707","2025-06-04T18:35:21.0970000+00:00","Many isekai is overlooked just because it labeled isekai... Like cooking in another world, with fenrir it there first brfore dungeon meshi netflix","",""
"766280136332410920","ekast237707","2025-06-04T18:38:26.1720000+00:00","It is about a girl cursed run for her life and survived with pick up left over potion in dumpster, and accidently raise a rare mind reader healing slime, i hope thats not a spoiler","",""
"766280136332410920","ekast237707","2025-06-04T18:39:24.8830000+00:00","She is a supposedly ""bad star"" Summoner","",""
"766280136332410920","ekast237707","2025-06-04T18:43:07.0990000+00:00","I astonished with Tearmoon empire too, because it s my first villaines genre for me","",""
"766280136332410920","ekast237707","2025-06-04T18:52:12.8000000+00:00","","https://cdn.discordapp.com/attachments/1342873250354565150/1379895534910836847/image0.jpg?ex=6996b31c&is=6995619c&hm=39c251181bf65d869b9138a147cdb7ae93c3ab21468f1325b49afe5a2895742e&",""
"226662955142348800","tyastro","2025-06-04T22:14:23.2040000+00:00","Honest to God you should watch farming life in another world it's so underated it's in Netflix like it's so good how it does slice of life making farming seem so fun","https://cdn.discordapp.com/attachments/1342873250354565150/1379946413227511940/MV5BYTY5NWMzNTEtZGIxYS00Yzk4LWE5MmQtYTdmZDVmNzEzYjU3XkEyXkFqcGc._V1_FMjpg_UX1000__1.jpg?ex=699639bf&is=6994e83f&hm=41e59a440b97ce09f989dce079726d79b4e7347b0369e6eff95182be559c7b1c&",""
"226662955142348800","tyastro","2025-06-04T22:15:54.8910000+00:00","I've also watched that campfire cooking really wished they do a second. Isekai shokudou is also good","",""
"226662955142348800","tyastro","2025-06-04T22:16:03.9430000+00:00","Very similar to that","",""
"766280136332410920","ekast237707","2025-06-04T22:29:30.3860000+00:00","Yes, yes, Restoran in another world, they say it good,","",""
"766280136332410920","ekast237707","2025-06-04T22:30:50.2710000+00:00","And noburi souka, anime ber cocok tanam, but now it clean and perform,","",""
"766280136332410920","ekast237707","2025-06-04T22:33:25.3550000+00:00","Maybe i will check again later, it become some youtuber favorit anime for its chillness, is it that good?","",""
"580702177006190595","ashiapmanman","2025-06-05T03:40:52.5380000+00:00","this is technically fantasy🤓","",""
"756858165647245373","revwuzhere","2025-06-05T04:15:58.8810000+00:00","native isekai 🤓","",""
"756858165647245373","revwuzhere","2025-06-05T04:17:54.6080000+00:00","but yea if its not involving any transition between two world/alternative world, it should be fantasy","",""
"580702177006190595","ashiapmanman","2025-06-05T04:30:42.5570000+00:00","nowadays the line between isekai and ""fantasy"" overlaps often","",""
"580702177006190595","ashiapmanman","2025-06-05T04:31:58.7240000+00:00","the majority of fantasy stories now has adventurers, guilds, magic, yadda yadda","",""
"580702177006190595","ashiapmanman","2025-06-05T04:31:59.3270000+00:00","and most isekais uses those tropes a lot","",""
"580702177006190595","ashiapmanman","2025-06-05T04:32:49.4320000+00:00","other than having the main character transported from their original world to the new world","",""
"580702177006190595","ashiapmanman","2025-06-05T04:33:02.9920000+00:00","and/or reincarnated into the new world","",""
"580702177006190595","ashiapmanman","2025-06-05T04:33:12.5140000+00:00",":emoji_75:","",""
"580702177006190595","ashiapmanman","2025-06-05T04:33:13.7570000+00:00","mfw isekai","",""
"580702177006190595","ashiapmanman","2025-06-05T04:34:51.2590000+00:00","genuinely pisses me off for some reason","",""
"766280136332410920","ekast237707","2025-06-05T05:04:41.1950000+00:00","Isekai nowadays it mean instan heroes and harem","",""
"766280136332410920","ekast237707","2025-06-05T05:05:44.2980000+00:00","But actually, i think what people think of isekai is another world like litteraly it English translation","",""
"766280136332410920","ekast237707","2025-06-05T05:06:25.0270000+00:00","And it means, you still have essense of your previous world","",""
"766280136332410920","ekast237707","2025-06-05T05:07:11.4410000+00:00","Thats the main course, and the appetizer or how to get it, can be devided mostly three","",""
"766280136332410920","ekast237707","2025-06-05T05:08:07.3560000+00:00","First is reincarnation, it means your die first than Transported to another world, yes truck kun its your foult","",""
"766280136332410920","ekast237707","2025-06-05T05:08:56.4340000+00:00","Second is teleported or summoned, first your are alone, second your are called by some people","",""
"766280136332410920","ekast237707","2025-06-05T05:09:48.5370000+00:00","Three it combined of teleport or reincarnation, or you can go travel beyond two or more world","",""
"766280136332410920","ekast237707","2025-06-05T05:10:50.1690000+00:00","Four, yes four its game world, video game, and maybe pure another world from the beginning, of simply called fantasy","",""
"766280136332410920","ekast237707","2025-06-05T09:20:40.8270000+00:00","8 Anime Plot twist","",""
"766280136332410920","ekast237707","2025-06-05T09:20:46.3450000+00:00","https://kumparan.com/sinema-update/8-anime-dengan-plot-twist-terbaik-sepanjang-masa-25CI3IgBzxc","",""
"226662955142348800","tyastro","2025-06-05T09:52:56.5860000+00:00","UMM ACTUALLY ITS REINCARNATION","",""
"226662955142348800","tyastro","2025-06-05T09:53:06.1950000+00:00","https://tenor.com/view/erm-aksuali-veli-vel-nerd-nerd-emoji-gif-11908435316515627035","",""
"226662955142348800","tyastro","2025-06-05T09:53:29.9130000+00:00","the main protatgonist got reborn","",""
"890070769089015808","tianhikari","2025-06-05T10:13:22.0260000+00:00","If Kumparan mention Frieren then W Kumparan","",""
"580702177006190595","ashiapmanman","2025-06-05T11:47:56.5690000+00:00","lmao i forgot","",""
"580702177006190595","ashiapmanman","2025-06-05T11:47:58.6700000+00:00","probably","",""
"766280136332410920","ekast237707","2025-06-05T12:10:51.4410000+00:00","What plot twist in frieren is.... I think its more journey, like tabi anime, you walked and got learning about the world and ourself","",""
"678487612348170241","hiraeth444","2025-06-05T14:25:45.5820000+00:00","hai is anyone into gachiakuta?? :3","",""
"736550209068335135",".ayab","2025-06-05T21:37:45.9320000+00:00","War's Unwomanly Face","https://cdn.discordapp.com/attachments/1342873250354565150/1380299585725009961/604588a8c9d6ca2779010eb4_225_337_73445.jpg?ex=69963129&is=6994dfa9&hm=8b71458781f76eba286d784df57c8d56e2629f105cf9d3141d7cb845a87bc374&","👍 (1)"
"736550209068335135",".ayab","2025-06-05T21:37:57.7790000+00:00","In The Unwomanly Face of War, Alexievich chronicles the experiences of the Soviet women who fought on the front lines, on the home front, and in the occupied territories. These women—more than a million in total—were nurses and doctors, pilots, tank drivers, machine-gunners, and snipers. They battled alongside men, and yet, after the victory, their efforts and sacrifices were forgotten.","",""
"736550209068335135",".ayab","2025-06-05T21:38:16.6180000+00:00",".......

Its really good","",""
"736550209068335135",".ayab","2025-06-05T21:44:28.9080000+00:00","Its a real book turmed to manga","",""
"766280136332410920","ekast237707","2025-06-05T22:27:41.8370000+00:00","Snipers??... Hmmm","",""
"736550209068335135",".ayab","2025-06-06T00:13:31.9510000+00:00","Not just sniper ekast","",""
"736550209068335135",".ayab","2025-06-06T00:13:43.4780000+00:00","Theres also nurses, laundress etc","",""
"736550209068335135",".ayab","2025-06-06T00:14:13.7380000+00:00","Its a collection of story based upon the struggle of soviet women","",""
"736550209068335135",".ayab","2025-06-06T00:16:12.8120000+00:00","","https://cdn.discordapp.com/attachments/1342873250354565150/1380339460062974112/Screenshot_20250606_071557_Chrome.jpg?ex=6996564c&is=699504cc&hm=71d6a7cd6e8915b4e269e806af8eefbfa1b0e0f402375b13db537bccf4ef99de&",""
"766280136332410920","ekast237707","2025-06-06T00:50:46.3180000+00:00","Oh Soviet, i see, it like escalate well, from nurse, machine gun and then Sniper, i never seen woman sniper before, even in game...","",""
"766280136332410920","ekast237707","2025-06-06T01:53:27.1460000+00:00","Wow, stage act 3,Hunter x Hunter cast MBS","",""
"766280136332410920","ekast237707","2025-06-06T01:53:29.5450000+00:00","https://youtu.be/Vcqgif91TXo?si=RqxJ1sSdBrPOF_ii","",""
"766280136332410920","ekast237707","2025-06-06T04:15:00.9010000+00:00","Hehehe...","",""
"766280136332410920","ekast237707","2025-06-06T04:15:03.6780000+00:00","https://youtu.be/NSXFxzCSKXA?si=zDNOoVJVbtXSD5Wx","",""
"1327306698838245499","k1mcchii","2025-06-06T13:29:07.4320000+00:00","Hihihi","",""
"1327306698838245499","k1mcchii","2025-06-06T13:29:10.1440000+00:00","Gachiakuta goated","",""
"1327306698838245499","k1mcchii","2025-06-06T13:29:17.4720000+00:00","I fw fashionable characters 🗣️","",""
"678487612348170241","hiraeth444","2025-06-06T16:56:40.9040000+00:00","BENR BANGET BOZZ","",""
"678487612348170241","hiraeth444","2025-06-06T16:56:49.1730000+00:00","i fw w gris he can get it","",""
"678487612348170241","hiraeth444","2025-06-06T16:56:52.6010000+00:00",":3","",""
"340697305806012416","hachimantaro9125","2025-06-07T14:59:49.8560000+00:00","","https://cdn.discordapp.com/attachments/1342873250354565150/1380924217599725730/Screenshot_20250607-215751__01.jpg?ex=69967ca5&is=69952b25&hm=1f7cf0377d2e1ea3217bf812b0eaf7c169d1b052af375c20bb3768f3a646947e&",""
"340697305806012416","hachimantaro9125","2025-06-07T15:05:18.7100000+00:00","Horror movie","",""
"688330999725293758","noxsiduss","2025-06-07T21:27:05.5700000+00:00","fr","",""
"766280136332410920","ekast237707","2025-06-08T00:32:54.9500000+00:00","I think this isekai anime is reincarnation of Code Geass","",""
"766280136332410920","ekast237707","2025-06-08T00:33:28.3000000+00:00","If the king not move first then who want to. Follow...","",""
"766280136332410920","ekast237707","2025-06-08T00:33:31.8300000+00:00","https://youtu.be/q-Hwa0q5YHU?si=4cVEg0E0GSmwYrPB","",""
"766280136332410920","ekast237707","2025-06-08T00:34:29.1370000+00:00","Warning: fan service in another episode","",""
"766280136332410920","ekast237707","2025-06-08T05:11:12.6230000+00:00","Reasons why Maomao is better","",""
"766280136332410920","ekast237707","2025-06-08T05:11:15.3790000+00:00","https://youtu.be/uOxmGTnWjB8?si=FnfCHPuq7HOM2PRE","",""
