AuthorID,Author,Date,Content,Attachments,Reactions
"620672544357220364","sad.potato.13","2026-01-08T05:12:26.9510000+00:00","Gua ga suka air jordans cos it doesnt suit me HAHAHA","",""
"691626449743904810","lotso125","2026-01-08T05:12:28.6990000+00:00","i got myself a farmer's market JP pants","",""
"691626449743904810","lotso125","2026-01-08T05:12:29.9180000+00:00","lmao","",""
"1064369916351889448","fellowmen","2026-01-08T05:12:36.5660000+00:00","legal trhifting?","",""
"691626449743904810","lotso125","2026-01-08T05:12:38.4340000+00:00","paham wkwkwkwk","",""
"1064369916351889448","fellowmen","2026-01-08T05:12:41.8130000+00:00","oh okay farmers market","",""
"691626449743904810","lotso125","2026-01-08T05:12:44.6500000+00:00","eeeh idk......","",""
"620672544357220364","sad.potato.13","2026-01-08T05:12:46.5150000+00:00","But for the pants, i have 4 of them","",""
"620672544357220364","sad.potato.13","2026-01-08T05:12:49.7710000+00:00","cargos","",""
"691626449743904810","lotso125","2026-01-08T05:12:55.6410000+00:00","banyak jg wkwkwkwk","",""
"691626449743904810","lotso125","2026-01-08T05:13:06.4950000+00:00","yesss it was a cargo / baloon pants thingy","",""
"691626449743904810","lotso125","2026-01-08T05:13:17.6800000+00:00","it was dope fr","",""
"620672544357220364","sad.potato.13","2026-01-08T05:13:18.0240000+00:00","Sepakean sm nyokap","",""
"691626449743904810","lotso125","2026-01-08T05:13:28.4030000+00:00","oalah pantesss","",""
"691626449743904810","lotso125","2026-01-08T05:13:40.4980000+00:00","kek w kira u cop like 4 jordans cargo for urself","",""
"691626449743904810","lotso125","2026-01-08T05:13:46.4600000+00:00","u must love the brand lol","",""
"1064369916351889448","fellowmen","2026-01-08T05:13:58.6340000+00:00","bisa dipakai buat keluyuran di couch, terus kalo konco ngajak meetup gausah ganti celana ya","",""
"1064369916351889448","fellowmen","2026-01-08T05:14:13.4400000+00:00","berarti atasannya kemeja ya","",""
"691626449743904810","lotso125","2026-01-08T05:14:25.7460000+00:00","paham","",""
"691626449743904810","lotso125","2026-01-08T05:14:46.5020000+00:00","cukup versatile sih soalnya kayak baggy cargo aja feelnya","",""
"691626449743904810","lotso125","2026-01-08T05:14:58.4070000+00:00","kemeja or tees or leather jacket works fine","",""
"1064369916351889448","fellowmen","2026-01-08T05:15:04.1640000+00:00","shoes coklat pakai yg mana","",""
"1064369916351889448","fellowmen","2026-01-08T05:15:13.3500000+00:00","docmart sung kah?","",""
"691626449743904810","lotso125","2026-01-08T05:15:23.4710000+00:00","either the AF1 or the docmart kayanya","",""
"691626449743904810","lotso125","2026-01-08T05:15:31.6150000+00:00","the nike winter thing juga bagus","",""
"1064369916351889448","fellowmen","2026-01-08T05:15:51.5450000+00:00","smooth","",""
"1064369916351889448","fellowmen","2026-01-08T05:16:08.7690000+00:00","harus jalan ntar malam sih","",""
"691626449743904810","lotso125","2026-01-08T05:16:09.0450000+00:00","fr the quickest yoink in my life","",""
"620672544357220364","sad.potato.13","2026-01-08T05:16:13.6670000+00:00","Wkkwkw gak si, 2 model, 2 colourway each

Not that i like the brand lbh ke modelnya lucu","",""
"1064369916351889448","fellowmen","2026-01-08T05:16:17.0210000+00:00","hangout at bar sih","",""
"691626449743904810","lotso125","2026-01-08T05:16:18.9370000+00:00","idk about that lol","",""
"691626449743904810","lotso125","2026-01-08T05:16:28.6160000+00:00","kenapa emg modelnyaa","",""
"1064369916351889448","fellowmen","2026-01-08T05:16:30.3890000+00:00","sayang aja ga dipakai ke lapangan","",""
"691626449743904810","lotso125","2026-01-08T05:16:53.2370000+00:00","w ga tll merhatiin jordan lifestyle wears soalnya","",""
"691626449743904810","lotso125","2026-01-08T05:17:03.4310000+00:00","maybe on the weekend","",""
"1064369916351889448","fellowmen","2026-01-08T05:17:16.6500000+00:00","gas, nice haul man","",""
"691626449743904810","lotso125","2026-01-08T05:17:32.1060000+00:00","terimakasih 🙏","",""
"1064369916351889448","fellowmen","2026-01-08T05:17:46.2890000+00:00","fx?","",""
"691626449743904810","lotso125","2026-01-08T05:17:57.2430000+00:00","selasa w gatau si kek belanjaan dateng semua wkwkwk","",""
"691626449743904810","lotso125","2026-01-08T05:18:12.0090000+00:00","i thrifted some pants and my preorder also just arrived","",""
"691626449743904810","lotso125","2026-01-08T05:18:15.4710000+00:00","crazy coincidence","",""
"691626449743904810","lotso125","2026-01-08T05:18:33.8670000+00:00","ada apa di fx? w gatau apa2 🗿","",""
"1064369916351889448","fellowmen","2026-01-08T05:18:35.9580000+00:00","preorder apa ni","",""
"1064369916351889448","fellowmen","2026-01-08T05:19:19.3770000+00:00","kalo celana baggy, bisa nyimpan sticklight banyakan","",""
"691626449743904810","lotso125","2026-01-08T05:19:27.5510000+00:00","i bought a shirt from hishiro, a local brand","",""
"691626449743904810","lotso125","2026-01-08T05:19:30.8040000+00:00","https://hishiro.store/id/products/hakuji-button-up-pre-order

this one","",""
"691626449743904810","lotso125","2026-01-08T05:19:46.4720000+00:00","buat apa w bawa sticklight ke mall 🗿","",""
"1064369916351889448","fellowmen","2026-01-08T05:20:06.7450000+00:00","wow","",""
"1064369916351889448","fellowmen","2026-01-08T05:20:07.7000000+00:00","nice","",""
"1064369916351889448","fellowmen","2026-01-08T05:20:12.8060000+00:00","local brand?","",""
"1064369916351889448","fellowmen","2026-01-08T05:20:15.5620000+00:00","very nice","",""
"691626449743904810","lotso125","2026-01-08T05:20:19.5940000+00:00","yessss","",""
"1064369916351889448","fellowmen","2026-01-08T05:20:35.2130000+00:00","review embroidery nya ga ntar?","",""
"691626449743904810","lotso125","2026-01-08T05:20:36.1210000+00:00","ikrrrr? gue juga kaget pas pertama kali liat wkwkwkw","",""
"691626449743904810","lotso125","2026-01-08T05:20:55.6500000+00:00","once i knew that they did pre order for that thing i immediately place my order lmao","",""
"691626449743904810","lotso125","2026-01-08T05:21:13.6160000+00:00","jaitannya rapi, silhouettenya juga pas di pundak dan lengan","",""
"691626449743904810","lotso125","2026-01-08T05:21:15.8110000+00:00","it was good","",""
"691626449743904810","lotso125","2026-01-08T05:21:27.2570000+00:00","bahannya juga ga tipis2 bgt so it was nice. breathable as well","",""
"691626449743904810","lotso125","2026-01-08T05:21:34.3620000+00:00","nyucinya aja nih kudu ati2 wkwkwkwk","",""
"1064369916351889448","fellowmen","2026-01-08T05:21:35.2470000+00:00","ommak","",""
"1064369916351889448","fellowmen","2026-01-08T05:21:43.3970000+00:00","udah pada soldout juga","",""
"1064369916351889448","fellowmen","2026-01-08T05:21:50.8570000+00:00","kek fuseinatti aja si hishiro ni","",""
"691626449743904810","lotso125","2026-01-08T05:21:56.8800000+00:00","yeah they ended their pre orders already","",""
"620672544357220364","sad.potato.13","2026-01-08T05:22:03.5200000+00:00","Lucu","",""
"691626449743904810","lotso125","2026-01-08T05:22:09.7600000+00:00","tp insider info katanya januari/februari mau ada PO lagi","",""
"691626449743904810","lotso125","2026-01-08T05:22:15.2680000+00:00","krn high demand","",""
"691626449743904810","lotso125","2026-01-08T05:22:18.9460000+00:00","follow IG nya aja wkwkwkwk","",""
"691626449743904810","lotso125","2026-01-08T05:22:35.1450000+00:00","ada link productnya kahhh? mau liat wkwkwk","",""
"691626449743904810","lotso125","2026-01-08T05:23:07.9010000+00:00","kinda, makanya w lgsg sikat wkwkwkwkw","",""
"691626449743904810","lotso125","2026-01-08T05:23:19.2390000+00:00","sayangnya celana w kurang muat makanya ga w beli","",""
"691626449743904810","lotso125","2026-01-08T05:23:39.2550000+00:00","bcs their jeans and jorts from the same collection are also crazy good fr","",""
"1064369916351889448","fellowmen","2026-01-08T05:23:55.1920000+00:00","a clothing brand based on jakarta not bandung?","",""
"1064369916351889448","fellowmen","2026-01-08T05:23:56.1390000+00:00","wow","",""
"691626449743904810","lotso125","2026-01-08T05:23:58.0980000+00:00","https://hishiro.store/id/products/raku-jeans-pre-order

NAJISSSSSS CAKEP BGT TOLOL","",""
"691626449743904810","lotso125","2026-01-08T05:24:17.4160000+00:00","betul","",""
"847083838105714699","monke_eat_banana","2026-01-08T05:24:22.1680000+00:00","Yoo send pick of the embroidery on the back pls","",""
"691626449743904810","lotso125","2026-01-08T05:24:25.5280000+00:00","tp production di china seinget w","",""
"1064369916351889448","fellowmen","2026-01-08T05:24:44.9720000+00:00","this is pretty original, so.. how about we discussed calle lotso the curator? what is calle?","",""
"1064369916351889448","fellowmen","2026-01-08T05:24:55.8710000+00:00","banyak yang bilang calle ga original","",""
"691626449743904810","lotso125","2026-01-08T05:24:56.4260000+00:00","KAYA GINI MENNNNNNN","https://cdn.discordapp.com/attachments/1441326388891226122/1458692932465856554/image.png?ex=6995f5e8&is=6994a468&hm=3bd321a35f50828a1ab098ef7a847324c3a34b220313b16f97a432bc37c0156d&",""
"691626449743904810","lotso125","2026-01-08T05:25:02.0430000+00:00","GILA GAKSIH","",""
"1064369916351889448","fellowmen","2026-01-08T05:25:06.9630000+00:00","iya ini gua liat keren sih","",""
"1064369916351889448","fellowmen","2026-01-08T05:25:18.0440000+00:00","cocok banget ke jkt48 pake begituan","",""
"1064369916351889448","fellowmen","2026-01-08T05:25:19.2710000+00:00","eh","",""
"691626449743904810","lotso125","2026-01-08T05:25:44.2330000+00:00","calle JUJUR menurut gue heavily inspired by many things kayak hellstar, tp mrk rip off the design completely. beneran cuma ganti nama jadi calle aja tuh design2nya","",""
"691626449743904810","lotso125","2026-01-08T05:25:52.1630000+00:00","goblok bgt benci w sama tu brand wkwkwkw","",""
"1064369916351889448","fellowmen","2026-01-08T05:26:06.1680000+00:00","fak kek brand bandung pake segitiga palace ya itu ya","",""
"691626449743904810","lotso125","2026-01-08T05:26:08.2910000+00:00","i mean like inspired is totally okay, tp ripping off is a big no no for me","",""
"691626449743904810","lotso125","2026-01-08T05:26:13.9490000+00:00","at least imitate gt jangan nyontek","",""
"1064369916351889448","fellowmen","2026-01-08T05:26:18.0330000+00:00","berarti bener feeling gua sama calle, sama marketingnya terlalu over the top sih ya","",""
"691626449743904810","lotso125","2026-01-08T05:26:29.1810000+00:00","cocok aja kayanya....? idk sih gapernah ngeliat jkt48","",""
"691626449743904810","lotso125","2026-01-08T05:27:17.8590000+00:00","yes kurang lebih. brands like SNSB, CALLE, MIRACLE can just die fr desainnya jelek sm copying others aja","",""
"691626449743904810","lotso125","2026-01-08T05:27:31.3950000+00:00","brand2 kek gini bahkan juga nyontek rilisan lokal lain yg kurang populer jir","",""
"1064369916351889448","fellowmen","2026-01-08T05:27:42.9000000+00:00","thank you curator for reminding us to avoid those kind of brand","",""
"691626449743904810","lotso125","2026-01-08T05:27:47.1820000+00:00","jadi bukan cuma localized international brand, tpp juga lokalin brand lokal gt","",""
"691626449743904810","lotso125","2026-01-08T05:27:51.4650000+00:00","najis bgt cara mainnya","",""
"1064369916351889448","fellowmen","2026-01-08T05:27:56.5570000+00:00","fr? wanjir","",""
"1064369916351889448","fellowmen","2026-01-08T05:28:00.2700000+00:00","harus dicallout sih ya","",""
"691626449743904810","lotso125","2026-01-08T05:28:28.7240000+00:00","WKWKWKWKWKWKWK w sih jujur gamau nyebar hate ke brand tersebut yaaa, but personally, i despise them dan ppl who called them ""hard"" or ""drippy""","",""
"691626449743904810","lotso125","2026-01-08T05:28:44.1660000+00:00","kek istg cek hellstar, sp5der, desainnya mirip2 mereka semua jir","",""
"691626449743904810","lotso125","2026-01-08T05:29:11.4560000+00:00","udah seringgggg cuma mereka biasanya cuma minta maaf dan ""mecat"" designer/ illustrator mereka aja","",""
"691626449743904810","lotso125","2026-01-08T05:29:14.9150000+00:00","cuci tangan lah biasa","",""
"1064369916351889448","fellowmen","2026-01-08T05:29:22.8890000+00:00","fak","",""
"1064369916351889448","fellowmen","2026-01-08T05:29:26.7890000+00:00","okey okey","",""
"691626449743904810","lotso125","2026-01-08T05:29:32.2210000+00:00","jd begitu","",""
"691626449743904810","lotso125","2026-01-08T05:29:54.8040000+00:00","gpp kalo mau beli calle ato miracle cuma ya..... just remember that they're not that ""original"" aja","",""
"691626449743904810","lotso125","2026-01-08T05:30:23.7350000+00:00","have some vision guys fr. i mean thats why older brands like pot meets pop and faith industries are still relevant yknow","",""
"1064369916351889448","fellowmen","2026-01-08T05:30:42.8060000+00:00","no, i prefer to choose my grail that are made from hardwork","",""
"1064369916351889448","fellowmen","2026-01-08T05:30:49.1870000+00:00","so sorry calle and gang","",""
"691626449743904810","lotso125","2026-01-08T05:30:51.5690000+00:00","wkwkwkwkwwk paham","",""
"1064369916351889448","fellowmen","2026-01-08T05:30:52.3580000+00:00","you are out","",""
"1064369916351889448","fellowmen","2026-01-08T05:31:18.3790000+00:00","dulu gua masih era di kitc, elhaus, berak atau kamengski","",""
"691626449743904810","lotso125","2026-01-08T05:31:20.7650000+00:00","oh ada 1 lg brand lokal w gasuka","",""
"691626449743904810","lotso125","2026-01-08T05:31:23.0950000+00:00","leaf namanya","",""
"1064369916351889448","fellowmen","2026-01-08T05:31:24.2390000+00:00","sekarang brand local makin keren ya","",""
"691626449743904810","lotso125","2026-01-08T05:31:25.1410000+00:00","wkwkwkwkwkwwk","",""
"691626449743904810","lotso125","2026-01-08T05:31:30.4070000+00:00","kalo ini karena norak ajasih","",""
"1064369916351889448","fellowmen","2026-01-08T05:31:33.0510000+00:00","lleaf?","",""
"691626449743904810","lotso125","2026-01-08T05:31:50.8340000+00:00","all of them CLEARS by a hundred mile fr","",""
"620672544357220364","sad.potato.13","2026-01-08T05:32:04.4940000+00:00","Yg ini ad 2 warna kayak baju pns sama pattern safari ijo

Kl yg gua lg pake ad 2, 1 lg dark gray-black gt","https://cdn.discordapp.com/attachments/1441326388891226122/1458694728160645151/IMG_2428.png?ex=6995f794&is=6994a614&hm=4fa2992d3c895ce5dd49e0a20b021d51c8eda3e90e1ed1f06dddf091eabfc2fa&",""
"691626449743904810","lotso125","2026-01-08T05:32:04.5770000+00:00","meskipun berak juga copy supreme tp ya ok lah mrk skrg lebi original","",""
"620672544357220364","sad.potato.13","2026-01-08T05:32:27.8960000+00:00","Ga nemu web link nya udh 2-3 thn lalu belinya retail","","👍 (1)"
"691626449743904810","lotso125","2026-01-08T05:32:29.0060000+00:00","yesss cek aja kapan2 wkwkwkwk kek design2nya aga norak mnrt w (tp original)","",""
"691626449743904810","lotso125","2026-01-08T05:32:33.7890000+00:00","kalo leaf masalah taste aja","",""
"691626449743904810","lotso125","2026-01-08T05:32:47.7800000+00:00","hooooo thats cool actually","",""
"1064369916351889448","fellowmen","2026-01-08T05:32:53.6250000+00:00","pake sepatu off white udah cucok ariga","",""
"691626449743904810","lotso125","2026-01-08T05:32:55.9170000+00:00","slim cargo gt emg cakep siii","",""
"1064369916351889448","fellowmen","2026-01-08T05:33:16.8150000+00:00","baru liat sekilas, kek lego gitu inspirasi warnanya ya?","",""
"691626449743904810","lotso125","2026-01-08T05:33:43.4100000+00:00","jujur i have no idea inspo board mereka apa","",""
"1064369916351889448","fellowmen","2026-01-08T05:33:59.5020000+00:00","lumayan juga sih follower ignya","",""
"1064369916351889448","fellowmen","2026-01-08T05:34:04.4830000+00:00","barutau leaf","",""
"691626449743904810","lotso125","2026-01-08T05:34:05.7360000+00:00","back then i saw them making these long baggy pants trus motifnya checkered gt kek papan catur","",""
"691626449743904810","lotso125","2026-01-08T05:34:14.5210000+00:00","istgggggggggg","",""
"1064369916351889448","fellowmen","2026-01-08T05:34:39.6120000+00:00","wgwgwg","",""
"1064369916351889448","fellowmen","2026-01-08T05:34:56.8110000+00:00","at least they were original about it","",""
"620672544357220364","sad.potato.13","2026-01-08T05:35:04.4390000+00:00","Off white virgil abloh ato warna off white","",""
"691626449743904810","lotso125","2026-01-08T05:35:12.7150000+00:00","ada juga ini","https://cdn.discordapp.com/attachments/1441326388891226122/1458695517285384426/e730a4826a3243db4ede89839afdfa4e.png?ex=6995f850&is=6994a6d0&hm=f01b32836788a07b9423da9a2566eb39a6b593d543af2ff5e5306ea46747673d&",""
"1064369916351889448","fellowmen","2026-01-08T05:35:14.6340000+00:00","off white nike ariga","",""
"691626449743904810","lotso125","2026-01-08T05:35:14.8510000+00:00","istighfar","",""
"691626449743904810","lotso125","2026-01-08T05:35:30.3270000+00:00","both preferably lol","",""
"691626449743904810","lotso125","2026-01-08T05:35:45.6050000+00:00","i mean i can see u wear those pants and also repping the offwhite yellow belts","",""
"1064369916351889448","fellowmen","2026-01-08T05:35:48.1350000+00:00","avant garde lah ya","",""
"620672544357220364","sad.potato.13","2026-01-08T05:35:48.9260000+00:00","Reality check gua pake crocs ke sekolah","",""
"691626449743904810","lotso125","2026-01-08T05:35:53.2310000+00:00","just like 2016 lmaoooo","",""
"691626449743904810","lotso125","2026-01-08T05:36:02.8470000+00:00","idk about that LMAOOOOOOO","",""
"691626449743904810","lotso125","2026-01-08T05:36:13.9380000+00:00","clogs? or normal crocs","",""
"1064369916351889448","fellowmen","2026-01-08T05:36:14.9350000+00:00","ya tetep gua ga ada niat beli sih ya","",""
"691626449743904810","lotso125","2026-01-08T05:36:20.8830000+00:00","paham","",""
"691626449743904810","lotso125","2026-01-08T05:36:24.7280000+00:00","same tbh","",""
"1064369916351889448","fellowmen","2026-01-08T05:37:16.3660000+00:00","crocs x aespa","",""
"1064369916351889448","fellowmen","2026-01-08T05:37:22.5590000+00:00","gamungkin sih ya dibawa ke sekolah","",""
"1064369916351889448","fellowmen","2026-01-08T05:37:24.0060000+00:00","but still","",""
"691626449743904810","lotso125","2026-01-08T05:37:43.6170000+00:00","yang bulu2 itu? wkwkwkwkwk","",""
"691626449743904810","lotso125","2026-01-08T05:37:47.1620000+00:00","takut kotor ril","",""
"691626449743904810","lotso125","2026-01-08T05:37:59.8480000+00:00","tp lucu sih itu w keinget sama starbucks unicorn frappe","",""
"1064369916351889448","fellowmen","2026-01-08T05:38:24.3490000+00:00","paham","",""
"1064369916351889448","fellowmen","2026-01-08T05:38:30.9860000+00:00","bagusnya dipake di rumah sih ya","",""
"691626449743904810","lotso125","2026-01-08T05:38:40.9330000+00:00","temukan 3 perbedaan","https://cdn.discordapp.com/attachments/1441326388891226122/1458696390891798601/id-11134207-7r98v-lmg7s3j383a918.png?ex=6995f920&is=6994a7a0&hm=f6582abcdf011cffcc4e54c423cf25139ffaa025ed38edd3e05f68e47bb338bf&,https://cdn.discordapp.com/attachments/1441326388891226122/1458696391269552128/Unicorn_Frappuccino-1-1200x1057.png?ex=6995f920&is=6994a7a0&hm=17c1e54dbec430996ed89f6a0591822170db0894ed27ffa188172d15769f976a&",""
"691626449743904810","lotso125","2026-01-08T05:39:52.7630000+00:00","the thing is.... ini collab rilis 2023 trus kek lagu mereka yg lagi populer tuh DRAMA","",""
"691626449743904810","lotso125","2026-01-08T05:39:58.8550000+00:00","WKWKWKWWKWKWKWK TERLALU KONTRAS JIR","",""
"1064369916351889448","fellowmen","2026-01-08T05:50:01.2390000+00:00","damn that is delicious","",""
"1092629690788884511","percyvalll_","2026-01-08T05:50:24.4860000+00:00","gw masih punya jordan 6 unc yg og colorway","",""
"1092629690788884511","percyvalll_","2026-01-08T05:51:02.3190000+00:00","gw beli karena ga sanggup beli infrared :smile:","",""
"691626449743904810","lotso125","2026-01-08T05:51:15.8780000+00:00","ig infrared atau yg apa","",""
"691626449743904810","lotso125","2026-01-08T05:51:19.9920000+00:00","oh bukan","",""
"1092629690788884511","percyvalll_","2026-01-08T05:51:58.4430000+00:00","","https://cdn.discordapp.com/attachments/1441326388891226122/1458699735866282037/unc.png?ex=6995fc3e&is=6994aabe&hm=60967e68e738ed261e86543b541151f5060095873205c7fea103e9ba245e3608&",""
"1092629690788884511","percyvalll_","2026-01-08T05:52:28.1920000+00:00","punya gw pull tabnya udah ancur juga gara2 sempet gw pake main","",""
"691626449743904810","lotso125","2026-01-08T05:52:33.7180000+00:00","that looks like tiffany color lol","",""
"691626449743904810","lotso125","2026-01-08T05:52:40.2180000+00:00","that looks cool tho","",""
"691626449743904810","lotso125","2026-01-08T05:52:50.7240000+00:00","nice one. as intended wkwkwkwk","",""
"691626449743904810","lotso125","2026-01-08T05:53:00.6230000+00:00","lo emg anak basket atau cuma suka main aja v?","",""
"1092629690788884511","percyvalll_","2026-01-08T05:53:28.9420000+00:00","cuma main aja dulu, ga sering sih","",""
"691626449743904810","lotso125","2026-01-08T05:54:22.8770000+00:00","paham","",""
"691626449743904810","lotso125","2026-01-08T05:54:33.5630000+00:00","same sih cuma w ga jago wkwkwk","",""
"691626449743904810","lotso125","2026-01-08T05:54:49.0800000+00:00","dulu pas kuliah sering 1v1 sama temen w gegara deket rumahnya ada ring","",""
"1092629690788884511","percyvalll_","2026-01-08T05:55:31.4400000+00:00","ekskul basket di sma gw ga aktif dulu makanya gw ga main lagi","",""
"691626449743904810","lotso125","2026-01-08T05:55:42.3520000+00:00","damn sedih bgt","",""
"691626449743904810","lotso125","2026-01-08T05:55:48.3080000+00:00","tp skrg masi suka main kah","",""
"1092629690788884511","percyvalll_","2026-01-08T05:56:37.3090000+00:00","sebenernya dari sd sih gw belajar basket, pas masuk smp orang orangnya problematik semua yg di basket yaudah kebaw amager sampe sma","",""
"1092629690788884511","percyvalll_","2026-01-08T05:56:44.7950000+00:00","udah ga samsek","",""
"691626449743904810","lotso125","2026-01-08T05:58:51.4640000+00:00","problematik kenapa tuh? as an individualnya atau sok jago gt","",""
"1092629690788884511","percyvalll_","2026-01-08T06:02:05.5010000+00:00","keseringan ribut sesama anggota, kelompok dalam kelompok type shi","",""
"691626449743904810","lotso125","2026-01-08T06:03:57.1220000+00:00","yaelah wkwkwkwkwkwk ternyata masalah sepele","",""
"691626449743904810","lotso125","2026-01-08T06:04:06.0700000+00:00","tp emg cepet jd toxic sih kalo udah gitu","",""
"691626449743904810","lotso125","2026-01-08T06:04:10.4430000+00:00","jadi selek2an sendiri","",""
"620672544357220364","sad.potato.13","2026-01-08T07:07:06.9680000+00:00","Crocs yang erm agak tinggi? Biar ga kena banjir","",""
"458504213203255324",".magurotuna","2026-01-08T07:45:19.0460000+00:00","chiikawa feet drip :smile:","https://cdn.discordapp.com/attachments/1441326388891226122/1458728259402600549/Screenshot_20260108_144427_Instagram.jpg?ex=699616ce&is=6994c54e&hm=28b1b65de108f650fc1fa184aff1d9ed08987e580a6a490c612a93f21e443bc3&,https://cdn.discordapp.com/attachments/1441326388891226122/1458728259754790912/Screenshot_20260108_144315_Instagram.jpg?ex=699616ce&is=6994c54e&hm=dbde9b83d48357ac8990aee5ceacb2f530b61cf8e24035e8fd7623d548ef7b5b&",""
"458504213203255324",".magurotuna","2026-01-08T07:45:45.7780000+00:00","man i want them so badly but im scared the graphics on the side will peel off over time","",""
"620672544357220364","sad.potato.13","2026-01-08T07:46:46.0440000+00:00","Kalo tiap jalan bunyi “una una una” gak","",""
"458504213203255324",".magurotuna","2026-01-08T07:47:24.8240000+00:00","ada yang kayak gini juga but i prefer the other ones","https://cdn.discordapp.com/attachments/1441326388891226122/1458728787343573116/Screenshot_20260108_144652_Instagram.jpg?ex=6996174c&is=6994c5cc&hm=aa1139bb0b3834999e48b8946b68a7bb0f0dd635fc91332a6e0d304731f88ecb&","🐟 (1)"
"458504213203255324",".magurotuna","2026-01-08T07:47:29.4610000+00:00","kalo engga aku kecewa","",""
"458504213203255324",".magurotuna","2026-01-08T07:47:36.6460000+00:00","kasih sound effect manual","",""
"620672544357220364","sad.potato.13","2026-01-08T07:47:41.6300000+00:00","YG INI LUCU BGT","",""
"620672544357220364","sad.potato.13","2026-01-08T07:47:46.9680000+00:00","mirip miu miu","",""
"458504213203255324",".magurotuna","2026-01-08T07:48:29.0660000+00:00","@Kucing Micin, B.Skena micin look at these","",""
"458504213203255324",".magurotuna","2026-01-08T07:49:02.2540000+00:00","cubanget woyh me and the gang","https://cdn.discordapp.com/attachments/1441326388891226122/1458729195982291176/image0.jpg?ex=699617ae&is=6994c62e&hm=a83c131b294dfcbc4f23a26c54d0ada1cd9f4c061b13ebdb1136a97b258a7a57&","⭐ (2),❤️ (1)"
"857530483508510750","kucingmicin","2026-01-08T07:51:38.4400000+00:00","EHH OMG","",""
"857530483508510750","kucingmicin","2026-01-08T07:51:41.6840000+00:00","SO CUTE","",""
"857530483508510750","kucingmicin","2026-01-08T12:33:42.7910000+00:00","i think youd like this video @Lotso 

https://www.youtube.com/watch?v=xK8pFZ1Oiak","",""
