AuthorID,Author,Date,Content,Attachments,Reactions
"437151269212127240","waltz817","2025-02-22T16:58:14.3160000+00:00","nice channel, nice","",""
"427539190629007362","maddiw","2025-02-23T10:56:22.0150000+00:00","gurren lagann > everything, thanks","","🤣 (1)"
"766280136332410920","ekast237707","2025-02-23T11:17:47.3940000+00:00","Yeasss my prayers hing","",""
"766280136332410920","ekast237707","2025-02-23T11:18:11.3760000+00:00","Look what auto correct do to me","",""
"766280136332410920","ekast237707","2025-02-23T11:18:32.2510000+00:00","Yess my thing, otak ku ways","",""
"753112518658097183","p3d_pilot","2025-02-23T11:18:44.4440000+00:00","https://www.instagram.com/reel/DGZ0oEcyGRe/?igsh=MWl5dXB3c3k0bmdtaA== Luhut mengakui beliau bukan Karbit waifu","",""
"691290530117713956","yisan","2025-02-23T11:19:18.5690000+00:00","brainrot lol","",""
"143747199677890561","yo_yoji","2025-02-23T11:22:33.9430000+00:00","Gunbuster enjoyer looking from far away","",""
"766280136332410920","ekast237707","2025-02-23T11:33:48.6420000+00:00","Even before Neon Genesis Evangelion.., wow such a great Wisdom","",""
"143747199677890561","yo_yoji","2025-02-23T11:35:40.2890000+00:00","Patlabor > Neon Genesis Evangelion","",""
"691290530117713956","yisan","2025-02-23T11:39:06.8490000+00:00","they due for a remake","",""
"691290530117713956","yisan","2025-02-23T11:39:18.3440000+00:00","new series in 2026 i heard.","",""
"427539190629007362","maddiw","2025-02-23T11:39:28.5860000+00:00","y'all olddd","",""
"427539190629007362","maddiw","2025-02-23T11:39:38.4490000+00:00","this is zoomer forum (im not a zoomer)","",""
"691290530117713956","yisan","2025-02-23T11:39:53.7820000+00:00","i hope there is no solo levelling coqsucker here.","",""
"427539190629007362","maddiw","2025-02-23T11:40:51.5480000+00:00","https://tenor.com/view/cat-sung-jin-woo-solo-leveling-manhwa-cat-gif-22195290","",""
"691290530117713956","yisan","2025-02-23T11:43:03.2630000+00:00","lol","",""
"143747199677890561","yo_yoji","2025-02-23T11:44:22.2970000+00:00","Duh, discrimination 😦","",""
"766280136332410920","ekast237707","2025-02-23T11:46:51.6690000+00:00","No i think buzzer need advisor from the great Wisdom, ancient lost technology, before covid and tiktok destroy the human brain","",""
"766280136332410920","ekast237707","2025-02-23T11:47:34.6910000+00:00","Aka Brainrot","",""
"766280136332410920","ekast237707","2025-02-23T11:50:14.9390000+00:00","I love 90 est anime like Patlabor, Magic Knight Rayearth, Escaflowne, I don't know why that 3 all women pilot, maybe emancipation..","",""
"691290530117713956","yisan","2025-02-23T11:51:18.0080000+00:00","the pilot is women because clamp....","",""
"766280136332410920","ekast237707","2025-02-23T11:51:52.8830000+00:00","Yes but Sunrise?","",""
"143747199677890561","yo_yoji","2025-02-23T11:52:15.5120000+00:00","I think CLAMP fair enough for gender equal for their mangas","",""
"766280136332410920","ekast237707","2025-02-23T11:52:17.0350000+00:00","And author of Patlabor","",""
"691290530117713956","yisan","2025-02-23T11:52:31.0540000+00:00","the source of material is clamp for rayearth.","",""
"691290530117713956","yisan","2025-02-23T11:53:18.6330000+00:00","as for patlabor if the pilot is a man no one will watch it, not enough drama.","","🔥 (1)"
"143747199677890561","yo_yoji","2025-02-23T11:53:28.6000000+00:00","Sadly, for now CLAMP work as character designer than make a series","",""
"691290530117713956","yisan","2025-02-23T11:54:04.7180000+00:00","being called out as a plagiarist damaged their reputation.","",""
"143747199677890561","yo_yoji","2025-02-23T11:55:12.7660000+00:00","Who called CLAMP plagiat? Never hear about that","",""
"691290530117713956","yisan","2025-02-23T11:55:16.9520000+00:00","although i really think xxxholic need a continuation.","",""
"143747199677890561","yo_yoji","2025-02-23T11:55:29.9040000+00:00","Me too","",""
"691290530117713956","yisan","2025-02-23T11:56:04.9710000+00:00","its about time Yuuko become an adult again.","",""
"766280136332410920","ekast237707","2025-02-23T11:56:12.9970000+00:00","I just remember clamp member mokona apapa, yes sad, but tbh i don't follow Clamp after Code Geass, suzaku & lelouch, the mecha knightmere clamp design is unique, thats 2010 anime that i love, and kobato..","",""
"143747199677890561","yo_yoji","2025-02-23T11:56:56.3480000+00:00","I nvr know CLAMP also mecha designer for code geass","",""
"766280136332410920","ekast237707","2025-02-23T11:57:44.2040000+00:00","Yes try, it said money maker project that time, all Star Sunrise Collect to make that anime","",""
"691290530117713956","yisan","2025-02-23T11:57:48.8390000+00:00","look it up man, its all over the news back then.","",""
"691290530117713956","yisan","2025-02-23T11:58:28.5450000+00:00","you can always see the distinct character design from clamp tbh.","",""
"691290530117713956","yisan","2025-02-23T11:58:42.1860000+00:00","the mecha is sunrise though","",""
"691290530117713956","yisan","2025-02-23T11:59:36.4300000+00:00","btw the new code geass anime is hot garbage.","",""
"691290530117713956","yisan","2025-02-23T11:59:44.6210000+00:00","try not to watch it.","",""
"143747199677890561","yo_yoji","2025-02-23T12:00:33.6430000+00:00","This one: https://www.animenewsnetwork.com/news/2021-03-28/tokyo-babylon-2021-anime-canceled-with-restart-planned-after-more-plagiarism-uncovered/.171243 ?","",""
"691290530117713956","yisan","2025-02-23T12:01:04.4960000+00:00","yeah more or less","",""
"691290530117713956","yisan","2025-02-23T12:01:20.6340000+00:00","they have been hiding under the rock since then.","",""
"1064369916351889448","fellowmen","2025-02-23T12:11:06.6880000+00:00","My most fav works from clamp is X/1999","",""
"766280136332410920","ekast237707","2025-02-23T12:11:15.6730000+00:00","Yes sadly after I check it say Akira Yasuda the creator of mecha design, clamp is the original character design only...","",""
"1064369916351889448","fellowmen","2025-02-23T12:11:36.8620000+00:00","Great manga, great production value for it's anime, and great OP","",""
"766280136332410920","ekast237707","2025-02-23T12:12:08.9720000+00:00","","https://cdn.discordapp.com/attachments/1342873250354565150/1343193681150349322/image0.jpg?ex=69965558&is=699503d8&hm=bb75bf863d3258a608e32fa58dafbec316f049648ebd19f34bb1e3a0b880e1b7&",""
"1064369916351889448","fellowmen","2025-02-23T12:12:18.7630000+00:00","Yes that one","",""
"1064369916351889448","fellowmen","2025-02-23T12:12:37.6220000+00:00","But why there is lelouch there?","",""
"766280136332410920","ekast237707","2025-02-23T12:12:43.6490000+00:00","And from the artbook no robot find except mask of zero","",""
"1064369916351889448","fellowmen","2025-02-23T12:13:07.2160000+00:00","Man for me the best mecha is still Gundam. Yes, Gundam amuro vs char","",""
"691290530117713956","yisan","2025-02-23T12:13:31.1610000+00:00","escaflowne is better imo.","",""
"1064369916351889448","fellowmen","2025-02-23T12:13:35.2410000+00:00","And spaceship Yamato dont forget it. I know it's not mecha, it's space drama but still","",""
"691290530117713956","yisan","2025-02-23T12:13:37.7570000+00:00","or dunbine","",""
"766280136332410920","ekast237707","2025-02-23T12:13:53.8140000+00:00","Cowboy beebop destroy all","",""
"766280136332410920","ekast237707","2025-02-23T12:14:16.2100000+00:00","The resist is futile","",""
"1064369916351889448","fellowmen","2025-02-23T12:14:33.6400000+00:00","No anime can compete with it, but I put space dandy to contend with cowboy bebop","",""
"1064369916351889448","fellowmen","2025-02-23T12:14:37.6220000+00:00","I love space dandy","",""
"1064369916351889448","fellowmen","2025-02-23T12:15:05.2420000+00:00","Well maybe for escaflowne it's for different market I guess?","",""
"1064369916351889448","fellowmen","2025-02-23T12:15:27.4530000+00:00","I love Gundam, we can see tomino still hold that darkness when he create the first Gundam","",""
"691290530117713956","yisan","2025-02-23T12:16:00.7120000+00:00","ehh","",""
"691290530117713956","yisan","2025-02-23T12:16:23.1040000+00:00","it died with witch from mercury.","",""
"1064369916351889448","fellowmen","2025-02-23T12:16:41.5360000+00:00","I mean what I love is amuro vs char","",""
"1064369916351889448","fellowmen","2025-02-23T12:16:45.9350000+00:00","Not after it","",""
"691290530117713956","yisan","2025-02-23T12:16:56.2180000+00:00","and the new gundam eva thing..... uninspired.","",""
"1064369916351889448","fellowmen","2025-02-23T12:17:26.3910000+00:00","When you knew the plot behind zeon to make people of the earth to leave the earth","",""
"766280136332410920","ekast237707","2025-02-23T12:17:28.7780000+00:00","But i love Macross too, Shonen and shoujo blend anime","",""
"1064369916351889448","fellowmen","2025-02-23T12:17:31.2680000+00:00","It's beautiful","",""
"143747199677890561","yo_yoji","2025-02-23T12:17:51.1640000+00:00","Macross era end on Macross Frontier","",""
"1064369916351889448","fellowmen","2025-02-23T12:17:59.2680000+00:00","And for characters itself, they have one same goal, but they keep misunderstand each other so","",""
"766280136332410920","ekast237707","2025-02-23T12:18:10.8590000+00:00","Yes Delta is for wota","",""
"1064369916351889448","fellowmen","2025-02-23T12:18:11.6570000+00:00","Macross 7 my man, I love it","",""
"766280136332410920","ekast237707","2025-02-23T12:18:15.4850000+00:00","Only","",""
"143747199677890561","yo_yoji","2025-02-23T12:18:48.9270000+00:00","Is macross 7 fire bomber thing?","",""
"1064369916351889448","fellowmen","2025-02-23T12:19:33.0280000+00:00","Yes that one","",""
"1064369916351889448","fellowmen","2025-02-23T12:19:35.3070000+00:00","Wkwkk","",""
"143747199677890561","yo_yoji","2025-02-23T12:19:51.1220000+00:00","I watching macross and macross frontier 😅","",""
"1064369916351889448","fellowmen","2025-02-23T12:19:55.4690000+00:00","I love they were trying different things","",""
"143747199677890561","yo_yoji","2025-02-23T12:20:06.8660000+00:00","Nvr watching series between it","",""
"1064369916351889448","fellowmen","2025-02-23T12:20:08.7310000+00:00","Of course Macross frontier is GOAT","",""
"1064369916351889448","fellowmen","2025-02-23T12:20:42.4300000+00:00","I think Macross already stopped their series when eureka seven comes out","",""
"1064369916351889448","fellowmen","2025-02-23T12:20:57.5500000+00:00","Maybe I'm wrong but I don't know","",""
"143747199677890561","yo_yoji","2025-02-23T12:21:39.8540000+00:00","For now I watching aquarion moe even the chara designer so cartoonist likes powerpuff girl","",""
"691290530117713956","yisan","2025-02-23T12:22:00.5570000+00:00","you should see aldnoah zero then, hated back then but i think people are too harsh on it.","",""
"1064369916351889448","fellowmen","2025-02-23T12:22:30.0160000+00:00","Aquarion Evol? Wkwkk maybe darling in the franxx did better job than aquarion","",""
"143747199677890561","yo_yoji","2025-02-23T12:22:37.7840000+00:00","Aldnoah 0 so drama, not like it also not hate it","",""
"143747199677890561","yo_yoji","2025-02-23T12:23:02.2910000+00:00","Majestice prince even better","",""
"1064369916351889448","fellowmen","2025-02-23T12:23:05.3870000+00:00","It still disappointing anime, it has great start, but man what pussy ending","",""
"143747199677890561","yo_yoji","2025-02-23T12:23:22.3340000+00:00","Evol good","",""
"766280136332410920","ekast237707","2025-02-23T12:23:48.5320000+00:00","Macross consist of three main thing Pilot, Songstress, and Mecha VF Variable Fighter","",""
"1064369916351889448","fellowmen","2025-02-23T12:23:50.9750000+00:00","Yes it is good for what it is.","",""
"1064369916351889448","fellowmen","2025-02-23T12:24:19.3510000+00:00","But darling in the franxx so hype and people so weebs about itu. Everyone forget about aquorion evol","",""
"143747199677890561","yo_yoji","2025-02-23T12:24:24.5260000+00:00","DiF more better than aquarion? Ok, we have different taste","",""
"1064369916351889448","fellowmen","2025-02-23T12:24:46.7650000+00:00","No, I don't like for both of those anime","",""
"691290530117713956","yisan","2025-02-23T12:24:48.3640000+00:00","no one remember fafner lol","",""
"1064369916351889448","fellowmen","2025-02-23T12:25:07.5480000+00:00","I just said what anime has more effect on people between those two","",""
"143747199677890561","yo_yoji","2025-02-23T12:25:13.2080000+00:00","I remember fafner but nvr watching the lastest series","",""
"143747199677890561","yo_yoji","2025-02-23T12:25:28.7990000+00:00","I see","",""
"766280136332410920","ekast237707","2025-02-23T12:25:32.9700000+00:00","Have everyone try mobile fighter G Gundam Domon Kashu and Master Asia, its awsome","","🤣 (1)"
"1064369916351889448","fellowmen","2025-02-23T12:25:43.9020000+00:00","Wasn't fafner character art style same as Gundam seed?","",""
"143747199677890561","yo_yoji","2025-02-23T12:25:52.3490000+00:00","Yes","",""
"691290530117713956","yisan","2025-02-23T12:25:55.1000000+00:00","the same lol","",""
"1064369916351889448","fellowmen","2025-02-23T12:25:56.4120000+00:00","It's guilty pleasure anime","",""
"143747199677890561","yo_yoji","2025-02-23T12:25:58.6630000+00:00","Same chara designer","",""
"766280136332410920","ekast237707","2025-02-23T12:26:14.0400000+00:00","Yes yes that political game","",""
"691290530117713956","yisan","2025-02-23T12:26:15.6160000+00:00","its strangely a bit racist now lol","",""
"1064369916351889448","fellowmen","2025-02-23T12:26:18.0520000+00:00","Combination between dragon ball z and Gundam hawza you get domon","",""
"143747199677890561","yo_yoji","2025-02-23T12:26:26.1960000+00:00","Before seed, the chara designer work for s-CRY-ed","",""
"766280136332410920","ekast237707","2025-02-23T12:26:50.0550000+00:00","Anime has tough me that the only one that can surpass China is Hongkong","",""
"1064369916351889448","fellowmen","2025-02-23T12:26:53.6220000+00:00","Wkwkwk it is political anime","",""
"143747199677890561","yo_yoji","2025-02-23T12:27:20.9870000+00:00","More political than code geass?","",""
"1064369916351889448","fellowmen","2025-02-23T12:27:27.0790000+00:00","Do we need transfer our discussion about Gundam to #⊱・🗺️・international-discussion @Buzzer beneran ?","",""
"691290530117713956","yisan","2025-02-23T12:27:28.5130000+00:00","ehh i think the last political anime i remember is 86","",""
"1064369916351889448","fellowmen","2025-02-23T12:27:30.8840000+00:00","Wkwkwk","",""
"143747199677890561","yo_yoji","2025-02-23T12:27:33.3580000+00:00","I not watching g gundam","",""
"766280136332410920","ekast237707","2025-02-23T12:28:12.4720000+00:00","Its basically a robot war disguese as a country war","",""
"1064369916351889448","fellowmen","2025-02-23T12:28:18.9360000+00:00","You should watch Babylon. Great anime","",""
"1064369916351889448","fellowmen","2025-02-23T12:28:43.2810000+00:00","Well code Geass is intended to be political anime","",""
"1064369916351889448","fellowmen","2025-02-23T12:28:54.2180000+00:00","But G Gundam is more rich in politics I guess","",""
"691290530117713956","yisan","2025-02-23T12:28:56.7050000+00:00","the one where people jumped from building? i think i have watched that","",""
"766280136332410920","ekast237707","2025-02-23T12:29:17.7780000+00:00","You should watch Isekai Kantai skill its like Suikoden game","",""
"1064369916351889448","fellowmen","2025-02-23T12:29:43.4830000+00:00","You should complete it","",""
"1064369916351889448","fellowmen","2025-02-23T12:30:25.4800000+00:00","I mean G Gundam, you can see what kind of Gundam to represent each nation","",""
"1064369916351889448","fellowmen","2025-02-23T12:30:34.7200000+00:00","It is racist but man it's good.","",""
"766280136332410920","ekast237707","2025-02-23T12:30:42.0030000+00:00","I havent watch Babylon what story?..","",""
"1064369916351889448","fellowmen","2025-02-23T12:31:11.1350000+00:00","It start from some people allow suicide to be allowed in japan","",""
"1064369916351889448","fellowmen","2025-02-23T12:31:20.1840000+00:00","Then bham","",""
"1064369916351889448","fellowmen","2025-02-23T12:31:40.1510000+00:00","I mean suicide policy. It is politics","",""
"766280136332410920","ekast237707","2025-02-23T12:32:22.7330000+00:00","If you play gundam battle asault and like to play domon, shining  or God Gundam you should watch g Gundam, and if you like God in Gundam","",""
"766280136332410920","ekast237707","2025-02-23T12:34:04.4860000+00:00","I think i have see the cover, isnt it girl face in top floor building","",""
"766280136332410920","ekast237707","2025-02-23T12:34:16.8840000+00:00","I don't know","",""
"1064369916351889448","fellowmen","2025-02-23T12:34:18.8040000+00:00","Try it man","",""
"766280136332410920","ekast237707","2025-02-23T12:35:52.0700000+00:00","I have many old Wisdom, of ancient Civilization Anime list that i havent watch because I busy watch new anime, like a ton of Isekai anime","",""
"766280136332410920","ekast237707","2025-02-23T12:36:19.5580000+00:00","Even no game no. Live I havent watch","",""
"691290530117713956","yisan","2025-02-23T12:36:29.5460000+00:00","most isekai are slop lol","",""
"766280136332410920","ekast237707","2025-02-23T12:37:10.6300000+00:00","I fall in that rabbit hole because of mecha Isekai bro title knight and magics","",""
"766280136332410920","ekast237707","2025-02-23T12:37:33.7790000+00:00","Mecha, robot is my weakness","",""
"691290530117713956","yisan","2025-02-23T12:37:35.0170000+00:00","one of the better one but still kinda sloppy.","",""
"766280136332410920","ekast237707","2025-02-23T12:38:21.8650000+00:00","You know Bones Yureka 7 thats my favorit, my fetish","",""
"766280136332410920","ekast237707","2025-02-23T12:38:52.2170000+00:00","I love to have love with mother's earth descendant","",""
"691290530117713956","yisan","2025-02-23T12:39:09.5710000+00:00","https://myanimelist.net/anime/53446/Tondemo_Skill_de_Isekai_Hourou_Meshi
wacky premise, surpisingly good.","",""
"1064369916351889448","fellowmen","2025-02-23T12:39:45.0220000+00:00","Isekai genre born because japanese men dream to have their life  to be reset. They feel robbed because work-life they had to endure","",""
"691290530117713956","yisan","2025-02-23T12:40:01.6590000+00:00","escapeism","",""
"1064369916351889448","fellowmen","2025-02-23T12:40:11.7890000+00:00","Correct","",""
"766280136332410920","ekast237707","2025-02-23T12:40:21.9910000+00:00","Yes one right answer, but many spektrum of answer I think","",""
"1064369916351889448","fellowmen","2025-02-23T12:40:29.4610000+00:00","It is sad to see Isekai prosper. Because escapeism","",""
"766280136332410920","ekast237707","2025-02-23T12:41:14.7770000+00:00","First it contain the essence of fetish japan that is medieval Europa","",""
"1064369916351889448","fellowmen","2025-02-23T12:41:40.1000000+00:00","Wkwkwk Japan is still fetishing westerners","",""
"143747199677890561","yo_yoji","2025-02-23T12:41:43.0800000+00:00","After read this I realise why Indonesian wibu love isekai","",""
"1064369916351889448","fellowmen","2025-02-23T12:41:53.5740000+00:00","If you see Naruto and bleach. Their mc has blond hair","",""
"1064369916351889448","fellowmen","2025-02-23T12:41:59.0920000+00:00","Think about that shit","",""
"1064369916351889448","fellowmen","2025-02-23T12:42:16.7410000+00:00","Even Goku has more power when he turned blond","",""
"766280136332410920","ekast237707","2025-02-23T12:43:11.0170000+00:00","Yes even in early anime they potray real Eropah, like candy candy","",""
"1064369916351889448","fellowmen","2025-02-23T12:43:27.5060000+00:00","Exactly","",""
"766280136332410920","ekast237707","2025-02-23T12:43:27.9100000+00:00","Rose of the Versailles","",""
"1064369916351889448","fellowmen","2025-02-23T12:43:41.8440000+00:00","Them japanese love those blonds","",""
"1064369916351889448","fellowmen","2025-02-23T12:44:12.4020000+00:00","And they think those blonds so superior, that the best manga out there has blonde mc in it","",""
"143747199677890561","yo_yoji","2025-02-23T12:44:44.5250000+00:00","Isn't that because Naruto is depicted as light while Sasuke is depicted as darkness?","",""
"766280136332410920","ekast237707","2025-02-23T12:45:03.8520000+00:00","And you must be blond if you want get into western internasional audiance","",""
"1064369916351889448","fellowmen","2025-02-23T12:45:07.0830000+00:00","Naruto blond Sasuke black hair","",""
"143747199677890561","yo_yoji","2025-02-23T12:45:12.5310000+00:00","Light vs Darkness is common on shounen story","",""
"1064369916351889448","fellowmen","2025-02-23T12:45:35.2540000+00:00","I think both of them has those dark power","",""
"1064369916351889448","fellowmen","2025-02-23T12:45:55.9840000+00:00","Kyubi in earlier presentation is like demonized fox","",""
"1064369916351889448","fellowmen","2025-02-23T12:46:00.9150000+00:00","Before they make it cute","",""
"1064369916351889448","fellowmen","2025-02-23T12:46:40.9060000+00:00","Wow @Buzzer beneran your #⊱・🎴・animanga is thriving with discussion","",""
"143747199677890561","yo_yoji","2025-02-23T12:47:40.7440000+00:00","Yes, but Naruto with his blond hair use that darkness power for good purpose/reason","",""
"766280136332410920","ekast237707","2025-02-23T12:48:48.2980000+00:00","You know who is blonde in one Piece and hxh?.?","",""
"1064369916351889448","fellowmen","2025-02-23T12:49:00.7870000+00:00","And that's what japanese love naruto. It's about westerner(Naruto) try to blend in Japan. People hate him first, and then gradually they accept them as their own","",""
"766280136332410920","ekast237707","2025-02-23T12:49:01.3510000+00:00","That is Sanji and kurapica","",""
"1064369916351889448","fellowmen","2025-02-23T12:49:13.2630000+00:00","I think it's like shogun story","",""
"1064369916351889448","fellowmen","2025-02-23T12:49:32.6760000+00:00","That's right, even Luffy hair now is white","",""
"143747199677890561","yo_yoji","2025-02-23T12:49:33.6700000+00:00","Meanwhile, Sasuke with his black hair uses the power of darkness to fight Naruto, although in the end the two become friends again.","",""
"1064369916351889448","fellowmen","2025-02-23T12:49:37.0470000+00:00","To be sun god nika","",""
"766280136332410920","ekast237707","2025-02-23T12:49:41.7600000+00:00","One Piece came out later after Naruto","",""
"1064369916351889448","fellowmen","2025-02-23T12:49:59.8770000+00:00","Those japanese sure hate themselves to be black hair","",""
"766280136332410920","ekast237707","2025-02-23T12:50:23.9030000+00:00","And HxH not very populer, I have a conspiracy theory","",""
"766280136332410920","ekast237707","2025-02-23T12:50:39.0180000+00:00","Because Kurapika clan is all dead","",""
"766280136332410920","ekast237707","2025-02-23T12:50:50.2600000+00:00","And thats mean..","",""
"766280136332410920","ekast237707","2025-02-23T12:51:23.0940000+00:00","Yoshihiro Togahashi is something else I love HXH","",""
"766280136332410920","ekast237707","2025-02-23T12:52:20.3750000+00:00","I think they just need time to self love because there is Samurai X and Ninja Hattori","",""
"1064369916351889448","fellowmen","2025-02-23T12:52:38.2910000+00:00","Battosai - Red Hair","",""
"1064369916351889448","fellowmen","2025-02-23T12:53:09.0160000+00:00","But I love vagabond and berserk. Which it's MC has black hair, and struggling to reach their goal","",""
"766280136332410920","ekast237707","2025-02-23T12:53:09.1190000+00:00","Kenshin Himura","",""
"143747199677890561","yo_yoji","2025-02-23T12:53:28.1150000+00:00","This is a depiction of having killed many people including his wife's fiancé.","",""
"766280136332410920","ekast237707","2025-02-23T12:53:29.2640000+00:00","Yes like Kyoto","",""
"1064369916351889448","fellowmen","2025-02-23T12:53:38.5500000+00:00","I think it's true for Japan value if you use vagabond and berserk","",""
"766280136332410920","ekast237707","2025-02-23T12:53:57.0980000+00:00","Its be bland of foedal and futuristik japan","",""
"1064369916351889448","fellowmen","2025-02-23T12:54:11.5110000+00:00","Then you should watch Akira","",""
"1064369916351889448","fellowmen","2025-02-23T12:54:23.4750000+00:00","It's probably self depicting story about Japan","",""
"224842428505391104","thegreenlampoon","2025-02-23T12:54:32.7700000+00:00","So many wibu guys in Indognesia.","",""
"766280136332410920","ekast237707","2025-02-23T12:54:34.0330000+00:00","Have watch, but i don't get it i sleep","",""
"766280136332410920","ekast237707","2025-02-23T12:55:12.0310000+00:00","I don't like Wibu japanese wannabe terms","",""
"1064369916351889448","fellowmen","2025-02-23T12:55:14.7830000+00:00","No we are otaku, please separate us from wibu","",""
"766280136332410920","ekast237707","2025-02-23T12:55:22.2010000+00:00","I more like Otak ku","",""
"224842428505391104","thegreenlampoon","2025-02-23T12:55:25.7020000+00:00","Arr rook same to me.
Maaf mas bro.","",""
"1064369916351889448","fellowmen","2025-02-23T12:55:32.7840000+00:00","Hahahaha","",""
"1064369916351889448","fellowmen","2025-02-23T12:55:41.6250000+00:00","I knew you are joking. It's good man","",""
"224842428505391104","thegreenlampoon","2025-02-23T12:55:55.0180000+00:00","Yeah, I think the only serious manga I've read is One Piece","",""
"766280136332410920","ekast237707","2025-02-23T12:56:10.1350000+00:00","I. Like all entertainment japan korean china, Amerika, Eropah Indonesia","",""
"1064369916351889448","fellowmen","2025-02-23T12:56:10.4810000+00:00","One piece is a safe choice","",""
"224842428505391104","thegreenlampoon","2025-02-23T12:56:11.9560000+00:00","I started in Marineford and went back before continuing.","",""
"224842428505391104","thegreenlampoon","2025-02-23T12:56:32.4130000+00:00","We had an amazing subbing scene in Indonesia back in the 2000s-2010s.","",""
"1064369916351889448","fellowmen","2025-02-23T12:56:48.6330000+00:00","Maybe because one piece has so many Indonesian reference they use for manga","",""
