AuthorID,Author,Date,Content,Attachments,Reactions
"425585007906783232","gksubrata","2025-03-11T16:32:07.8740000+00:00","@perantau98 @Raden Go nuts","","👍 (1)"
"474936118786129940","perantau98","2025-03-11T16:33:39.9830000+00:00","Nice","",""
"474936118786129940","perantau98","2025-03-11T16:34:43.6920000+00:00","Ahh Malaysian politics, the shit show that never fails to keep on giving shit","",""
"474936118786129940","perantau98","2025-03-11T16:35:38.6830000+00:00","Ask me more on Malaysia here","",""
"425585007906783232","gksubrata","2025-03-11T16:38:13.4320000+00:00","Changed the channel name: Malaysian Politics","",""
"1169256316821307447","greshniki._.","2025-03-11T16:47:17.8810000+00:00","whatever happened to jho low lmao","",""
"474936118786129940","perantau98","2025-03-11T16:47:27.3310000+00:00","In hiding","",""
"1169256316821307447","greshniki._.","2025-03-11T16:47:32.4340000+00:00","did the funds from them ever get recovered","",""
"1169256316821307447","greshniki._.","2025-03-11T16:47:35.3540000+00:00","aw man","",""
"474936118786129940","perantau98","2025-03-11T16:47:56.9560000+00:00","Nope. Some were but some nope.","","sad (1)"
"474936118786129940","perantau98","2025-03-11T16:48:19.5680000+00:00","Overall, recovery process is slow. But the current gov said almost done","",""
"1169256316821307447","greshniki._.","2025-03-11T16:50:25.5350000+00:00","aw man","",""
"1169256316821307447","greshniki._.","2025-03-11T16:51:21.6810000+00:00","on a scale from 1-10 how would you rate the last 5 years in m'sia polticis","",""
"474936118786129940","perantau98","2025-03-11T16:52:30.0450000+00:00","Scale it on how bad or how good?","",""
"1169256316821307447","greshniki._.","2025-03-11T16:54:01.6340000+00:00","how bad 1 being worst 10 being very good","",""
"474936118786129940","perantau98","2025-03-11T16:54:24.0520000+00:00","5","",""
"474936118786129940","perantau98","2025-03-11T16:55:12.5190000+00:00","Solid boring 5. Just a bunch of soft coup attempts, racial politics and “guys chill think about the economy”.","",""
"1169256316821307447","greshniki._.","2025-03-11T16:56:56.6380000+00:00","im just imagining the malaysian parliament consisting of everyone throwing racial slurs at everyone and someone going ""guys the economy"" and everyone just locks in for a quick second before going back to slur throwing","",""
"474936118786129940","perantau98","2025-03-11T16:58:11.4160000+00:00","The parliament sadly is more civil than that. But still a circus nevertheless.","",""
"474936118786129940","perantau98","2025-03-11T16:58:39.1070000+00:00","It is the politics on the street campaign levels that you see the shit show.","",""
"474936118786129940","perantau98","2025-03-14T10:22:59.5430000+00:00","","https://cdn.discordapp.com/attachments/1349057306624790609/1350051580438909020/IMG_3506.jpg?ex=69963bc3&is=6994ea43&hm=e5d17098c5dcde76e6ae776d6c429c598d71f067f52010229cf1def957c8933a&",""
"474936118786129940","perantau98","2025-03-14T10:23:06.8010000+00:00","","https://cdn.discordapp.com/attachments/1349057306624790609/1350051610717327390/IMG_3484.jpg?ex=69963bca&is=6994ea4a&hm=97930e87345c7e0976c8c54a430c092b7f77a768fd104a3ff455fcebbffe8a42&",""
"474936118786129940","perantau98","2025-03-14T10:25:06.4360000+00:00","","https://cdn.discordapp.com/attachments/1349057306624790609/1350052112553480212/IMG_3519.jpg?ex=69963c42&is=6994eac2&hm=f916ba76d92b0ff78b09c54749067a62d5ee72c90d97a9b38c5cf4e40cf91338&",""
"474936118786129940","perantau98","2025-03-14T10:25:44.9250000+00:00","","https://cdn.discordapp.com/attachments/1349057306624790609/1350052273933520896/IMG_3520.jpg?ex=69963c68&is=6994eae8&hm=e76ebb01a5ef23c2b8028d0a4a15b7140268875f490fb0fe76bda2f81034c50e&",""
"474936118786129940","perantau98","2025-03-14T10:28:20.5810000+00:00","","https://cdn.discordapp.com/attachments/1349057306624790609/1350052926847979584/IMG_3523.jpg?ex=69963d04&is=6994eb84&hm=3a49383bef979f0466e19d5acf0913f74394acd64e632d6ab99b77ceb0b05335&",""
"474936118786129940","perantau98","2025-03-14T11:52:40.7420000+00:00","@Sirmuda do you think the Malaysian government has data on all Bruneians?","",""
"1268106650200444992",".sirmuda","2025-03-14T12:04:09.6290000+00:00","I dont think so","",""
"1268106650200444992",".sirmuda","2025-03-14T12:05:14.4520000+00:00","Brunei doesn't have politics btw","",""
"474936118786129940","perantau98","2025-03-14T12:07:18.4930000+00:00","We know","",""
"474936118786129940","perantau98","2025-03-14T12:07:57.7680000+00:00","I kinda think so, for those who cross the border.","",""
"1268106650200444992",".sirmuda","2025-03-14T12:24:38.1860000+00:00","I guess but we don't really focus on immigration a lot","",""
"1268106650200444992",".sirmuda","2025-03-14T12:27:33.7820000+00:00","We do have a party that is either we don't know or we don't care about it. The National Development Party (NDP). They don't do shit. It's registered and legalized in 2005.","",""
"1268106650200444992",".sirmuda","2025-03-14T12:29:24.1260000+00:00","If you were to ask what the NDP is, it's literally almost like a joke party cause they swore their loyalty to the Sultan and MIB, They are full of old people, they don't do any political activities but instead looks like a retirement organization","",""
"474936118786129940","perantau98","2025-03-14T12:39:33.7350000+00:00","I am more interested in a Brunei without oil. The running joke is that you will join Malaysia. But I don’t think that is the case, but you need to be a full fledged micronation that practices dubious offshore financing.","",""
"474936118786129940","perantau98","2025-03-14T12:40:03.2520000+00:00","Which Labuan is already doing at your doorstep","",""
"1268106650200444992",".sirmuda","2025-03-14T12:40:49.6650000+00:00","We are not interested in joining Malaysia if you know what I mean (1960-63). Bcuz we are nationalist, we always say Brunei is Brunei.","",""
"1268106650200444992",".sirmuda","2025-03-14T12:41:08.9210000+00:00","Even if our oil and gas runs out. We will still find more resources","",""
"1268106650200444992",".sirmuda","2025-03-14T12:41:23.2030000+00:00","But I don't think the 2035 Vision will be achieved","",""
"474936118786129940","perantau98","2025-03-14T12:47:05.4990000+00:00","I mean, since a strong currency is already a factor. But, your defence is dependent on the British pact.","",""
"474936118786129940","perantau98","2025-03-14T12:47:36.7170000+00:00","We saw the development, it is the Sultan’s decision.","",""
"1268106650200444992",".sirmuda","2025-03-14T12:47:56.4020000+00:00","Not just the Brits, we also have singaporeans and Gurkhas","",""
"1268106650200444992",".sirmuda","2025-03-14T12:48:22.0540000+00:00","Sultan SOAS was good but Sultan Hassanal Bolkiah... **sigh**","",""
"474936118786129940","perantau98","2025-03-14T12:49:34.5260000+00:00","Singaporean defence pact to us is mehh. Good tech, but this will open doors for them to be attacked. Gurkha, is basically British.","",""
"474936118786129940","perantau98","2025-03-14T12:49:52.1540000+00:00","Btw, suku Melayu ke Murut ke Dusun?","",""
"1268106650200444992",".sirmuda","2025-03-14T12:50:03.6570000+00:00","Aku?","",""
"474936118786129940","perantau98","2025-03-14T12:50:10.4350000+00:00","Ye","",""
"1268106650200444992",".sirmuda","2025-03-14T12:50:18.8610000+00:00","Oh suku as in who i support or what","",""
"474936118786129940","perantau98","2025-03-14T12:50:32.6510000+00:00","Tak, darah apa?","",""
"1268106650200444992",".sirmuda","2025-03-14T12:50:44.8860000+00:00","Oh it's a bit confusing","",""
"1268106650200444992",".sirmuda","2025-03-14T12:50:51.9300000+00:00","I'm Chinese-Malay","",""
"474936118786129940","perantau98","2025-03-14T12:51:04.1720000+00:00","Muslim?","",""
"1268106650200444992",".sirmuda","2025-03-14T12:51:07.5270000+00:00","Tapi ada dusun and Tutong jua","",""
"1268106650200444992",".sirmuda","2025-03-14T12:51:13.1540000+00:00","Alhamdulillah au","",""
"474936118786129940","perantau98","2025-03-14T12:51:22.5780000+00:00","Au bana","",""
"474936118786129940","perantau98","2025-03-14T12:51:42.8250000+00:00","I see","",""
"1268106650200444992",".sirmuda","2025-03-14T12:51:55.0250000+00:00","Baru jua ku balik dari sembahyang terawih","",""
"474936118786129940","perantau98","2025-03-14T12:53:17.6660000+00:00","Ahhh, sebagai orang Melayu, Brunei ni bagus didirikan begitu je. Tapi ada nasi lemak tak?","",""
"474936118786129940","perantau98","2025-03-14T12:53:34.5750000+00:00","Kira moreh lepas terawih?","",""
"1268106650200444992",".sirmuda","2025-03-14T12:53:36.1980000+00:00","Adaa~","",""
"1268106650200444992",".sirmuda","2025-03-14T12:53:38.2920000+00:00","Ofc ada","",""
"1268106650200444992",".sirmuda","2025-03-14T12:53:50.2180000+00:00","Moreh ani apa ertinya?","",""
"474936118786129940","perantau98","2025-03-14T12:53:53.2660000+00:00","Pernah sampai KL?","",""
"1268106650200444992",".sirmuda","2025-03-14T12:54:05.8580000+00:00","Inda. Sarawak And Sabah sja","",""
"1268106650200444992",".sirmuda","2025-03-14T12:54:10.8640000+00:00","I wish","",""
"474936118786129940","perantau98","2025-03-14T12:54:10.9100000+00:00","Supper","",""
"1268106650200444992",".sirmuda","2025-03-14T12:54:24.1260000+00:00","Oh you mean time sahur?","",""
"474936118786129940","perantau98","2025-03-14T12:54:41.6500000+00:00","Lepas isyak biasanya","",""
"1268106650200444992",".sirmuda","2025-03-14T12:55:11.8630000+00:00","Ohh I know what you mean. Inda pulang. Selepas terawih, balik then tidur then sahur","",""
"474936118786129940","perantau98","2025-03-14T12:55:25.9640000+00:00","Ohhh, marilah ke Semenanjung sini.","",""
"474936118786129940","perantau98","2025-03-14T12:55:33.3630000+00:00","Ohhh","",""
"474936118786129940","perantau98","2025-03-14T12:57:58.4330000+00:00","Kalau ke Semenanjung, nanti boleh sampai Singapore, Batam, Pattani, Satun, Hatyai, lepas dah pusing 1 semenanjung lah.","",""
"1268106650200444992",".sirmuda","2025-03-14T12:58:12.0210000+00:00","Wuishh Siuk jua","",""
"474936118786129940","perantau98","2025-03-14T12:58:21.1240000+00:00","Syokkk","",""
"1268106650200444992",".sirmuda","2025-03-14T12:59:35.0400000+00:00","But idk why tapi my mom cakap KK is better than KL but who knows","",""
"474936118786129940","perantau98","2025-03-14T13:00:43.1680000+00:00","Kalau makan fresh food tu betul. Tapi KL banyak lagi yang boleh cuba. Culturally more diverse.","",""
"474936118786129940","perantau98","2025-03-14T13:01:09.6270000+00:00","Dan Semenanjung is more than just KL","",""
"1268106650200444992",".sirmuda","2025-03-14T13:01:29.3520000+00:00","Actually what I'm interested in KL rn are 3 things. Shopping mall, Gerai Ramadhan and restaurants","",""
"1268106650200444992",".sirmuda","2025-03-14T13:01:54.9050000+00:00","I keep seeing the good food arah kamu punya bazaar ahhh. Cam nyaman usulnyaa","",""
"474936118786129940","perantau98","2025-03-14T13:02:00.1730000+00:00","Kalau ada kerja di Brunei, boleh pass cv tak?","",""
"1268106650200444992",".sirmuda","2025-03-14T13:02:25.8810000+00:00","Boleh","",""
"474936118786129940","perantau98","2025-03-14T13:02:37.4570000+00:00","KL punya makan biasa je tapi cubalah. The best is of course setiap negeri punya makanan.","",""
"1268106650200444992",".sirmuda","2025-03-14T13:02:59.6170000+00:00","I actually wanna try nasi lemak burung hantu. I Heard it's the best","",""
"474936118786129940","perantau98","2025-03-14T13:03:24.3120000+00:00","Takdelah. Nasi lemak kat kampung lagi sedap hahahaha. Tapi boleh cuba. Sedap je.","",""
"1268106650200444992",".sirmuda","2025-03-14T13:03:41.0960000+00:00","Ahh I see","",""
"474936118786129940","perantau98","2025-03-14T13:04:38.5530000+00:00","Ni, try join keretapi sarong 16 September tahun ni. Hari Malaysia.","",""
"474936118786129940","perantau98","2025-03-14T13:05:04.3230000+00:00","Kat KL","",""
"1268106650200444992",".sirmuda","2025-03-14T13:05:06.9620000+00:00","Liatlah kalau ada duit 😅","",""
"1268106650200444992",".sirmuda","2025-03-14T13:05:16.6030000+00:00","I'm just a student anyways","",""
"474936118786129940","perantau98","2025-03-14T13:05:20.2530000+00:00","Duit kau besar. Takyah risau.","",""
"1268106650200444992",".sirmuda","2025-03-14T13:05:29.5730000+00:00","Woahhh","",""
"1268106650200444992",".sirmuda","2025-03-14T13:05:37.2010000+00:00","Wait that make sense","",""
"474936118786129940","perantau98","2025-03-14T13:05:44.5090000+00:00","500 dollar Brunei cukup je","",""
"1268106650200444992",".sirmuda","2025-03-14T13:05:47.7670000+00:00","1 BND-3RM","",""
"1268106650200444992",".sirmuda","2025-03-14T13:05:56.7940000+00:00","Boleh²","",""
"474936118786129940","perantau98","2025-03-14T13:06:18.3830000+00:00","500 tu pun banyak habis kat tiket kapal terbang","",""
"1079558513291964536","huhu_matcha","2025-03-14T13:06:22.7360000+00:00","What resources will you find?","",""
"474936118786129940","perantau98","2025-03-14T13:06:38.9500000+00:00","Offshore finance","",""
"1268106650200444992",".sirmuda","2025-03-14T13:07:19.7170000+00:00","I'm not sure but if there is not resources banar², we just follow style Singapore","",""
"1268106650200444992",".sirmuda","2025-03-14T13:07:37.1120000+00:00","We can do that I think","",""
"474936118786129940","perantau98","2025-03-14T13:07:43.0550000+00:00","Susah. Tapi boleh buat","",""
"474936118786129940","perantau98","2025-03-14T13:08:17.8450000+00:00","Low taxes for MNCs to set up shop. Tapi your country is the size of Seremban in population.","",""
"1268106650200444992",".sirmuda","2025-03-14T13:08:37.1390000+00:00","Cana jua, Sultan kami ada 300+ kereta mahal²... Duit Rakyat adalah gaji dan duit Tabung amanah pekerja sja","",""
"1268106650200444992",".sirmuda","2025-03-14T13:09:28.8420000+00:00","Unless rajin berbisnes","",""
"474936118786129940","perantau98","2025-03-14T13:09:41.8540000+00:00","HAHAHAHA, istana ada banyak bilik. Kalau tidur 1 malam 1 kamar, tak cukup 1 tahun untuk duduk istana tu.","",""
"1079558513291964536","huhu_matcha","2025-03-14T13:09:45.7640000+00:00","Singapore had the advantage of being a major port. Brunei? Unless you’re already developing a service-based industry now (which I doubt is happening)","",""
"1268106650200444992",".sirmuda","2025-03-14T13:10:23.4620000+00:00","Wr also have ports too. I live near ports","",""
"474936118786129940","perantau98","2025-03-14T13:11:04.7460000+00:00","Brunei will be a micronation that can do all of that. But they will be late in the game and they will require Singaporean and Malaysian expertise.","",""
"1079558513291964536","huhu_matcha","2025-03-14T13:11:09.4930000+00:00","Correct me if I’m wrong. Wasn’t there news a few months ago about the Sultan and taking girls against their will? I remember I read about it somewhere","",""
"1268106650200444992",".sirmuda","2025-03-14T13:11:35.5850000+00:00","Source pls","",""
"474936118786129940","perantau98","2025-03-14T13:11:37.3410000+00:00","This one is years ago stories.","",""
"474936118786129940","perantau98","2025-03-14T13:11:59.2570000+00:00","Too many girls, which one you wanna know? But mostly overseas.","",""
"1079558513291964536","huhu_matcha","2025-03-14T13:13:05.6560000+00:00","I know :sad:","",""
"474936118786129940","perantau98","2025-03-14T13:14:47.2680000+00:00","Tahu kan sultan kau ada 1 rumah besar kat KL?","",""
"1268106650200444992",".sirmuda","2025-03-14T13:15:06.0170000+00:00","Really? Yang aku tau di US and UK ada pulang","",""
"474936118786129940","perantau98","2025-03-14T13:15:07.7440000+00:00","Bukan kedutaan Brunei","",""
"474936118786129940","perantau98","2025-03-14T13:15:53.1200000+00:00","Ada kat Taman Bukit Tunku.","",""
"1268106650200444992",".sirmuda","2025-03-14T13:16:55.9990000+00:00","Wait I just checked. Ada rupanya","",""
"1268106650200444992",".sirmuda","2025-03-14T13:17:09.6610000+00:00","Typical Sultan","",""
"474936118786129940","perantau98","2025-03-14T13:17:29.2260000+00:00","I think that is a different property. Looks different from the one I usually pass by","",""
"474936118786129940","perantau98","2025-03-14T13:17:46.6020000+00:00","I think he has many properties in Malaysia. Hahahaha","",""
"474936118786129940","perantau98","2025-03-14T13:18:02.8770000+00:00","He can act tough in front of Malaysia’s Raja Raja Melayu","",""
"1268106650200444992",".sirmuda","2025-03-14T13:18:22.0230000+00:00","He even bought Beverly hills and now American left wingers were boycotting it due to Sharia law","",""
"1268106650200444992",".sirmuda","2025-03-14T13:18:29.5480000+00:00","Real","",""
"474936118786129940","perantau98","2025-03-14T13:18:59.1440000+00:00","What do you think about Azhari?","",""
"474936118786129940","perantau98","2025-03-14T13:19:23.5210000+00:00","The radical who tried to do a revolution in Brunei.","",""
"474936118786129940","perantau98","2025-03-14T13:19:39.4380000+00:00","Lol","",""
"474936118786129940","perantau98","2025-03-14T13:20:39.1940000+00:00","Btw, I have a pic of my agung, when he was just Sultan of Johor cium tangan your Sultan hahahaha. What a disgrace.","",""
"1268106650200444992",".sirmuda","2025-03-14T13:23:08.9140000+00:00","He was a good man. Not an extremist at least. I understand what he wants. He was a good friend with Sultan SOAS until Tunku Abdul Rahman offer brunei to join the Federation of Malaya which made Azahari angry. They won the election and started a revolt saying that Brunei will rule Sarawak, Sabah And Labuan and to from the Federation of North Kalimantan. I'm sorry to say this you might hate me about it but I support the FNK but I don't like the name of it. Azahari got exiled in Philippines then Indonesia. Then Sultan SOAS changed his mind and said to Tunku that Brunei will not join Malaya. I have mix feelings on both sultan and Azahari. Azahari was also Anti imperialist and want brunei to gain independence early","",""
"1268106650200444992",".sirmuda","2025-03-14T13:23:58.9140000+00:00","Oooo show me man","",""
"474936118786129940","perantau98","2025-03-14T13:25:13.1560000+00:00","","https://cdn.discordapp.com/attachments/1349057306624790609/1350097439096307802/IMG_3532.jpg?ex=69966679&is=699514f9&hm=f5c4f814d9f0d8f1c61f6530d14a9635aa936dd28ee70b5e09a401b6cc3c256d&",""
"1268106650200444992",".sirmuda","2025-03-14T13:25:56.5080000+00:00","Oh ani. Yeah we also post about the news in Borneo Bulletin (our main news)","",""
"474936118786129940","perantau98","2025-03-14T13:26:38.9520000+00:00","Mehhh, couldn’t be bothered about FNK. In fact, you guys might have done a good job.","",""
"474936118786129940","perantau98","2025-03-14T13:27:21.0280000+00:00","Malaysians are the least patriotic in this region.","",""
"1268106650200444992",".sirmuda","2025-03-14T13:28:28.5650000+00:00","Wait you asked me about Azahari. What you think of Anwar Ibrahim. I watched his movie and it was kinda based","",""
"474936118786129940","perantau98","2025-03-14T13:29:24.4500000+00:00","Meh, he is just a snake tbh. The movie is based but not his exact biography. He is a Machiavellian to the core.","",""
"474936118786129940","perantau98","2025-03-14T13:30:09.1830000+00:00","You know Abang Jo CM of Sarawak right? Abang Jo is a better leader than Anwar.","",""
"1268106650200444992",".sirmuda","2025-03-14T13:30:24.3990000+00:00","And I just learned that Perikatan Nasional is right-wing to **Far-Right**","",""
"1268106650200444992",".sirmuda","2025-03-14T13:30:40.6300000+00:00","Ofc. My dad said abang Jo is a good premier","",""
"1268106650200444992",".sirmuda","2025-03-14T13:30:57.4760000+00:00","I'm quite impressed after my dad showed me a few clips of his speeches","",""
"474936118786129940","perantau98","2025-03-14T13:31:13.8840000+00:00","Yeah, you need to learn that PAS calls the shot in Perikatan. And PAS is emulating Bruneian Hudud","",""
"474936118786129940","perantau98","2025-03-14T13:32:16.7170000+00:00","Yup, paying off education loan, cheap state funded affordable housing and many more.","",""
"1268106650200444992",".sirmuda","2025-03-14T13:32:30.7270000+00:00","It's funny to have Bruneian hudud when the royals break it themselves. The princess don't wear tudung And they are free to wear whatever they want. Even showing some skin","",""
"1268106650200444992",".sirmuda","2025-03-14T13:33:03.3540000+00:00","Sarawak is good but I think Limbang is a bit ghetto but it's ok lah","",""
"474936118786129940","perantau98","2025-03-14T13:33:07.9950000+00:00","I have seen one of your prince on British tabloid being somewhat open to be gei","",""
"1268106650200444992",".sirmuda","2025-03-14T13:33:44.7610000+00:00","Oh Prince Azim? My dad once met him in the 90s and he described him as being so gay and sounds pondan. I laughed so hard","",""
"474936118786129940","perantau98","2025-03-14T13:33:59.1100000+00:00","U should see other ghettos in Malaysia","",""
"474936118786129940","perantau98","2025-03-14T13:34:14.6430000+00:00","Yeah","",""
"1268106650200444992",".sirmuda","2025-03-14T13:34:19.2810000+00:00","Some parts in Miri is ghetto. But the rest is good","",""
"474936118786129940","perantau98","2025-03-14T13:34:50.7260000+00:00","You should come see more ghettos in Sabah, and Semenanjung.","",""
"1268106650200444992",".sirmuda","2025-03-14T13:35:11.7970000+00:00","I've seen Sabah. I wanna see semenanjung","",""
"474936118786129940","perantau98","2025-03-14T13:36:19.8400000+00:00","Okay, KL we have Bukit Bintang. A lot of Bangladeshi ghettos. Pudu, banyak ayam murah especially Pasar Pudu. Pelabuhan Klang.","",""
"1268106650200444992",".sirmuda","2025-03-14T13:37:11.7330000+00:00","Wuishh ayam murah. Berapa satu whole chicken. We think Malaysia is more cheaper than Brunei","",""
"474936118786129940","perantau98","2025-03-14T13:37:13.9690000+00:00","Then see Baling, Yan and ceruk2 Kedah like Changloon. Then see Kelantan at Rantau Panjang.","",""
"474936118786129940","perantau98","2025-03-14T13:37:39.9730000+00:00","Hahahaha ayam is code name for kupu kupu malam","",""
"1268106650200444992",".sirmuda","2025-03-14T13:37:59.2700000+00:00","Oooh lol","",""
"1268106650200444992",".sirmuda","2025-03-14T13:39:11.4050000+00:00","Ok. BSB, we have...uhh apa ah.. shopping mall damit jua ganya, a lot of diplomatic offices, kampong Ayer ofc, man not much, kadai²","",""
"474936118786129940","perantau98","2025-03-14T13:40:15.2140000+00:00","I think Miri has more kedais for you guys. But Klang Valley or colloquially KL is a city of 8 million people.","",""
"474936118786129940","perantau98","2025-03-14T13:40:44.4820000+00:00","So, the scale is huge for your standards. Banyak shopping mall and kedai and ghetto of all sorts","",""
"1268106650200444992",".sirmuda","2025-03-14T13:40:58.5770000+00:00","Man Miri is better, they have subway, Baskin Robbins, H&M, Uniqlo and more. We just to places where we don't have it here in Brunei","",""
"474936118786129940","perantau98","2025-03-14T13:41:32.5280000+00:00","Seremban has all of that. KL has more.","",""
"1268106650200444992",".sirmuda","2025-03-14T13:41:50.6880000+00:00","I can imagine 🥹","",""
"474936118786129940","perantau98","2025-03-14T13:42:16.5220000+00:00","C U mart, Family Mart, Chagee, Zus and anything branded.","",""
"1268106650200444992",".sirmuda","2025-03-14T13:43:04.9110000+00:00","We recently open our first Zus in Brunei. I want 7/11 and Family mart. I want one of those 24/7 convenient stores 😭","",""
"1268106650200444992",".sirmuda","2025-03-14T13:43:23.2090000+00:00","Watsons is better than guardian","",""
"474936118786129940","perantau98","2025-03-14T13:43:38.5550000+00:00","Yup","",""
"474936118786129940","perantau98","2025-03-14T13:45:08.1060000+00:00","Banyak lagi bro. Btw, all the Bruneian rap songs need to have a Malaysian market. Basically, you are Malaysia 2.0 in a lot of things.","",""
"1268106650200444992",".sirmuda","2025-03-14T13:45:53.4220000+00:00","Wait we talk about stores. How about education since I complete sekolah Menegah last year. What's SPM like","",""
"474936118786129940","perantau98","2025-03-14T13:46:04.1830000+00:00","Thailand 7/11 is better. Ngl. U should check out Thailand. And cheap shopping, Batam is good.","",""
"1268106650200444992",".sirmuda","2025-03-14T13:46:18.3200000+00:00","That make sense","",""
"474936118786129940","perantau98","2025-03-14T13:46:57.9200000+00:00","SPM is frustrating. Straight As is the goal. But not so tough I would say.","",""
"1268106650200444992",".sirmuda","2025-03-14T13:47:22.8960000+00:00","I heard most of the important subjects are in Bahasa Melayu. Wouldn't it be hard?","",""
"474936118786129940","perantau98","2025-03-14T13:47:26.6220000+00:00","Sekolah Menengah kat Brunei focus on STEM?","",""
"474936118786129940","perantau98","2025-03-14T13:47:46.9060000+00:00","My time was in English. That was 10 years ago","",""
"1268106650200444992",".sirmuda","2025-03-14T13:48:10.6160000+00:00","Science, Technology, Engineering and Mathematics? Hell yeah, both CCA and technical schools","",""
"1268106650200444992",".sirmuda","2025-03-14T13:48:36.4820000+00:00","You guys have o levels at least? In any states?","",""
"474936118786129940","perantau98","2025-03-14T13:48:48.8100000+00:00","Okay, percentage against subjek agama camne? And uni korang kalau bukan brunei, pergi mana?","",""
"474936118786129940","perantau98","2025-03-14T13:49:27.1880000+00:00","We have o levels. STPM is equivalent to A levels.","",""
"1268106650200444992",".sirmuda","2025-03-14T13:49:50.1140000+00:00","Agama which is Islamic Religious Knowledge, Ramai dapat credit. Kalau bukan uni di brunei, either Singapore, Malaysia, UK. Tapi for International school students lagi special. US","",""
"1268106650200444992",".sirmuda","2025-03-14T13:49:58.3880000+00:00","Ahh I see","",""
"474936118786129940","perantau98","2025-03-14T13:50:22.9300000+00:00","Sounds similar to Malaysia","",""
"474936118786129940","perantau98","2025-03-14T13:51:07.2870000+00:00","But how many elites are there in Brunei, population of 500k?","",""
