AuthorID,Author,Date,Content,Attachments,Reactions
"474936118786129940","perantau98","2025-09-27T13:44:12.2690000+00:00","I can recall the massacre on the Maduran population stonky in Sambas 1999. Literally a documentary of Dayaks going hunting for Madurans who came from the transmigration programs. Tragedi Sambas","",""
"474936118786129940","perantau98","2025-09-27T13:45:09.8400000+00:00","This is true due to the affirmative action policy put in place by the New Economic Policy that was put in place in the 70s. Later corruption and political rhetoric fuels the fascists on this.","",""
"456226577798135808","Deleted User","2025-09-27T13:45:40.3090000+00:00","got it from a fella","",""
"456226577798135808","Deleted User","2025-09-27T13:46:08.2960000+00:00","i suppose yes, but from that incident became the cataclyst for all of us to behave and become tolerable","",""
"456226577798135808","Deleted User","2025-09-27T13:46:15.7640000+00:00","because we dont want to repeat another ethnic war","",""
"456226577798135808","Deleted User","2025-09-27T13:46:23.9390000+00:00","our ethnic war in the 90s are awful","",""
"456226577798135808","Deleted User","2025-09-27T13:46:33.5300000+00:00","heads hanging around hips type shit","",""
"474936118786129940","perantau98","2025-09-27T13:49:07.1290000+00:00","Yeah, other than Kampung Barus which were anti-communist concentration camps. But now the communists are gone there is nothing of that magnitude. No segregation. Only education things happen.","",""
"474936118786129940","perantau98","2025-09-27T13:51:50.3180000+00:00","Yeah, but personally I wouldn’t call that a track record I would be proud of. I have seen many Dayaks doing demonstrations threatening fellow Indonesians from entering a certain area. Last year Ustaz Abdul Samad a Riau preacher had the Dayak communities put up demonstrations.","",""
"474936118786129940","perantau98","2025-09-27T13:54:26.5520000+00:00","Which felt like religious tension is up there.","",""
"456226577798135808","Deleted User","2025-09-27T13:55:34.9250000+00:00","i never said i was proud???","",""
"474936118786129940","perantau98","2025-09-27T14:02:10.0520000+00:00","This is tricky. I have commented once on @Buzzer beneran ‘s video on the intricacies of Malaysian racial politics. The silly thing is that this is a social contract in the 50s and some of it is constitutional like Perkara 153 buat kedudukan istimewa Melayu dan bumiputera. It is constitutional and many policies that are born from this passage of the constitution are being abused. UiTM and native land rights. There are such things of bumiputera quotas where properties are cheaper or Malay Land Reserve, Orang Asli Reserves, Negeri Sembilan Minangkabau Tanah Adat, Sabah and Sarawakian Native Titles on properties exist. Some can be degazette. Most of the bumiputera properties hold low values and are not really desirable even among bumiputeras due to the below market rates. So, many of these lands and properties are abandoned anyways. Unless we’re talking about Sabah where I am well-versed.","",""
"474936118786129940","perantau98","2025-09-27T14:03:06.7620000+00:00","I didn’t say you’re proud of it. I said I wouldn’t be proud of that history like how I am not proud of the KL racial riots on 13 May 1969.","",""
"474936118786129940","perantau98","2025-09-27T14:08:05.1340000+00:00","British parliamentary rules, to take away Perkara 153, we need 2/3 parliament to agree to abolish it with the blessing of the senate and the Agung. This is almost impossible to do under the current Malaysian political climate.","",""
"474936118786129940","perantau98","2025-09-27T14:17:27.8310000+00:00","Malaysian politics will always be cursed with no true left wing government. Every coalition needs a conservative party or two to be the winning coalition.","",""
"474936118786129940","perantau98","2025-09-27T14:17:55.5470000+00:00","So racism will always be the rhetoric.","",""
"474936118786129940","perantau98","2025-09-27T14:20:57.8500000+00:00","When Najib fell in 2018, Pakatan Harapan has 2 conservative parties and 2 liberal parties. In 2020, one of the conservative parties called Bersatu just bounce from the coalition because they said that the Malays are underrepresented. And they collapsed the Pakatan government overnight prior to the Covid lockdowns. This is a curse. Current Pakatan Harapan is working with UMNO to make the government. Alsooo a dangerous ball game. Another Malay racist political issue played and this government will fall too. This is the core issue.","",""
"1268106650200444992",".sirmuda","2025-09-27T14:30:56.1570000+00:00","Man. the more I see words, the more I sound dumb","",""
"892623309437542451","johnthesentientautomobile","2025-09-28T03:22:18.8490000+00:00","https://youtu.be/WunYXkxjwp0?si=bSuY_2pxgr3y8DMC","",""
"892623309437542451","johnthesentientautomobile","2025-09-28T03:22:49.9600000+00:00","Tak habis habis orang dengan awek wolfcut","",""
"892623309437542451","johnthesentientautomobile","2025-09-28T03:22:55.5520000+00:00","Overrated gile","",""
"892623309437542451","johnthesentientautomobile","2025-09-28T03:23:35.7030000+00:00","Oh we don't call them Chimal, just Chinese","",""
"474936118786129940","perantau98","2025-09-28T03:26:20.7390000+00:00","I like thick lushy hair and a girl who can pull off a mullet","",""
"892623309437542451","johnthesentientautomobile","2025-09-28T03:31:18.2840000+00:00","I actually don't mind","",""
"892623309437542451","johnthesentientautomobile","2025-09-28T03:31:33.1610000+00:00","Hell my girl can be bald but I'll still think she's hot","",""
"474936118786129940","perantau98","2025-09-28T04:22:01.0010000+00:00","Anyone wanna go to Tangerang on 18 October for a concert here?","",""
"474936118786129940","perantau98","2025-09-28T04:22:13.1360000+00:00","Sound Groove Festival Vol 2","",""
"474936118786129940","perantau98","2025-09-28T04:22:44.6400000+00:00","Ada Hindia, .Feast, Lomba Sihir, Juicy Luicy.","",""
"892623309437542451","johnthesentientautomobile","2025-09-28T13:04:41.8820000+00:00","Bold of you to assume I have either the time or money :__:","",""
"892623309437542451","johnthesentientautomobile","2025-09-28T13:04:58.4940000+00:00","Is ERK gonna be there?","",""
"474936118786129940","perantau98","2025-09-28T13:29:16.9960000+00:00","Jap","",""
"474936118786129940","perantau98","2025-09-28T13:29:34.9610000+00:00","","https://cdn.discordapp.com/attachments/1349057306624790609/1421851334524797049/IMG_8164.png?ex=6996677e&is=699515fe&hm=50e0f5e0520ddd5507a59ffe088328aae6e5eac9eba49ddd32ac18d158684d13&",""
"474936118786129940","perantau98","2025-09-28T13:29:39.9030000+00:00","Xde @Juanster","",""
"892623309437542451","johnthesentientautomobile","2025-09-28T13:46:40.1730000+00:00","Damn :__:","",""
"474936118786129940","perantau98","2025-09-28T13:47:43.1570000+00:00","Latihan Pestapora hari tu ada","",""
"892623309437542451","johnthesentientautomobile","2025-09-28T13:47:55.6520000+00:00","Pestapora tu aku dah tau","",""
"892623309437542451","johnthesentientautomobile","2025-09-28T13:48:01.1690000+00:00","Tapi kan diorang boikot","",""
"892623309437542451","johnthesentientautomobile","2025-09-28T13:48:12.4880000+00:00","Something to do with one of the sponsors","",""
"474936118786129940","perantau98","2025-09-28T15:08:41.9000000+00:00","Latihan kat Bukit Jalil maksud aku","",""
"474936118786129940","perantau98","2025-09-28T15:08:49.7960000+00:00","Aku sempatlah tengok","",""
"1064369916351889448","fellowmen","2025-09-29T02:32:31.3700000+00:00","Efek Rumah Kaca enthusiast? nice","",""
"766280136332410920","ekast237707","2025-09-29T02:38:07.0910000+00:00","Hallo, I am new, Morning 🙏🙏","",""
"766280136332410920","ekast237707","2025-09-29T02:38:25.2860000+00:00","Bara Suara mana Suaranya...","",""
"766280136332410920","ekast237707","2025-09-29T02:39:23.8510000+00:00","Suara Kayu mana Suaranya...","",""
"766280136332410920","ekast237707","2025-09-29T02:39:42.3180000+00:00","Baskara: Temukan Suara mu","","🤣 (1)"
"474936118786129940","perantau98","2025-09-29T13:28:10.3220000+00:00","Baskara: Tiada orang yang tidak bisa nyanyi

Me: Nok cermin pecoh hujan ribut kalau keluar suara.","",""
"474936118786129940","perantau98","2025-09-29T13:28:27.0650000+00:00","Anyone wanna go to Tangerang for a concert?🎵🎶🎸

18 October 2025, Sound Groove Festival Vol 2! 😎

I’ll be there. 😁

https://www.instagram.com/reel/DPLrUHZjweH/?igsh=bzl4cTNtZThpNXVu","","🔥 (1)"
"892623309437542451","johnthesentientautomobile","2025-10-01T07:06:49.8520000+00:00","Bangunkanku bila September berakhir 🗣️🔥","https://cdn.discordapp.com/attachments/1349057306624790609/1422842175573721138/IMG_20251001_150614.jpg?ex=69960dc9&is=6994bc49&hm=b400a9b57b30068d29fe174debd64152c626f0446466df50b22da8352ef96dc6&",""
"474936118786129940","perantau98","2025-10-01T10:02:27.8040000+00:00","U beat me to it","",""
"474936118786129940","perantau98","2025-10-01T10:02:33.4640000+00:00","Hahahahaha","",""
"474936118786129940","perantau98","2025-10-01T10:15:17.2380000+00:00","Btw, we made a collab post with the concert in Tangerang. 😆

https://www.instagram.com/reel/DPQg5E-Dh1J/?igsh=MWtjcTl2bGZ0NHl0bQ==","",""
"474936118786129940","perantau98","2025-10-01T10:18:15.4810000+00:00","","https://cdn.discordapp.com/attachments/1349057306624790609/1422890349763887185/IMG_8352.png?ex=69963aa7&is=6994e927&hm=f8ce6b9cc942c05e7134d8c05c08b7e009ad7efdf00a418e68ccf135966661a2&",""
"766280136332410920","ekast237707","2025-10-01T12:35:19.8850000+00:00","This Baskara poster is awesome, do in Malaysia play Pigeon Race too? Merpati Sawangan? It is mean to make forced peace with Music?...","",""
"474936118786129940","perantau98","2025-10-01T15:54:45.2260000+00:00","We don’t do pigeon race","",""
"766280136332410920","ekast237707","2025-10-01T19:36:26.1310000+00:00","Okay, Mike Tyson do Burung Dara Sawangan too... Btw","",""
"474936118786129940","perantau98","2025-10-01T22:34:55.3010000+00:00","Yup, I know that","",""
"766280136332410920","ekast237707","2025-10-01T23:52:27.5620000+00:00","Cool","",""
"1422214171180666890",".sirmuda.","2025-10-03T17:16:41.8790000+00:00","Hello","",""
"474936118786129940","perantau98","2025-10-04T13:15:23.3730000+00:00","Yo","",""
"474936118786129940","perantau98","2025-10-04T13:15:27.4700000+00:00","Wassup?","",""
"1422214171180666890",".sirmuda.","2025-10-04T14:06:36.6260000+00:00","Nothing much","",""
"474936118786129940","perantau98","2025-10-04T14:21:57.1030000+00:00","I mean, I feel ya. Come to Malaysia lah, more events here","",""
"892623309437542451","johnthesentientautomobile","2025-10-05T02:42:09.2380000+00:00","","https://cdn.discordapp.com/attachments/1349057306624790609/1424225118904647790/IMG_20251004_205126.jpg?ex=69967881&is=69952701&hm=a9db1c61d416f88663bdfa6a8dc564520f6ba92a6af45610810aeb135f8073cd&","👆 (1)"
"1422214171180666890",".sirmuda.","2025-10-05T04:39:40.3250000+00:00","Nothing to do in Brunei Man. My daily life is wake up, breakfast, kolej, jalan² time lunch (usually Thursday main pool), kolej, balik, sembahyang, tidur","",""
"892623309437542451","johnthesentientautomobile","2025-10-05T05:38:25.6050000+00:00","Yeah but you guys still had an emo band","",""
"1064369916351889448","fellowmen","2025-10-05T07:13:14.7910000+00:00","Emo what now","",""
"1422214171180666890",".sirmuda.","2025-10-05T10:35:27.4670000+00:00","I thought those were like the 2010s","",""
"1422214171180666890",".sirmuda.","2025-10-05T10:35:42.7270000+00:00","When Asians look emo af","",""
"892623309437542451","johnthesentientautomobile","2025-10-05T13:20:21.0590000+00:00","We should bring it back","",""
"892623309437542451","johnthesentientautomobile","2025-10-05T13:20:45.8420000+00:00","But I feel like bringing back British style post punk","",""
"892623309437542451","johnthesentientautomobile","2025-10-05T13:20:51.9660000+00:00","My friend wants shoegaze","",""
"741102379054792756","indonesien.","2025-10-05T14:53:12.5280000+00:00","Assalamualaikum","",""
"741102379054792756","indonesien.","2025-10-05T14:54:05.1580000+00:00","Korang ada tak lagu Malaysia zaman dulu masa perang lawan Indonesia?","",""
"474936118786129940","perantau98","2025-10-05T14:55:48.4040000+00:00","Ada","",""
"474936118786129940","perantau98","2025-10-05T14:56:01.4130000+00:00","Inilah Barisan Kita","",""
"741102379054792756","indonesien.","2025-10-05T14:57:07.9660000+00:00","itu je atau ada lagi?","",""
"474936118786129940","perantau98","2025-10-05T14:57:28.7300000+00:00","Yelah tu, x dating","",""
"474936118786129940","perantau98","2025-10-05T14:57:50.4060000+00:00","Itu yg mmg anti-Konfrontasi","",""
"474936118786129940","perantau98","2025-10-05T14:57:58.8310000+00:00","Lain biasa","",""
"474936118786129940","perantau98","2025-10-05T14:58:22.5370000+00:00","And yg lama2 xde sgt yg best","",""
"741102379054792756","indonesien.","2025-10-05T14:58:50.0740000+00:00","link kat yt ada tak?","",""
"474936118786129940","perantau98","2025-10-05T15:56:01.4640000+00:00","https://vt.tiktok.com/ZSURsPPrs/","","👍 (1)"
"1422214171180666890",".sirmuda.","2025-10-05T17:19:16.1400000+00:00","WOAHHHH GILA","",""
"1422214171180666890",".sirmuda.","2025-10-05T17:19:38.8260000+00:00","all the girls in my class are gatal. not the boys","",""
"892623309437542451","johnthesentientautomobile","2025-10-06T00:31:44.6560000+00:00","","https://cdn.discordapp.com/attachments/1349057306624790609/1424554688262443139/SPOILER_image0.jpg?ex=699659f0&is=69950870&hm=36e9f1de0af50a62a1cb1bd72af1c6338a02262a380f2907bbf91b574200b70e&",""
"892623309437542451","johnthesentientautomobile","2025-10-06T00:31:49.7890000+00:00","💀","",""
"474936118786129940","perantau98","2025-10-06T02:48:28.1260000+00:00","Ngilu bai baca","",""
"319135053890191360","eijussy","2025-10-07T11:14:03.9860000+00:00","@Juanster opinions about PMX please sir","",""
"892623309437542451","johnthesentientautomobile","2025-10-07T11:23:43.8610000+00:00","Surprisingly I don't have necessarily strong opinions of him, but I can tell he has a different pace compared to our previous prime ministers which could be a little controversial","",""
"319135053890191360","eijussy","2025-10-07T11:25:28.8900000+00:00","Controversial by how so?","",""
"892623309437542451","johnthesentientautomobile","2025-10-07T11:25:46.4090000+00:00","Simply put, they're not used to it","",""
"892623309437542451","johnthesentientautomobile","2025-10-07T11:26:34.0190000+00:00","He likes to take the slow and steady approach to keep Malaysia alive after the pandemic, maybe even bounce back","",""
"892623309437542451","johnthesentientautomobile","2025-10-07T11:27:31.2730000+00:00","While some people thought he was gonna do things drastically and instantaneously, which is obviously quite unrealistic","",""
"892623309437542451","johnthesentientautomobile","2025-10-07T11:27:42.8520000+00:00","Which is why they're quite upset","",""
"319135053890191360","eijussy","2025-10-07T11:27:43.2770000+00:00","I mean","",""
"319135053890191360","eijussy","2025-10-07T11:28:01.5400000+00:00","I’ve seen some people in some Malaysian subreddits straight up wanting to remove the NEP in a “when they become PM” scenario which is a Speedrun into being ousted","",""
"319135053890191360","eijussy","2025-10-07T11:28:37.0910000+00:00","Bro likes to take his time with his Madani framework","",""
"892623309437542451","johnthesentientautomobile","2025-10-07T11:29:09.3630000+00:00","Some Malaysian subreddits? You mean besides r/malaysia and r/bolehland?","",""
"319135053890191360","eijussy","2025-10-07T11:29:21.6000000+00:00","I forgot which sub","",""
"319135053890191360","eijussy","2025-10-07T11:29:34.6970000+00:00","But I have some opinions about r/Malaysia and bolehland","",""
"319135053890191360","eijussy","2025-10-07T11:29:42.9610000+00:00","They’re like two sides of the same coin for me LMAOOOO","",""
"892623309437542451","johnthesentientautomobile","2025-10-07T11:32:32.9540000+00:00","I don't bother with Reddit anymore so I don't know how it's like nowadays","",""
"199129645155745792","gingermusk","2025-10-08T04:28:33.5510000+00:00","hi, Indonesian asking. is the FAM controversy really shocking to all malaysian or is it only for football lovers' bubble?","",""
"751790602357702678","retropolism","2025-10-08T12:56:14.0580000+00:00","Anies better than Mahitler","",""
"605452468284817427","buzzer9229","2025-10-09T03:22:44.6170000+00:00","No Mahathir is above Jokowi levels, Anies doesn't come close. Anies is probably Anwar Ibrahim","",""
"605452468284817427","buzzer9229","2025-10-09T03:24:29.6010000+00:00","Mahathir is ideological but he's also a realist. Mahathir has a developmentalist mindset and an authoritarian streak. Mahathir is famous for his Malaysian ethnocentric nationalism, authoritarian developmentalism, and his distate for the West, choosing to ""Look East"" instead (modelling off of Japan and Taiwan and South Korea).","",""
"605452468284817427","buzzer9229","2025-10-09T03:25:53.9800000+00:00","The only one to match Mahathir in terms of prestige in Indonesia historically is Suharto, but right now the only one that comes close is Luhut.","","👍 (2)"
"766280136332410920","ekast237707","2025-10-09T06:14:24.0060000+00:00","Pak BJ Habibie? Buzz","",""
"766280136332410920","ekast237707","2025-10-09T06:15:17.6690000+00:00","ICMI :Cendikiawan Muslim","",""
"766280136332410920","ekast237707","2025-10-09T06:16:26.0910000+00:00","Anies Baswedan, Alm Azyumardi Azra, Komarudin Hidayat, Nurcholish Madjid, Cak Nun, Hidayat Nur Wahid...","",""
"766280136332410920","ekast237707","2025-10-09T06:17:33.7610000+00:00","Why Cendikiawan, Cerdik Pandai is like rare in Indonesia?","",""
"736550209068335135",".ayab","2025-10-09T14:20:45.0920000+00:00","Why Luhut Buzzer?","",""
"605452468284817427","buzzer9229","2025-10-09T15:11:32.9760000+00:00","program program mercusuar sukses","",""
"1422214171180666890",".sirmuda.","2025-10-10T00:33:32.1840000+00:00","selamat pagi","",""
"474936118786129940","perantau98","2025-10-10T08:32:53.9140000+00:00","Nahhh","",""
"474936118786129940","perantau98","2025-10-10T08:34:08.9700000+00:00","Petang","",""
"474936118786129940","perantau98","2025-10-10T08:41:38.4370000+00:00","https://www.channelnewsasia.com/asia/malaysia-budget-2026-anwar-ibrahim-finance-minister-5393941","",""
"474936118786129940","perantau98","2025-10-13T02:33:12.9270000+00:00","Selamat Pagi","",""
"766280136332410920","ekast237707","2025-10-13T03:24:34.1490000+00:00","Selamat Pagi juga","",""
"474936118786129940","perantau98","2025-10-13T06:54:28.5520000+00:00","Kentut jap","",""
"892623309437542451","johnthesentientautomobile","2025-10-14T02:15:42.2860000+00:00","Selamat pagi","",""
"766280136332410920","ekast237707","2025-10-14T02:56:05.6090000+00:00","Aku Jawab Selamat pagi lagi, yeay","",""
"199129645155745792","gingermusk","2025-10-14T08:37:11.5450000+00:00","selamat petang","",""
"474936118786129940","perantau98","2025-10-14T09:01:00.9980000+00:00","Asal mana bang?","",""
"892623309437542451","johnthesentientautomobile","2025-10-14T09:22:04.7640000+00:00","https://youtube.com/shorts/bUbFibQOtVw?si=fBLgDgrVI62rbjc-","",""
"1422214171180666890",".sirmuda.","2025-10-14T11:29:41.6380000+00:00","Our average Saturday night to midnight music","",""
"1422214171180666890",".sirmuda.","2025-10-14T11:29:51.2320000+00:00","Then on Sunday night is jazz","",""
"892623309437542451","johnthesentientautomobile","2025-10-14T11:31:27.5110000+00:00","I noticed that one of our local English radio stations *really* likes playing 80s new wave and synthpop","",""
"892623309437542451","johnthesentientautomobile","2025-10-14T11:31:37.2880000+00:00","But in certain slots","",""
"892623309437542451","johnthesentientautomobile","2025-10-14T11:31:49.6000000+00:00","Shout-out Traxx FM","",""
"892623309437542451","johnthesentientautomobile","2025-10-14T11:31:56.4660000+00:00","The only segment I pay attention to","",""
"1422214171180666890",".sirmuda.","2025-10-14T13:10:15.0100000+00:00","Brunei Radio Stations like Kristal FM 90.7 usually play 80s around 4:30 or 5PM","",""
"892623309437542451","johnthesentientautomobile","2025-10-14T13:13:36.8270000+00:00","What's with Kristal FM playing Slipknot in the middle of the night?","",""
"892623309437542451","johnthesentientautomobile","2025-10-14T13:13:46.6620000+00:00","How popular is metal music there even?","",""
"1422214171180666890",".sirmuda.","2025-10-14T22:05:02.5170000+00:00","I have ZERO clue.","",""
"1422214171180666890",".sirmuda.","2025-10-14T22:05:24.9610000+00:00","Man I don't even know what they are thinking","",""
"892623309437542451","johnthesentientautomobile","2025-10-15T00:06:03.9870000+00:00","https://youtu.be/J1NMv0UJ7Lc?si=OlKix_1KhZyO0QY0","",""
"892623309437542451","johnthesentientautomobile","2025-10-15T00:06:12.5450000+00:00","Well I bet you didn't expect this","",""
"1422214171180666890",".sirmuda.","2025-10-15T01:52:04.9070000+00:00","Funny cause I'm currently studying in Belait","",""
"892623309437542451","johnthesentientautomobile","2025-10-15T01:54:07.2270000+00:00","How is it?","",""
"892623309437542451","johnthesentientautomobile","2025-10-15T01:54:16.7980000+00:00","Do you go home during the weekends?","",""
"199129645155745792","gingermusk","2025-10-15T02:15:01.0880000+00:00","jakarta🫡","",""
"1422214171180666890",".sirmuda.","2025-10-15T04:10:09.6780000+00:00","I mean I enjoy IBTE but sometimes it sucks. I'm about to do a presentation on Radical Politics later","",""
"1422214171180666890",".sirmuda.","2025-10-15T04:10:19.0690000+00:00","Friday","",""
"1422214171180666890",".sirmuda.","2025-10-15T04:10:54.5440000+00:00","I lov how Miri is literally just next door","",""
"892623309437542451","johnthesentientautomobile","2025-10-15T04:15:57.0990000+00:00","Have you ever considered Curtin?","",""
"892623309437542451","johnthesentientautomobile","2025-10-15T04:16:08.5410000+00:00","I once had beef with Miri","",""
"892623309437542451","johnthesentientautomobile","2025-10-15T04:16:36.4510000+00:00","Because in the entirety of Sarawak's Pan Borneo, their portion takes the longest to complete and I think they're still not finished","",""
"892623309437542451","johnthesentientautomobile","2025-10-15T04:17:02.8670000+00:00","Not only that, their (old) bus terminal sucks ass and inexcusable for the second biggest city in Sarawak","",""
"892623309437542451","johnthesentientautomobile","2025-10-15T04:18:07.5810000+00:00","Cuz even Bintulu, the fourth biggest city has a really good bus terminal","",""
"1422214171180666890",".sirmuda.","2025-10-15T04:19:31.2910000+00:00","Will wait for my BM result next year. Im not sure what are the requirements","",""
"892623309437542451","johnthesentientautomobile","2025-10-15T04:22:46.5890000+00:00","I hope you'll be fine","",""
"892623309437542451","johnthesentientautomobile","2025-10-15T04:22:56.9640000+00:00","I got a bunch of friends who goes to Curtin","",""
"892623309437542451","johnthesentientautomobile","2025-10-15T04:23:03.2150000+00:00","Or Swinburne in Kuching","",""
"892623309437542451","johnthesentientautomobile","2025-10-15T04:23:12.8170000+00:00","But both are expensive af","",""
"1422214171180666890",".sirmuda.","2025-10-15T06:20:27.3810000+00:00","I mean Im Taking engineering in IBTE so will see","",""
"436220883808419841","edennottheproject","2025-10-15T10:32:43.1120000+00:00","Changed the channel name: South East Asian Politics","",""
"892623309437542451","johnthesentientautomobile","2025-10-15T11:00:02.9020000+00:00","Which branch of engineering?","",""
"1422214171180666890",".sirmuda.","2025-10-15T11:00:27.9150000+00:00","Building Services Engineering","",""
"474936118786129940","perantau98","2025-10-15T14:23:56.4110000+00:00","This is the Greater Malaysia Politics Channel @eden is busy | do not ping! 

It’s a cursed channel and shall remain so hahahaha. We don’t discuss other than Malaysia and Brunei here. 

A better name would be Outdonesia 🤣","","👍 (2)"
"474936118786129940","perantau98","2025-10-15T14:24:33.2170000+00:00","Jkjk, but Outdonesia would be nice. Would be a missed opportunity here if it’s not renamed as such.","",""
"474936118786129940","perantau98","2025-10-15T14:52:33.3430000+00:00","Man what’s up with these kids graping and unaliving other kids? Is pornography to be blamed together with whatever incel-esque literature? @Juanster","",""
"474936118786129940","perantau98","2025-10-15T14:52:45.0960000+00:00","Adik2 kita ni orait tak?","",""
"892623309437542451","johnthesentientautomobile","2025-10-15T14:53:02.6480000+00:00","Oh damn that's under civil engineering","",""
"892623309437542451","johnthesentientautomobile","2025-10-15T14:53:11.1920000+00:00","Alright so","",""
"892623309437542451","johnthesentientautomobile","2025-10-15T14:53:16.3000000+00:00","You could just say kill","",""
"892623309437542451","johnthesentientautomobile","2025-10-15T14:53:24.7160000+00:00","Dah tentu tak","",""
"892623309437542451","johnthesentientautomobile","2025-10-15T14:53:48.6730000+00:00","But I believe it's not a good idea to blame everything on a single party/factor","",""
"892623309437542451","johnthesentientautomobile","2025-10-15T14:54:00.3310000+00:00","It's a culmination of individual experiences","",""
"892623309437542451","johnthesentientautomobile","2025-10-15T14:54:30.6970000+00:00","In particular with the Bandar Utama murder case, clearly he's not right in the head and probably spent time in the incel-space","",""
"892623309437542451","johnthesentientautomobile","2025-10-15T14:55:02.4200000+00:00","But we also don't know much about his upbringing or his family so it may play a role there for all we know","",""
"892623309437542451","johnthesentientautomobile","2025-10-15T14:56:07.9200000+00:00","Regarding the graping incident, they're a bunch of immensely horny losers who bonded over their horniness and disregard for consent","",""
