AuthorID,Author,Date,Content,Attachments,Reactions
"892623309437542451","johnthesentientautomobile","2025-10-27T10:59:29.3830000+00:00","","https://cdn.discordapp.com/attachments/1349057306624790609/1432322810457624668/IMG_20251027_112156.jpg?ex=69964451&is=6994f2d1&hm=b6d76e008d7f93527c5806ab6c250baa51a048e8597c979e87e0fcb5b0a39366&",""
"751790602357702678","retropolism","2025-10-27T16:07:30.6030000+00:00","It's different thing","",""
"1422214171180666890",".sirmuda.","2025-10-27T23:56:52.4610000+00:00","Ik","",""
"1422214171180666890",".sirmuda.","2025-10-27T23:57:04.1700000+00:00","I don't know what to say so I just start yapping","",""
"1422214171180666890",".sirmuda.","2025-10-27T23:58:05.6160000+00:00","sometimes it doesn't make sense or it's out of topic","",""
"474936118786129940","perantau98","2025-10-29T12:02:21.3320000+00:00","Weh geng","",""
"474936118786129940","perantau98","2025-10-29T12:03:12.2260000+00:00","Ada sesiapa yg dah baca agreement USA ngan kita tak? Kita as in Malaysia.","",""
"474936118786129940","perantau98","2025-10-29T12:03:25.3560000+00:00","Aku lom sempat baca","",""
"1422214171180666890",".sirmuda.","2025-10-30T03:03:04.3770000+00:00","Yoo","",""
"1422214171180666890",".sirmuda.","2025-10-30T03:03:08.9560000+00:00","Share kan if ada","",""
"474936118786129940","perantau98","2025-10-30T14:50:04.3120000+00:00","Finally on mandatory leave","",""
"474936118786129940","perantau98","2025-10-30T14:50:11.0360000+00:00","Will read up","",""
"474936118786129940","perantau98","2025-10-31T11:11:41.6800000+00:00","On my way to Blok M","",""
"892623309437542451","johnthesentientautomobile","2025-11-01T10:27:45.0400000+00:00","💀","https://cdn.discordapp.com/attachments/1349057306624790609/1434126762580906076/IMG_20251031_094045.jpg?ex=69963ce0&is=6994eb60&hm=0f64806316bf4b4c61a4684af1369294883ffe6c35bd1b58c78156a461a0b985&","💀 (5)"
"766280136332410920","ekast237707","2025-11-01T10:56:03.0500000+00:00","Mungkin salah paham aja","",""
"766280136332410920","ekast237707","2025-11-01T10:56:18.9570000+00:00","Pernah bangga jadi ahli nasi?","",""
"766280136332410920","ekast237707","2025-11-01T10:56:38.6800000+00:00","Bangga pakai logo SW RIA","",""
"1422214171180666890",".sirmuda.","2025-11-01T11:10:32.3600000+00:00","Nazis in the Malay peninsula? :__:","",""
"892623309437542451","johnthesentientautomobile","2025-11-01T11:12:45.6850000+00:00","Nah the title was deadass ""BANGGA PAKAI LOGO SWASTIKA""","",""
"892623309437542451","johnthesentientautomobile","2025-11-01T11:13:58.3870000+00:00","You'd be surprised to see a lot of people justifying Hitler's actions, especially ever since the genocide against Gaza became more and more dominant in today's political climate","",""
"892623309437542451","johnthesentientautomobile","2025-11-01T11:14:26.7150000+00:00","Which is definitely the wrong way to express support because Jews aren't the only people Hitler tried to eliminate","",""
"1422214171180666890",".sirmuda.","2025-11-01T11:15:03.1270000+00:00","Even if all my friends are apolitical, they love Nazis.","",""
"1422214171180666890",".sirmuda.","2025-11-01T11:17:10.2790000+00:00","Or even if one likes history, they might say ""Oh, Amin Al-Huseeini side with Hitler. No?""","",""
"766280136332410920","ekast237707","2025-11-01T11:29:39.4440000+00:00","I just reminded of mas @Melayunesian [2020-2025]🪦 , its sad... His guild been ban because of them","",""
"766280136332410920","ekast237707","2025-11-01T11:29:54.2980000+00:00","","https://cdn.discordapp.com/attachments/1349057306624790609/1434142403807154227/Screenshot_2025-11-01-18-28-15-379_com.discord.jpg?ex=69964b72&is=6994f9f2&hm=afe73bbbe66ca46d44096ef67b74062b478d4a50939cadf1daa7e54dd3da8a31&,https://cdn.discordapp.com/attachments/1349057306624790609/1434142404172054602/Screenshot_2025-11-01-18-26-03-777_com.discord.jpg?ex=69964b72&is=6994f9f2&hm=6c8528de67508a66eb8639568cf671cf3a2133cbd6427d06ed6118da5d2bbc17&",""
"605452468284817427","buzzer9229","2025-11-01T16:32:54.7330000+00:00","@perantau98 @Juanster what do Malaysians think of the KTT ASEAN","",""
"474936118786129940","perantau98","2025-11-01T16:34:54.0590000+00:00","Haven’t read up on the trade agreements made. Can’t give an opinion. Best I can gauge on sentiment is mixed, between being indifferent or hating the gov. Tho, most of the things from the summit are good.","",""
"892623309437542451","johnthesentientautomobile","2025-11-02T00:45:58.9190000+00:00","I also didn't know much about the trade agreements sadly","",""
"892623309437542451","johnthesentientautomobile","2025-11-02T00:46:37.9790000+00:00","Though I guess Donald Trump's visit definitely costed some trust towards the government, especially with the general public being anti-Israel","",""
"892623309437542451","johnthesentientautomobile","2025-11-02T00:46:52.3830000+00:00","In a way, they think the government is selling out","",""
"755356910760362024","bhagavangita","2025-11-03T15:44:54.2790000+00:00","yang dipertua dewan rakyat","",""
"892623309437542451","johnthesentientautomobile","2025-11-04T10:13:31.8310000+00:00",":smile: :smile: :smile:","https://cdn.discordapp.com/attachments/1349057306624790609/1435210347660443688/Screenshot_2025-11-04_180608.png?ex=6996398b&is=6994e80b&hm=0d055858d6fd0107e62951ba9509a4d143327f4a4019da4ab353507fe4360008&",""
"892623309437542451","johnthesentientautomobile","2025-11-05T06:13:41.4860000+00:00","","https://cdn.discordapp.com/attachments/1349057306624790609/1435512377759109202/Screenshot_2025-11-03-17-39-07-495_com.facebook.katana.jpg?ex=69960155&is=6994afd5&hm=4bc6c680fac8635f75ec241dbd30cdbc974c729278d95d4e204ce71247a99541&","💀 (4)"
"892623309437542451","johnthesentientautomobile","2025-11-05T06:13:44.5630000+00:00",":debating:","",""
"1422214171180666890",".sirmuda.","2025-11-05T12:26:24.3620000+00:00","","https://cdn.discordapp.com/attachments/1349057306624790609/1435606174744449084/Screenshot_20251105_202603_com_android_chrome_ChromeTabbedActivity.jpg?ex=699658b0&is=69950730&hm=5e3a84f8b980ed048a512cad79f3acd75567cc0aac1760c66ac025446c200633&",""
"474936118786129940","perantau98","2025-11-06T06:06:15.1370000+00:00","They learned from Carthaginians from the First Punic War","",""
"474936118786129940","perantau98","2025-11-06T08:33:04.2930000+00:00","@Melayunesian [2020-2025]🪦","https://cdn.discordapp.com/attachments/1349057306624790609/1435909841976692797/IMG_9970.png?ex=69962200&is=6994d080&hm=b199bba0b71e65d537859eb52a3dda015ffd371cbcaa3866415ad7e41c6be793&",""
"330558916582703116","hackersensei","2025-11-06T11:23:00.3360000+00:00","Ay malaysian fwllow ini pada dr mana saja @perantau98 n friends","",""
"330558916582703116","hackersensei","2025-11-06T11:23:09.3020000+00:00","aku mau kesana nanti","",""
"474936118786129940","perantau98","2025-11-06T11:24:17.6720000+00:00","Seremban but based in Kuala Lumpur","",""
"474936118786129940","perantau98","2025-11-06T11:24:20.4980000+00:00","Yuk mampir","",""
"474936118786129940","perantau98","2025-11-06T11:24:25.1370000+00:00","Monggo mas","",""
"474936118786129940","perantau98","2025-11-06T11:24:32.3730000+00:00","Langsung kita ketemu aja","",""
"330558916582703116","hackersensei","2025-11-06T11:24:59.8570000+00:00","Masih lama si bang aku desember","",""
"330558916582703116","hackersensei","2025-11-06T11:25:02.7330000+00:00","wkkwk","",""
"330558916582703116","hackersensei","2025-11-06T11:25:38.3760000+00:00","Ke genting, KL,etc","",""
"474936118786129940","perantau98","2025-11-06T12:17:17.9010000+00:00","Mantap","",""
"474936118786129940","perantau98","2025-11-06T12:17:37.0040000+00:00","Nanti kabarin aja","",""
"892623309437542451","johnthesentientautomobile","2025-11-06T23:19:27.2980000+00:00","https://www.instagram.com/reel/DQtMNZHj7mU/?igsh=MTI0aHVvOXVqc3ppMw==","",""
"330558916582703116","hackersensei","2025-11-06T23:50:46.8930000+00:00","Siap","",""
"605452468284817427","buzzer9229","2025-11-07T06:21:26.6240000+00:00","The union of the Austromalayu is difficult","",""
"605452468284817427","buzzer9229","2025-11-07T06:21:31.2970000+00:00","So much problems","",""
"605452468284817427","buzzer9229","2025-11-07T06:21:45.0080000+00:00","If you unite without tangible benefits then gaada tujuan nya","",""
"605452468284817427","buzzer9229","2025-11-07T06:21:58.1620000+00:00","If you unite based on rhetorics ya tolol juga sih","",""
"605452468284817427","buzzer9229","2025-11-07T06:22:28.1170000+00:00","A union between Indonesia, Malaysia, Singapore and Philippines technically must provide huge benefits for all","",""
"605452468284817427","buzzer9229","2025-11-07T06:22:40.0470000+00:00","If not ya semua orang mau pindah ke Malaysia and Singapore","",""
"605452468284817427","buzzer9229","2025-11-07T06:25:55.2020000+00:00","Union between these countries is impossible cause all the countries in this region has a lack of comparable development","",""
"605452468284817427","buzzer9229","2025-11-07T06:27:03.5450000+00:00","@Melayunesian [2020-2025]🪦 jadi if you want to unite Malaysia and Indonesia, don't just stop at the core and value, think about the technicals. You cannot expect an entire nation to combine with another nation just cause they speak similar languages, look the same and has the same cultural values or part of the  same ethnicity.","",""
"605452468284817427","buzzer9229","2025-11-07T06:27:12.1930000+00:00","GIMANA URUSAN DOMPET ANJING","",""
"605452468284817427","buzzer9229","2025-11-07T06:27:40.0740000+00:00","W KALO JDI ORG MALAYSIA JUGA KESEL NGELIAT INDON INDON ITU PINDAH OVERPOPULATE JOHOR","",""
"605452468284817427","buzzer9229","2025-11-07T06:31:17.7700000+00:00","WAHH JOB MARKET KL PENUH AMA ORANG ORANG BANYUWANGI AMA LAMPUNG","",""
"605452468284817427","buzzer9229","2025-11-07T06:31:35.4910000+00:00","you'd create an *internal* mass immigration problem","",""
"605452468284817427","buzzer9229","2025-11-07T06:31:57.4250000+00:00","you'd create the biggest fuck up a country can do as a country in the 21st century","",""
"605452468284817427","buzzer9229","2025-11-07T06:32:07.3090000+00:00","making up problems for yourself","",""
"605452468284817427","buzzer9229","2025-11-07T06:32:48.8890000+00:00","terus partai gimana jadi nya","",""
"605452468284817427","buzzer9229","2025-11-07T06:33:01.7550000+00:00","Barisan Nasional gak laku lagi dong","",""
"605452468284817427","buzzer9229","2025-11-07T06:33:45.5130000+00:00","Because politicians need to appeal to the bigger masses and Melayu mass is small compared to the Javanese mass if Indonesia-Malaysia becomes one country","",""
"605452468284817427","buzzer9229","2025-11-07T06:34:05.7960000+00:00","PDIP gimana njir","",""
"605452468284817427","buzzer9229","2025-11-07T06:34:12.2450000+00:00","no one in Malaysia is that left wing","",""
"605452468284817427","buzzer9229","2025-11-07T06:36:01.2730000+00:00","terus presiden nya siapa njir","",""
"605452468284817427","buzzer9229","2025-11-07T06:36:05.9020000+00:00","ibu kota nya dimana","",""
"605452468284817427","buzzer9229","2025-11-07T06:36:18.9950000+00:00","Ibu kota nya di KL","",""
"605452468284817427","buzzer9229","2025-11-07T06:36:37.7640000+00:00","Mampus itu KL, 400,000 PNS indon pindah ke KL Putrajaya","",""
"605452468284817427","buzzer9229","2025-11-07T06:37:06.1100000+00:00","Population terbanyak orang Indonesia kan","",""
"605452468284817427","buzzer9229","2025-11-07T06:37:13.9500000+00:00","obviously president bukan orang Malaysia punya","",""
"605452468284817427","buzzer9229","2025-11-07T06:37:22.9850000+00:00","Orang Malaysia mau gak","",""
"605452468284817427","buzzer9229","2025-11-07T06:38:09.7900000+00:00","Polisi deh","",""
"605452468284817427","buzzer9229","2025-11-07T06:38:25.6780000+00:00","How do Malaysians and Indonesians create the same police force","",""
"605452468284817427","buzzer9229","2025-11-07T06:38:53.3210000+00:00","Indonesian police force is centralized, militaristic, corrupt, very big","",""
"605452468284817427","buzzer9229","2025-11-07T06:39:08.2740000+00:00","Malaysian police force is more bureaucratic, civil servant like, decentralized, compact","",""
"605452468284817427","buzzer9229","2025-11-07T06:40:12.2810000+00:00","@Melayunesian [2020-2025]🪦 gimana man","",""
"605452468284817427","buzzer9229","2025-11-07T06:40:16.9930000+00:00","How do you address these issues","",""
"605452468284817427","buzzer9229","2025-11-07T06:40:36.2900000+00:00","Address law enforcement, economics, job market, migration, politics","",""
"474936118786129940","perantau98","2025-11-07T06:41:39.6960000+00:00","I believe in confederation of city states. The Srivijaya model. More of a union like European Union.","",""
"474936118786129940","perantau98","2025-11-07T06:42:10.8940000+00:00","Ours is more centralized","",""
"474936118786129940","perantau98","2025-11-07T06:44:14.9310000+00:00","Prosperity through trade. Tax collection is only by region.","",""
"474936118786129940","perantau98","2025-11-07T06:44:34.0510000+00:00","3 to 4 capital cities","",""
"474936118786129940","perantau98","2025-11-07T06:46:19.1170000+00:00","In PAP we believe","",""
"474936118786129940","perantau98","2025-11-07T06:47:12.9740000+00:00","The only tangible benefits is flow of goods and technology. Malaysia has so many to offer to Indonesia and the Philippines, vice versa.","",""
"474936118786129940","perantau98","2025-11-07T06:47:48.7860000+00:00","Flow of human capital is tough to say","",""
"474936118786129940","perantau98","2025-11-07T06:48:25.6000000+00:00","Military, Police and other civil service can unite.","",""
"474936118786129940","perantau98","2025-11-07T06:49:05.0330000+00:00","Idk, my plan is to purchase Riau and Kepri from Indonesia just to show how Riau and Kepri can transform overnight.","",""
"474936118786129940","perantau98","2025-11-07T06:49:13.8000000+00:00","Then slowly others can merge.","",""
"605452468284817427","buzzer9229","2025-11-07T06:50:18.7170000+00:00","Indonesians will be treated as second class citizens and cheap labor","",""
"605452468284817427","buzzer9229","2025-11-07T06:50:24.5710000+00:00","Same as Philippines","",""
"605452468284817427","buzzer9229","2025-11-07T06:50:37.7840000+00:00","We want a unity with dignity and equality","",""
"605452468284817427","buzzer9229","2025-11-07T06:50:43.3350000+00:00","Not a unity that profits one side","",""
"474936118786129940","perantau98","2025-11-07T06:50:56.8250000+00:00","I mean, a certain people group migrating in has always happen. The Bugis and Minang migration happened in Malaya, we can always allow other people to come in.","",""
"605452468284817427","buzzer9229","2025-11-07T06:51:23.8200000+00:00","Yes but international immigration makes it harder for people to go into Malaysia to look for work","",""
"605452468284817427","buzzer9229","2025-11-07T06:51:37.6550000+00:00","If Malaysia is just another place in the country","",""
"605452468284817427","buzzer9229","2025-11-07T06:51:48.5350000+00:00","People can go there without having to face immigration hurddles","",""
"605452468284817427","buzzer9229","2025-11-07T06:52:15.3530000+00:00","Indonesians are already treated second class in Malaysia, we'd be damned if Indonesia unites and is still second class 😄","",""
"474936118786129940","perantau98","2025-11-07T06:52:40.0090000+00:00","This is neo-colonial fear. Tough to say but a strong constitution will prevent this. This rhetoric was used by Sabahans and Sarawakians and Kelantanese. When in fact, bureaucracy wise, fair. If the administration is unfair, our courts will protect.","",""
"474936118786129940","perantau98","2025-11-07T06:53:01.3690000+00:00","Hence, a union like the EU can prevent this.","",""
"605452468284817427","buzzer9229","2025-11-07T06:53:23.5740000+00:00","EU can only do it cause their economies are comparable though","",""
"474936118786129940","perantau98","2025-11-07T06:53:58.1680000+00:00","Working towards this. If I can prove what Riau could be like, we will definitely come into some form of a model nation.","",""
"605452468284817427","buzzer9229","2025-11-07T06:54:00.6760000+00:00","How do you control Indonesians and Filipinos flooding high GDP per capita places like Malaysia and Singapore","",""
"474936118786129940","perantau98","2025-11-07T06:54:15.0240000+00:00","Slow mergers hehe","",""
"474936118786129940","perantau98","2025-11-07T06:54:58.7060000+00:00","But question is sovereignty. Not gonna challenge NKRI Harga Mati, unless can purchase or referendum is set in provinces that are close to Malaysia.","",""
"605452468284817427","buzzer9229","2025-11-07T06:55:47.9000000+00:00","You know the central government and a majority of people around Indonesia is adverse to that idea","",""
"474936118786129940","perantau98","2025-11-07T06:56:24.6320000+00:00","Slow and steady. Flooding high income per capita places might seem like a disadvantage. But, our population are ageing fast as well. We will still import Indonesian labour as preferred labour for many industries except construction.","",""
"474936118786129940","perantau98","2025-11-07T06:57:05.8450000+00:00","Hence the harga mati part is tough. Indonesia is too unstable, one leave, all will leave. Which is tough.","",""
"474936118786129940","perantau98","2025-11-07T06:59:50.5910000+00:00","I know Manila and Jakarta are both adverse to such ideas. But Malaysia is never adverse to referendums. The Malaysia Agreement can always be null. Only problem with Malaysia, we lack the teeth for local authority. Sabah could have been rich if corruption was not rampant on the state level. It could be a country on its own.","",""
"474936118786129940","perantau98","2025-11-07T07:08:53.3380000+00:00","If only Malaysian Malay elites have the vision, and draft foreign policies to lobby the other elite families in each provinces, we would have destabilised Indonesia. Tapi Melayu malas berfikir. Kurang peduli.","",""
"1064369916351889448","fellowmen","2025-11-07T07:08:59.6500000+00:00","loh kelewat chat berharga, le me simak","",""
"474936118786129940","perantau98","2025-11-07T07:12:03.4920000+00:00","Mari, pandangan anda diterima","",""
"1064369916351889448","fellowmen","2025-11-07T07:13:16.4460000+00:00","aku intrigue kau menggunakan srivijaya model","",""
"474936118786129940","perantau98","2025-11-07T07:15:40.6460000+00:00","@Buzzer beneran I read your story was it yesterday or the day before on IG. I agree with the Chinese guy saying our people are not advanced enough in culture hence why corruption is in our DNA.","",""
"474936118786129940","perantau98","2025-11-07T07:16:09.3680000+00:00","Hard to admit, but, our people used to think that taking bribes are a form of tax. 🫠","",""
"474936118786129940","perantau98","2025-11-07T07:16:34.7710000+00:00","Srivijaya was super corrupt and is guilty of this on the Straits of Malacca.","",""
"474936118786129940","perantau98","2025-11-07T07:16:50.4560000+00:00","But Srivijaya lacked rivalries.","",""
"474936118786129940","perantau98","2025-11-07T07:17:56.8690000+00:00","Because everyone has a piece. Almost no military presence that is overwhelming. All soldiers are peasants and the King’s Guards (hulubalang)","",""
"474936118786129940","perantau98","2025-11-07T07:18:14.6670000+00:00","We don’t have a Confucious or a renaissance","",""
"474936118786129940","perantau98","2025-11-07T07:18:26.9520000+00:00","But doesn’t mean we’re too late","",""
"474936118786129940","perantau98","2025-11-07T07:18:58.5540000+00:00","I am seeing in real time Ferry Irwandi, Baskara Putra, you and Indah G @Buzzer beneran","",""
"474936118786129940","perantau98","2025-11-07T07:19:51.1680000+00:00","You guys have potential, Indonesia was waking up but now I am seeing it falling asleep again.","",""
"474936118786129940","perantau98","2025-11-07T07:20:13.3460000+00:00","Filipinos on the other hand need to abandon their Spanish American sentiment.","",""
"474936118786129940","perantau98","2025-11-07T07:20:38.4680000+00:00","Return to the Malay language","",""
"474936118786129940","perantau98","2025-11-07T07:21:35.3850000+00:00","I have a Malaysian friend, my primary school (SD) friend who is fond of the Philippines. While me, Indonesia.","",""
"474936118786129940","perantau98","2025-11-07T07:21:59.3450000+00:00","From the same town of Seremban 2","",""
"474936118786129940","perantau98","2025-11-07T07:22:28.0960000+00:00","We feel the deep connection but at the same time foreign.","",""
"474936118786129940","perantau98","2025-11-07T07:26:05.3330000+00:00","As long as there is a renaissance to produce valuable traits and high value products and to hinder rent-seeking behaviour, kita akan jadi bangsa yang maju.","",""
"1422214171180666890",".sirmuda.","2025-11-09T22:10:22.3900000+00:00","Aku tidur sakit belakang","",""
"1422214171180666890",".sirmuda.","2025-11-09T22:10:26.8090000+00:00",":pray:","",""
"1422214171180666890",".sirmuda.","2025-11-09T22:10:40.0460000+00:00","I don't know what I do in my sleep","",""
"1064369916351889448","fellowmen","2025-11-10T00:59:37.2700000+00:00","do the strecth sirmuda","",""
"474936118786129940","perantau98","2025-11-10T04:00:35.4090000+00:00","Same","",""
"892623309437542451","johnthesentientautomobile","2025-11-10T14:55:04.9440000+00:00","Wahai handai-handai sekalian, ingatlah pesanan hamba bawakan seikhlas hati ini","https://cdn.discordapp.com/attachments/1349057306624790609/1437455529546092694/IMG_20251110_225253.jpg?ex=69967b88&is=69952a08&hm=2c6731871a0b169f86dc9525b88d127ab730b5cbf42b0b10e039deb9f5fbfb2a&",""
"892623309437542451","johnthesentientautomobile","2025-11-13T06:25:41.8350000+00:00","Certified Tranung classic","https://cdn.discordapp.com/attachments/1349057306624790609/1438414502159847494/IMG_20251113_142303.jpg?ex=69960425&is=6994b2a5&hm=60326fdedebf412dd0f66abc2d2e4e87828d373fb26bca03c9c605fa4a43b79a&",""
"1422214171180666890",".sirmuda.","2025-11-13T06:29:46.0460000+00:00","I'm surprised Malaysia actually display such a thing","",""
"892623309437542451","johnthesentientautomobile","2025-11-13T06:30:52.2930000+00:00","It's probably just a Northern thing","",""
"892623309437542451","johnthesentientautomobile","2025-11-13T06:31:08.2350000+00:00","Cuz they're the most socially conservative parts of the country","",""
"428399814238273556","the.og.green","2025-11-13T06:47:30.1460000+00:00","is that a yamaha mx king I see","",""
"1064369916351889448","fellowmen","2025-11-13T07:28:48.7640000+00:00","bebek dan kopliing itu indonesia poenya","",""
"428399814238273556","the.og.green","2025-11-13T07:29:23.5110000+00:00","perlahan semakin sedikit karena matic","",""
"1064369916351889448","fellowmen","2025-11-13T07:29:54.8110000+00:00","karena ulah aerox dah","",""
"474936118786129940","perantau98","2025-11-13T09:39:13.8730000+00:00","East Coast Peninsular is Quran belt. I am surprised they haven’t televised the punishment or public caning of lesbians that were caught scissoring each other in their car.","",""
"1422214171180666890",".sirmuda.","2025-11-13T09:40:24.0860000+00:00","There is what scissoring?","",""
"474936118786129940","perantau98","2025-11-13T09:40:45.9560000+00:00","But then again, Melayu jaga aib","",""
"1422214171180666890",".sirmuda.","2025-11-13T09:40:46.9780000+00:00","I think I need cuci mata dulu Just to see what you wrote","",""
"1422214171180666890",".sirmuda.","2025-11-13T09:41:11.1880000+00:00","Bnr tu","",""
"474936118786129940","perantau98","2025-11-13T09:41:35.4210000+00:00","What, this went viral, Brunei not covering Malaysian news? I wonder how thick are your newspapers? 🤣","",""
"1422214171180666890",".sirmuda.","2025-11-13T09:42:11.9350000+00:00","Let me check Borneo Bulletin to actually make sure","",""
"474936118786129940","perantau98","2025-11-13T09:43:02.8560000+00:00","","https://cdn.discordapp.com/attachments/1349057306624790609/1438464167005782056/IMG_0276.png?ex=69963266&is=6994e0e6&hm=f6220e25c464d56bd3ce44b24869d26d43abfed3fbb22b2e3ccb3c77a75c00d2&",""
"1422214171180666890",".sirmuda.","2025-11-13T09:43:29.9040000+00:00","Yup it's not in BB","",""
"1422214171180666890",".sirmuda.","2025-11-13T09:43:39.3270000+00:00","Goddamn such a thing exist here","",""
"1422214171180666890",".sirmuda.","2025-11-13T09:47:49.5100000+00:00","If we are talking about like Pelita Brunei, BB and Media Permata. I don't think it's that thick (Maybe). The front page will always be about the Royals then the rest is gonna be about like local news, sports, Brunei stuff I guess, then advertisements and more","",""
"474936118786129940","perantau98","2025-11-13T10:02:00.2320000+00:00","Dystopian","",""
"1422214171180666890",".sirmuda.","2025-11-13T10:05:38.4200000+00:00","Forgot to add foreign news","",""
"1422214171180666890",".sirmuda.","2025-11-13T10:05:53.5380000+00:00","But yeah still","",""
"474936118786129940","perantau98","2025-11-13T10:06:52.4000000+00:00","Brunei news be like “Ada pakcik memancing atas jeti” type of news? Besides being up to date with the Sultan’s car collection or what not.","",""
"1422214171180666890",".sirmuda.","2025-11-13T10:07:49.2610000+00:00","Idk if this considered dystopian","https://cdn.discordapp.com/attachments/1349057306624790609/1438470401087770644/Screenshot_20251113_180722_com_instagram_android_InstagramMainActivity.jpg?ex=69963835&is=6994e6b5&hm=e2c0c62d99b0395a5f7852ecf83c4d509f933a8b2c970fdaaeea12a211864673&",""
"474936118786129940","perantau98","2025-11-13T10:08:19.2190000+00:00","If only we put Port Klang in Brunei. You’ll have a more interesting set of news.","",""
"474936118786129940","perantau98","2025-11-13T10:09:14.7790000+00:00","Better still, Sabah and Sarawak, Kelantan, Klang. That should make up a good chunk of sensational news.","",""
"474936118786129940","perantau98","2025-11-13T10:10:07.3140000+00:00","Idk, Brunei news be like Perlis news I guess.","",""
