AuthorID,Author,Date,Content,Attachments,Reactions
"605452468284817427","buzzer9229","2025-03-23T16:11:49.0270000+00:00","shes Aries I'm Leo","",""
"736550209068335135",".ayab","2025-03-23T16:11:50.8580000+00:00","Ah so not good","",""
"882111176006328440","nerosalt","2025-03-23T16:11:57.3020000+00:00","always a soft palette dont know what theyre called","",""
"882111176006328440","nerosalt","2025-03-23T16:11:59.4190000+00:00","those books","",""
"712671680324960316","pompompuringdom","2025-03-23T16:12:04.6310000+00:00","My moon sign is a Leo!","",""
"605452468284817427","buzzer9229","2025-03-23T16:12:15.9500000+00:00","My moon sign is Capricorn","",""
"736550209068335135",".ayab","2025-03-23T16:12:23.5830000+00:00","I'm planning to read mistborn the final empire next month","",""
"882111176006328440","nerosalt","2025-03-23T16:12:31.9860000+00:00","wait what","",""
"882111176006328440","nerosalt","2025-03-23T16:12:34.3510000+00:00","dark romance","",""
"712671680324960316","pompompuringdom","2025-03-23T16:12:40.2010000+00:00","You know what @Buzzer beneran that makes SO MUCH SENSE about you now","",""
"882111176006328440","nerosalt","2025-03-23T16:12:40.3910000+00:00","as in booktok, dark romance?","",""
"412926738298044431","jaxxxxxxyyyy","2025-03-23T16:12:46.9270000+00:00","It is still a good read nevertheless","",""
"605452468284817427","buzzer9229","2025-03-23T16:12:49.6080000+00:00","my rising is Scorpio","",""
"412926738298044431","jaxxxxxxyyyy","2025-03-23T16:13:08.8470000+00:00","Though the violence is just basically graphic but comically graphic at some point","",""
"882111176006328440","nerosalt","2025-03-23T16:13:22.3490000+00:00","is it just","",""
"882111176006328440","nerosalt","2025-03-23T16:13:30.1130000+00:00","splatterpunk","",""
"412926738298044431","jaxxxxxxyyyy","2025-03-23T16:13:30.3230000+00:00","To the point I am not even shocked but just confused on who's writing these things","",""
"736550209068335135",".ayab","2025-03-23T16:13:54.2530000+00:00","Is mistborn any good?","",""
"882111176006328440","nerosalt","2025-03-23T16:15:32.7780000+00:00","if you even slightly enjoyed that genuinely, go play cyberpunkdreams","",""
"882111176006328440","nerosalt","2025-03-23T16:16:26.6650000+00:00","it is one of the pieces of fiction written in the last 10 years","",""
"412926738298044431","jaxxxxxxyyyy","2025-03-23T16:16:33.2100000+00:00","Ahhhhh I do heard of that one","",""
"412926738298044431","jaxxxxxxyyyy","2025-03-23T16:16:47.9810000+00:00","Gonna try to see what kind of gold treasure I am discovering","",""
"595261388579143712","owenzedd","2025-03-23T16:17:01.2000000+00:00","How long does it take you guys to finish a decently thick book","",""
"882111176006328440","nerosalt","2025-03-23T16:17:32.3360000+00:00","yk fallen london? 2x the action pool with free weekly refills, just know that the game is GRAPHIC","",""
"882111176006328440","nerosalt","2025-03-23T16:17:44.3070000+00:00","grind is hard, game unforgiving, just like life","",""
"736550209068335135",".ayab","2025-03-23T16:17:47.8980000+00:00","5 days to read without absorbing any relevant info","",""
"882111176006328440","nerosalt","2025-03-23T16:17:52.9520000+00:00","eh, 1-2 months","",""
"882111176006328440","nerosalt","2025-03-23T16:17:56.2580000+00:00","how thich","",""
"882111176006328440","nerosalt","2025-03-23T16:17:59.7780000+00:00","thick","",""
"595261388579143712","owenzedd","2025-03-23T16:18:09.1880000+00:00","5 days is insane","",""
"412926738298044431","jaxxxxxxyyyy","2025-03-23T16:18:21.9830000+00:00","Damn I used to see them gameplays","",""
"736550209068335135",".ayab","2025-03-23T16:18:30.2890000+00:00","300k book  easy","",""
"412926738298044431","jaxxxxxxyyyy","2025-03-23T16:18:33.7480000+00:00","It is been a long time now that you've mentioned it","",""
"736550209068335135",".ayab","2025-03-23T16:18:52.8680000+00:00","But I forgor most of the plot lmao","",""
"736550209068335135",".ayab","2025-03-23T16:18:59.2140000+00:00","Definitely not recommended","",""
"595261388579143712","owenzedd","2025-03-23T16:19:22.1130000+00:00","A thousand pages more less","",""
"882111176006328440","nerosalt","2025-03-23T16:19:26.2930000+00:00","the writer is clearly an edgelord","",""
"882111176006328440","nerosalt","2025-03-23T16:19:37.0580000+00:00","yeah 1-2 months","","👍 (1)"
"595261388579143712","owenzedd","2025-03-23T16:19:37.6860000+00:00","Have to reread a few times","",""
"882111176006328440","nerosalt","2025-03-23T16:19:53.6400000+00:00","eh","",""
"882111176006328440","nerosalt","2025-03-23T16:19:57.6730000+00:00","idk","",""
"736550209068335135",".ayab","2025-03-23T16:19:58.5120000+00:00","Also I have a lot of free time","",""
"882111176006328440","nerosalt","2025-03-23T16:20:03.1090000+00:00","how long was the king in yellow","",""
"412926738298044431","jaxxxxxxyyyy","2025-03-23T16:20:27.4570000+00:00","Yeah I can see why","",""
"412926738298044431","jaxxxxxxyyyy","2025-03-23T16:20:59.5220000+00:00","Welp, back to possibly writing monarchs as democratic figures in my own forum","",""
"882111176006328440","nerosalt","2025-03-23T16:21:04.2840000+00:00","but it is cyberpunk, like if you asked me what cyberpunk was, cpd is cyberpunk","",""
"736550209068335135",".ayab","2025-03-23T16:21:13.0370000+00:00","Yeah most of the book I chose are unfortunately fluff lately I don't want to read things that make me think

University already done that for me","",""
"412926738298044431","jaxxxxxxyyyy","2025-03-23T16:21:14.0880000+00:00","Ye","",""
"882111176006328440","nerosalt","2025-03-23T16:21:40.3550000+00:00","yeah id finish a 1k book in a month","",""
"736550209068335135",".ayab","2025-03-23T16:21:57.7510000+00:00","Wait are talking word count or page count?","",""
"882111176006328440","nerosalt","2025-03-23T16:22:02.0710000+00:00","king in yellow was 270-ish pages, took me a week, x4","",""
"736550209068335135",".ayab","2025-03-23T16:22:13.9780000+00:00","Ahh","",""
"882111176006328440","nerosalt","2025-03-23T16:22:24.0490000+00:00","pages i think","",""
"736550209068335135",".ayab","2025-03-23T16:22:32.8850000+00:00","I reckon you don't have a lot of free time to read?","",""
"882111176006328440","nerosalt","2025-03-23T16:22:34.3250000+00:00","whos in your pfp btw","",""
"736550209068335135",".ayab","2025-03-23T16:22:40.8110000+00:00","Stranded snake","",""
"736550209068335135",".ayab","2025-03-23T16:24:11.8140000+00:00","https://youtu.be/hguMvUG9NIY?si=C5PQX3msDXTExWtz","",""
"882111176006328440","nerosalt","2025-03-23T16:24:15.7880000+00:00","eh, not really, just use my free time to do other things","",""
"882111176006328440","nerosalt","2025-03-23T16:24:27.1700000+00:00","if i really focus i could get it done in a single day","",""
"595261388579143712","owenzedd","2025-03-23T16:24:30.8370000+00:00","Some kids from the younger generation will die without finishing a single damn book","",""
"736550209068335135",".ayab","2025-03-23T16:25:30.9750000+00:00","Have you guys read John grissam the rouge lawyer?","",""
"882111176006328440","nerosalt","2025-03-23T16:25:37.5720000+00:00","no","",""
"736550209068335135",".ayab","2025-03-23T16:26:07.7520000+00:00","It's the first book I first read into completion","",""
"595261388579143712","owenzedd","2025-03-23T16:56:43.1560000+00:00","Not yet","",""
"595261388579143712","owenzedd","2025-03-23T16:56:55.0160000+00:00","What is it about","",""
"595261388579143712","owenzedd","2025-03-23T16:57:34.3930000+00:00","Can't remember the first book I chose and finish","",""
"736550209068335135",".ayab","2025-03-23T21:42:58.1940000+00:00","As the title says it's about a rouge and mysterious lawyer who will take any case no matter how blamable the defendant is.","",""
"265355459454566402","shiawase6946","2025-03-24T08:21:44.2470000+00:00","Depends what kind of book. Definitely need more time for Novels. 

I remember finished Les Miserables (Eng of course) in like around two months; 4 hours every single day from 10 PM to 2 AM. After finishing it I cried, not sure why maybe because of the story, could also be joy of finally finishing it.

Now, It is hard to read like how I used to be. It feels sad, but that's how life is.","",""
"265355459454566402","shiawase6946","2025-03-24T08:26:17.4450000+00:00","Oh ya Do you guys think reading is something that should be adopted early in life to be able to carry it as habit later on?","",""
"779882211641393192","galdenball","2025-03-24T10:23:31.4750000+00:00","this is actually intresting topics i cam across on discord platform regarding indonesian language","",""
"736550209068335135",".ayab","2025-03-24T10:52:10.4010000+00:00","I have an idea beside making reading books as elite... Just assign the thing to read as homework for students.

Through brute force there'll probably one or two that'll start to read.","",""
"736550209068335135",".ayab","2025-03-24T10:53:09.6460000+00:00","But we also need to have a supporting infrastructure in the form of theater","",""
"736550209068335135",".ayab","2025-03-24T10:54:02.0810000+00:00","Can you imagine if theater club in Indonesia starts to show more in highschool instead of competition or special school events?","",""
"736550209068335135",".ayab","2025-03-24T10:54:49.6730000+00:00","In fact why not open the showing to the public and invite parents to watch","",""
"779882211641393192","galdenball","2025-03-24T10:55:10.9460000+00:00","i'd be interested to if there a lot of event","",""
"779882211641393192","galdenball","2025-03-24T10:55:58.0390000+00:00","not to mention that half of my literary works are just translated indonesian","",""
"779882211641393192","galdenball","2025-03-24T10:55:59.6750000+00:00","to english","",""
"412926738298044431","jaxxxxxxyyyy","2025-03-24T12:32:18.7960000+00:00","This is actually what a lot of Baltic countries during their early era of independence, in which many museums, theaters and literature buildings were erected","",""
"412926738298044431","jaxxxxxxyyyy","2025-03-24T12:32:52.5560000+00:00","But to do that, it need governmental support, at least in local levels","",""
"736550209068335135",".ayab","2025-03-24T16:10:48.5330000+00:00","Transfer dana makan gratis ke theater","",""
"736550209068335135",".ayab","2025-03-24T16:11:08.6410000+00:00","At least it'll produce a more tangible result","",""
"412926738298044431","jaxxxxxxyyyy","2025-03-24T16:13:45.2880000+00:00","Lmao true","",""
"412926738298044431","jaxxxxxxyyyy","2025-03-24T16:13:51.0980000+00:00","People will come if there are good food","",""
"736550209068335135",".ayab","2025-03-24T16:14:40.9150000+00:00","While in the topic of theater, we need more public theater","",""
"736550209068335135",".ayab","2025-03-24T16:15:11.7200000+00:00","Just like libraries they important for a civilization culture","",""
"736550209068335135",".ayab","2025-03-24T16:15:42.9470000+00:00","I want to see more theater being more famous in Indonesia","",""
"412926738298044431","jaxxxxxxyyyy","2025-03-24T16:16:02.9430000+00:00","True true, and I still remembered the closest we have a theatre is basically OVJ","",""
"412926738298044431","jaxxxxxxyyyy","2025-03-24T16:16:07.3160000+00:00","But it is a comedy show","",""
"736550209068335135",".ayab","2025-03-24T16:16:13.9860000+00:00","God I miss ovj","",""
"412926738298044431","jaxxxxxxyyyy","2025-03-24T16:16:22.2050000+00:00","Yet in all fairness, theaters used comedy to attract people during its first few eras","",""
"412926738298044431","jaxxxxxxyyyy","2025-03-24T16:16:26.6890000+00:00","Making people laughed","",""
"412926738298044431","jaxxxxxxyyyy","2025-03-24T16:16:32.3620000+00:00","Then brought irl issues","",""
"412926738298044431","jaxxxxxxyyyy","2025-03-24T16:16:36.2000000+00:00","And relatable things","",""
"736550209068335135",".ayab","2025-03-24T16:16:50.3290000+00:00","Comedians are needed for any society to function","",""
"412926738298044431","jaxxxxxxyyyy","2025-03-24T16:16:54.7010000+00:00","Some even used it to convinced them of an idea","",""
"736550209068335135",".ayab","2025-03-24T16:17:13.2120000+00:00","They are philosophers that can actively influence society in real time","",""
"736550209068335135",".ayab","2025-03-24T16:18:09.7660000+00:00","Is the death of TV a contributor why Indonesian aren't reading that much any more","",""
"412926738298044431","jaxxxxxxyyyy","2025-03-24T16:24:42.9450000+00:00","What if we mix podcast with theatres","",""
"412926738298044431","jaxxxxxxyyyy","2025-03-24T16:24:50.0560000+00:00","Kaesang kinda did such thing with his channel","",""
"412926738298044431","jaxxxxxxyyyy","2025-03-24T16:25:01.1850000+00:00","With similar setting like OVJ","",""
"412926738298044431","jaxxxxxxyyyy","2025-03-24T16:25:18.3120000+00:00","True that","",""
"412926738298044431","jaxxxxxxyyyy","2025-03-24T16:25:38.9830000+00:00","Yeah we have phones and laptops right now with Netflix","",""
"736550209068335135",".ayab","2025-03-24T16:25:48.1390000+00:00","You mean like this?

:https://youtu.be/vp5AwkMF1cE?si=oe8yZPQLxQC9f4ZZ","",""
"736550209068335135",".ayab","2025-03-24T16:26:02.2950000+00:00","But comedy?","",""
"412926738298044431","jaxxxxxxyyyy","2025-03-24T16:26:08.2810000+00:00","Ohhhhh that could be good","",""
"736550209068335135",".ayab","2025-03-26T14:21:43.6020000+00:00","The bastardization of the indonesian language is inevitable, should KBBI include more slang like the Oxford dictionary within its catalogue?","",""
"736550209068335135",".ayab","2025-03-26T14:24:04.4770000+00:00","Wether we like it or not most Indonesian content and literature are posted in semi-formal way it's much better if Indonesia wants to survive as a relevant language within the next hundred years or so the KBBI needs to be more flexible to answer the march of time","",""
"736550209068335135",".ayab","2025-03-26T14:25:06.4650000+00:00","We also need a proper system on how to cite videos and footnotes so educations video aren't just spoutijg unreliable data or information without and thing to reference from","",""
"882111176006328440","nerosalt","2025-03-26T14:25:22.7210000+00:00","We have brought it upon ourselves, who are we to deny it?","",""
"882111176006328440","nerosalt","2025-03-26T14:25:45.7090000+00:00","Our government constantly pushes for cultural preservation yet the one language that unites us all is ignored?","",""
"736550209068335135",".ayab","2025-03-26T14:27:03.1970000+00:00","If our written language is already a lost cause (I argue it's not), maybe the government should focus more on how to standardize videos?","",""
"736550209068335135",".ayab","2025-03-26T14:27:36.0990000+00:00","Formalizing video content in what ever form whether it's short or hour long essays","",""
"736550209068335135",".ayab","2025-03-26T14:29:58.6220000+00:00","Example


Video

Content /image/text (1)
Content /image/text (2)

(desc)

¹. How to make thermite bomb, Ted Krazinyskj, 131-34, 06.14.
². The Importance of Aura farming, Sung Jin Woo, 125-134,14.50.","",""
