AuthorID,Author,Date,Content,Attachments,Reactions
"766280136332410920","ekast237707","2025-10-05T01:51:57.4870000+00:00","","https://cdn.discordapp.com/attachments/1342873250354565150/1424212486529482772/IMG_20251005_084055.jpg?ex=69966cbd&is=69951b3d&hm=2ea0de9dedea458effabf0b259559653af963f90f7f19aebf76956be7d87444e&",""
"766280136332410920","ekast237707","2025-10-05T01:52:09.6430000+00:00","","https://cdn.discordapp.com/attachments/1342873250354565150/1424212537217646702/IMG_20251005_084035.jpg?ex=69966cc9&is=69951b49&hm=933ab4cb348235198ff389731df8d4d112145339bdcb34fe3f4c703a64e821ce&,https://cdn.discordapp.com/attachments/1342873250354565150/1424212537544671302/IMG_20251005_084009.jpg?ex=69966cc9&is=69951b49&hm=4a0485de37d6a70662bfe5b222ac89b4668abc5f05d473b5726b9d825d78d8d6&",""
"766280136332410920","ekast237707","2025-10-05T01:52:46.7850000+00:00","","https://cdn.discordapp.com/attachments/1342873250354565150/1424212693153222777/IMG_20251005_083950.jpg?ex=69966cee&is=69951b6e&hm=5c9560d4f636672a111cb66bc958ecad393893b9a445f73a26f95c43c1eca885&,https://cdn.discordapp.com/attachments/1342873250354565150/1424212693463728178/IMG_20251005_083923.jpg?ex=69966cee&is=69951b6e&hm=617d7ccc0f6c1f48277041ae6c295c060ac2e6cd9f251333182372157517f9bf&",""
"766280136332410920","ekast237707","2025-10-05T01:53:04.6900000+00:00","","https://cdn.discordapp.com/attachments/1342873250354565150/1424212768357093508/IMG_20251005_083851.jpg?ex=69966d00&is=69951b80&hm=a52e196385fa78750440fd9737e89862a2067e867d2cfa602deb88f40f213c5b&,https://cdn.discordapp.com/attachments/1342873250354565150/1424212768730513408/IMG_20251005_083823.jpg?ex=69966d00&is=69951b80&hm=e25860a0604ee2d5578dd2bd186a4c85b114c9dacee514318985f82d3ddb831c&",""
"766280136332410920","ekast237707","2025-10-05T01:53:34.4240000+00:00","https://www.instagram.com/p/DPY2YAuD53U/?igsh=dXR3djM2cDlieG1i","",""
"766280136332410920","ekast237707","2025-10-05T01:55:31.0090000+00:00","# Selamat Belajar Untuk Man Teman yang sedang Role Play ya, Semangat, 🔥🔥🔥🔥🔥","",""
"766280136332410920","ekast237707","2025-10-06T08:19:33.1700000+00:00","Thank you Mas Gigguk","",""
"766280136332410920","ekast237707","2025-10-06T08:19:39.3200000+00:00","Ost Baan","",""
"766280136332410920","ekast237707","2025-10-06T08:19:43.7370000+00:00","https://youtu.be/4CuxHWvSEAI?si=BVL5DY9xrdHKZBUL","",""
"766280136332410920","ekast237707","2025-10-06T12:43:21.8640000+00:00","Kayaknya ni akun mencari kesedihan, aku nangis sii","",""
"766280136332410920","ekast237707","2025-10-06T12:43:37.9060000+00:00","","https://cdn.discordapp.com/attachments/1342873250354565150/1424738873648615524/IMG_20251006_192434.jpg?ex=69965cb9&is=69950b39&hm=74884f8c9dcc3093a3fe932d32749980440312f22d46b36548b7e0a73a09aa45&",""
"766280136332410920","ekast237707","2025-10-06T12:43:44.7950000+00:00","https://www.instagram.com/p/DPTfRPyipFJ/?img_index=13&igsh=NWFuOHlqeHdqMW96","",""
"766280136332410920","ekast237707","2025-10-06T12:44:41.5240000+00:00","The key is... For Kids","",""
"766280136332410920","ekast237707","2025-10-06T12:45:00.6630000+00:00","😭 😭 😭","",""
"766280136332410920","ekast237707","2025-10-07T05:47:01.7070000+00:00","Youtube Code Geass 16 Song Playlist from SK - FS","",""
"766280136332410920","ekast237707","2025-10-07T05:47:06.2780000+00:00","https://youtube.com/playlist?list=PLaybPUeHluug8GRXqLScxf56ZVY-uh18s&si=8zajs4DgxIPz4ou6","",""
"766280136332410920","ekast237707","2025-10-08T04:50:43.4370000+00:00","This is it? Sony make k-pop demon hunter and spiderverse too","",""
"766280136332410920","ekast237707","2025-10-08T04:50:59.0650000+00:00","Welcome Matured Animated Art","",""
"766280136332410920","ekast237707","2025-10-08T04:51:02.0610000+00:00","https://youtu.be/V5-J8mOxj5E?si=8Z2dzHNpKhhp_s_b","",""
"563984376585781268","rsnz09","2025-10-08T06:00:56.6470000+00:00","😹","https://cdn.discordapp.com/attachments/1342873250354565150/1425362309756354610/image0.jpg?ex=6996a718&is=69955598&hm=e90685c0cf47a52cce0bd73d0b5b4312f5fe2343381c18da703905e81508bbd3&",""
"766280136332410920","ekast237707","2025-10-08T09:56:42.9330000+00:00","Coool","",""
"766280136332410920","ekast237707","2025-10-08T09:56:50.0020000+00:00","We are Alien Race","",""
"766280136332410920","ekast237707","2025-10-08T09:57:07.4310000+00:00","Uchujin in japanese","",""
"766280136332410920","ekast237707","2025-10-08T09:57:19.9650000+00:00","Like Jawa in star wars","",""
"1064369916351889448","fellowmen","2025-10-08T10:46:01.6660000+00:00","Space Battleship YAMATO","",""
"766280136332410920","ekast237707","2025-10-08T10:59:57.4040000+00:00","Mojacko berputar","",""
"563984376585781268","rsnz09","2025-10-09T11:21:40.2260000+00:00","they animated the amo scene in gachiakuta","",""
"563984376585781268","rsnz09","2025-10-09T11:21:52.5630000+00:00","https://tenor.com/view/spiderman-negro-spiderman-triste-spiderman-black-sad-gif-25329157","",""
"563984376585781268","rsnz09","2025-10-09T11:22:27.6530000+00:00","https://tenor.com/view/spider-man-spider-man-web-of-shadows-depressed-sad-gif-16524395","",""
"563984376585781268","rsnz09","2025-10-09T11:22:42.4150000+00:00","https://tenor.com/view/rain-sad-depression-gif-24658304","",""
"766280136332410920","ekast237707","2025-10-11T22:55:00.4750000+00:00","I am agree, their not lie, their account is for fun and creative love letter to the media, at least they making use of cosplayer and bring outside anime comunity to their creative work, I think, we should chill they not intend to be serious one anime account, not lie","",""
"766280136332410920","ekast237707","2025-10-11T22:55:03.6520000+00:00","https://youtu.be/JiNhZzyJp2c?si=O8VJDaVW9kTDd7Y9","",""
"766280136332410920","ekast237707","2025-10-13T23:59:23.7320000+00:00","Klu kamu lagi sedih, galau, pundung, marah, bingung, dengerin lagu stories dari code geass yang diulang ulang ini","",""
"766280136332410920","ekast237707","2025-10-13T23:59:32.9980000+00:00","https://youtu.be/iyGpSvj1DGo?si=3GTbHc4PRzzpeQD6","",""
"766280136332410920","ekast237707","2025-10-14T00:01:15.7200000+00:00","Lyrics

You are my stories
A tale I have never read before
You are my stories
A tale I have never read before

When I gazed into your eyes
I could see an unknown land

Stories where the door opened
A tale that will never be shut again
Stories where the door opened
A tale that will never be shut again

Destiny cannot be changed
I shall head to an unknown land

I want to protect you
With that simple thought alone
Until the moment when
This pitch black world overflows with light

I want to protect you
With that simple thought alone
Until the moment when
This pitch black world overflows with light","",""
"766280136332410920","ekast237707","2025-10-14T04:21:53.0420000+00:00","Supercell My Dearest from. opening Anime Guilty Crown","",""
"766280136332410920","ekast237707","2025-10-14T04:22:01.0770000+00:00","https://youtu.be/nAUysFtM6kQ?si=MaF1dJlwrpwtLzR0","",""
"766280136332410920","ekast237707","2025-10-14T04:22:30.5240000+00:00","Lyrics reTYE

You everything that makes me whole
To you I'd give my only heart and soul
I'm Yours

Hey,with you here with me,I cant stop smiling
You joy, so new, like the warmth of spring
I'm sure you're my everything ah

And on this road, I have always walked completely Alone
I used to hesitate every day
But now, I can confidently say
That Here we stand
Only the two of us, with your Hands resting in mine
I will always go, anywhere you know
Holding on, together 'till the end of time
As you turn to me and whisper
You'll never be alone
So smile my dear,oh

If ever you should find your purpose, but worry you won't see through
Don't let your worries tie you down and hold you back from what is true

If shadow try to suffocate you and silence you 'till nothing's left
You'realize,before your eyes, that i won't ever leave your side
And brightly like the sun I'll shine and light the path ahead of you
No king or God from up above will ever stop what you can do 

You everything that makes me whole
To you, I'd give my only heart and soul
I'm yours

Though, many conflicts challenge our faith so
The hardship faced in this tainted world
Someday,we laugh again I know
Don't even let the careless masses destroy the hope you hold within
Their words are only lies and slander, to bring you down where they have been
No matter if the world around you is weighing guilt upon your Head
I'll cast away,you doubts at bay, and make every mistake okay
So take the crown of burdens in you and leave your troubles far behind
You'll never feel adrift or lonely, as long as I am at your side

You're everything that makes me whole
To you, I 'd give my only heart and soul, ah
I'm yours

Long outro

If you could one day understand then that's all That I would really need
In person or in spirit I swear, that you can always count on me

When Darkness falls, with solemn walls and you feel your confidence is weak
I'm here with you, not one but two, and together we will make it through

If life should tear my hand from yours, I know you'll still remember me

If mind and body melts away, a part of me will always be
You have my only heart and soul, I pledge to you all That I have my dear

Do you Hear
(Like a Poem, Great ReTYE)","",""
"766280136332410920","ekast237707","2025-10-16T06:29:04.9990000+00:00","Lagu yang dimulai dari yasashi tokoro, I like that gentle aspect...","",""
"766280136332410920","ekast237707","2025-10-16T06:29:09.6790000+00:00","https://youtu.be/YvyGpBa-oWc?si=DnV8U4PRbRm6vhmA","",""
"766280136332410920","ekast237707","2025-10-16T06:29:59.1520000+00:00","One of my favorite anime, isekai Kantai Skill Nariagaru","",""
"766280136332410920","ekast237707","2025-10-16T06:32:34.8180000+00:00","English Translation

You have kind and innocent traits,
But you also have a courageous side.
When you plunge into business with a serious face,
You simply forget about me.
No matter how you are, I can’t help but love you.
When you’re healthy and when you’re unwell,
I want to always be by your side.
This is the first time I feel this way… I love you.

With this born love in this huge world
I want to quietly touch eternity.
Wanting to draw the same dreams as you,
Aimed at a beautiful, brilliant future,
Into which your gaze is directed,
I decided that this is my last love.

Your eyes are so beautiful,
Even in your sleep you look so cute.
You speak to me,
Weaving your tender sounds.

Even though you’re a crybaby, you hate losing.
You’re ready to face any wall.

Ah, what a wonderful person you are.
We were lucky enough to meet, finally we were able to meet.
It’s you who are my wonder.

I want to know even more deeply the desire
That led me to this dazzling sky that I look at.
Trying to find words that can convey to you
That you’re becoming more and more dear to me,
I listen to the rustle of the breeze.
I love you (I love you)
With you (Be with you)
You can believe in me.

With this born love in this huge world
I want to quietly touch eternity.
Wanting to draw the same dreams as you,
Aimed at a beautiful, brilliant future,
Into which your gaze is directed,
I’ll give you my last love.

English translation from japanese: Prosvetlennyi","",""
"766280136332410920","ekast237707","2025-10-16T09:16:15.4110000+00:00","Fans Anime Yang Netral dan hanya mencari Acara yang bagus","",""
"766280136332410920","ekast237707","2025-10-16T09:16:19.0510000+00:00","https://youtu.be/TYfbggUZPf4?si=dgMH3MCrzcaw4vdo","",""
"766280136332410920","ekast237707","2025-10-16T09:16:30.8820000+00:00","Ini bukti nya lagi","",""
"766280136332410920","ekast237707","2025-10-16T09:16:34.3410000+00:00","https://youtu.be/vBeygbTQuco?si=9mAZvFl7NwrvAxWd","",""
"896422019028099082","rdenfarrel","2025-10-16T14:10:00.0460000+00:00","Sekarang lg banyak isekai, yang masak2 sama guguk slime lucu bgt ini season 2 nya, Mayan lepas penat, sama assassin yang statsnya ga ngotak, selain 2 ini apalagi ya isekai musim ini?","",""
"736550209068335135",".ayab","2025-10-16T17:30:09.4810000+00:00","Im losing the plot for chaonsaw man part 2","",""
"766280136332410920","ekast237707","2025-10-17T09:37:20.4060000+00:00","Please, be as rasionable as much, don't judge, just listen","",""
"766280136332410920","ekast237707","2025-10-17T09:37:40.7890000+00:00","About Marrying an Anime Character","",""
"766280136332410920","ekast237707","2025-10-17T09:38:32.1910000+00:00","Andhika:Hug Cafe
Haruka:Maybe Very Tired
Wendy:Weird but there","",""
"766280136332410920","ekast237707","2025-10-17T09:38:55.2600000+00:00","","https://cdn.discordapp.com/attachments/1342873250354565150/1428678655478992907/Screenrecorder-2025-10-17-16-30-50-107.mp4?ex=6996316f&is=6994dfef&hm=a1e1f914a8b18977aaf28d8940a1970bc50d60828b927dec31b542258e85d2a0&",""
"766280136332410920","ekast237707","2025-10-17T09:39:44.1810000+00:00","Very very funny, and insight full of japanese culture, with Haruka, critics goverment while just chill and fun","",""
"766280136332410920","ekast237707","2025-10-17T09:39:48.5610000+00:00","https://youtu.be/KR0-rudwRjA?si=PUfi9YrNHI4N4pNN","",""
"766280136332410920","ekast237707","2025-10-17T11:33:12.7480000+00:00","Magic knight Rayearth, Clamp","",""
"766280136332410920","ekast237707","2025-10-17T11:33:47.6300000+00:00","Mau diremake 2026,17 Oktober  1994 penayangan pertama nya","",""
"766280136332410920","ekast237707","2025-10-17T11:33:50.9610000+00:00","https://x.com/famitsu/status/1979132876802396222?t=IccMn04VlSGm9xrBaumpyQ&s=19","",""
"766280136332410920","ekast237707","2025-10-17T22:06:19.3900000+00:00","Hunter x Hunter
Top 10 Nen ability from Killua. Zoldyckt","",""
"766280136332410920","ekast237707","2025-10-17T22:06:23.3060000+00:00","https://www.instagram.com/p/DP3d0GrEggl/?img_index=12&igsh=MTZzMzR6ODhiNGQxYQ==","",""
"766280136332410920","ekast237707","2025-10-17T22:07:07.7120000+00:00","","https://cdn.discordapp.com/attachments/1342873250354565150/1428866948875423754/IMG_20251018_045419.jpg?ex=6996380b&is=6994e68b&hm=10e31927d0fff531e88fa953c0bcc5b6d376b5648e57d540f20a8f06b6e73b68&",""
"766280136332410920","ekast237707","2025-10-17T22:08:25.6860000+00:00","Part 1","",""
"766280136332410920","ekast237707","2025-10-17T22:08:36.8150000+00:00","","https://cdn.discordapp.com/attachments/1342873250354565150/1428867322352893973/IMG_20251018_045403.jpg?ex=69963864&is=6994e6e4&hm=a0b230a360f3b88123baee89dfbdf5fb2562669240d763686b31469454375f80&,https://cdn.discordapp.com/attachments/1342873250354565150/1428867322843758613/IMG_20251018_045330.jpg?ex=69963864&is=6994e6e4&hm=588f95c24e2940901ed3dddd4afd8d40bc4fccd8b9fd18214edc82edb33d6171&",""
"766280136332410920","ekast237707","2025-10-17T22:08:41.9940000+00:00","Part 2","",""
"766280136332410920","ekast237707","2025-10-17T22:08:53.1430000+00:00","","https://cdn.discordapp.com/attachments/1342873250354565150/1428867390657138858/IMG_20251018_045312.jpg?ex=69963875&is=6994e6f5&hm=69bfbe6c07b12945e38f1503860b03601961e2126ae12a8b740a0d5119254fd2&,https://cdn.discordapp.com/attachments/1342873250354565150/1428867390975770624/IMG_20251018_045252.jpg?ex=69963875&is=6994e6f5&hm=b3fd36f5aa598751774f7aac5a133d7ec36328144168b8578f62689a34320efa&",""
"766280136332410920","ekast237707","2025-10-17T22:08:59.0110000+00:00","Part 3","",""
"766280136332410920","ekast237707","2025-10-17T22:09:11.7350000+00:00","","https://cdn.discordapp.com/attachments/1342873250354565150/1428867468503285810/IMG_20251018_045226.jpg?ex=69963887&is=6994e707&hm=c7f93e9049beb11e104859831d270c187667fa43b70f56f230318ca917b9df8a&,https://cdn.discordapp.com/attachments/1342873250354565150/1428867469057064990/IMG_20251018_045200.jpg?ex=69963887&is=6994e707&hm=cd793751863d66d3a488fac77b0f288567bd22bced523881c6081609c98fa0d6&",""
"766280136332410920","ekast237707","2025-10-17T22:09:21.5830000+00:00","Part 4","",""
"766280136332410920","ekast237707","2025-10-17T22:09:31.4360000+00:00","","https://cdn.discordapp.com/attachments/1342873250354565150/1428867550820962459/IMG_20251018_045136.jpg?ex=6996389b&is=6994e71b&hm=5cf2730b79d9a500d1998ec655224fbb21a7cbfd7ea504d16f35d7c5d7bdf9f5&,https://cdn.discordapp.com/attachments/1342873250354565150/1428867551424938139/IMG_20251018_045111.jpg?ex=6996389b&is=6994e71b&hm=1c4daef50c40ba2b8be970387e18140bb14d3cae39e1e35c2f605b56b0767d13&",""
"766280136332410920","ekast237707","2025-10-17T22:09:36.2360000+00:00","Part 5","",""
"766280136332410920","ekast237707","2025-10-17T22:09:46.7800000+00:00","","https://cdn.discordapp.com/attachments/1342873250354565150/1428867615677354024/IMG_20251018_045052.jpg?ex=699638aa&is=6994e72a&hm=9edada8f2b00ace602340e0edd116cce86e3e8fde4cb8669bc37573385edab75&,https://cdn.discordapp.com/attachments/1342873250354565150/1428867615996116992/IMG_20251018_045022.jpg?ex=699638aa&is=6994e72a&hm=0bf58385d411ebc3e7f840e9d16a3129b0fb184724572c230434a81f57842c3d&",""
"766280136332410920","ekast237707","2025-10-17T22:09:52.1040000+00:00","Part 6","",""
"766280136332410920","ekast237707","2025-10-17T22:10:02.7630000+00:00","","https://cdn.discordapp.com/attachments/1342873250354565150/1428867682589081771/IMG_20251018_044956.jpg?ex=699638ba&is=6994e73a&hm=e64d6a39f574b67d0c6a03fc01c19ce03cb5f0857eef24b6381735ec6fcf355c&,https://cdn.discordapp.com/attachments/1342873250354565150/1428867683042197524/IMG_20251018_044921.jpg?ex=699638ba&is=6994e73a&hm=359dcf1231d6c272baeac9f30580c99362ab8f08837315af050bf61713be72e1&",""
"766280136332410920","ekast237707","2025-10-17T22:10:37.4910000+00:00","*PS:Creativity can be learn from consume idea","",""
"766280136332410920","ekast237707","2025-10-17T22:11:48.3290000+00:00","I think all shonen power level start from looking X-Man... That i adore too","",""
"766280136332410920","ekast237707","2025-10-18T09:46:19.1980000+00:00","Nice, podcast, soo packed","",""
"766280136332410920","ekast237707","2025-10-18T09:46:24.1610000+00:00","https://youtu.be/EfVoArmSk1o?si=g-Bl1kKoTXWuIrI4","",""
"766280136332410920","ekast237707","2025-10-18T12:32:38.0500000+00:00","Anime Bandai Namco yang mengkritik DEI, Woke, Kesetaraan, adalah janji manis palsu belaka","",""
"766280136332410920","ekast237707","2025-10-18T12:33:28.3430000+00:00","Jagoan utama nya MC memiliki skill Infinity Gacha kartu summon, salah satu summon nya adalah Waifu maid...","",""
"766280136332410920","ekast237707","2025-10-18T12:34:14.7540000+00:00","Ini perlawanan balik Jepang ke Barat sii menurut hemat ku, ini sangat politik, jagoan utama nya mirip master foton ion dari Tales of Abyss","",""
"766280136332410920","ekast237707","2025-10-18T12:34:27.8810000+00:00","https://youtu.be/j_UyfXvX28M?si=AGE2BWAWzoh4KWDW","",""
"766280136332410920","ekast237707","2025-10-18T12:34:54.0040000+00:00","Fon master Ion","",""
"766280136332410920","ekast237707","2025-10-18T12:35:00.7480000+00:00","","https://cdn.discordapp.com/attachments/1342873250354565150/1429085358880198748/ion_ss_card.jpg?ex=69965ab4&is=69950934&hm=b1cbd0c5826e88a2a81e1674cee3100b27d98342e2de63088f87efdd87931e91&",""
"766280136332410920","ekast237707","2025-10-19T01:56:26.2060000+00:00","Do you ever think, your whole life is wrong, you are the mistake, not everyone, not the world?","",""
"766280136332410920","ekast237707","2025-10-19T01:56:51.1780000+00:00","","https://cdn.discordapp.com/attachments/1342873250354565150/1429287148359520388/Screenrecorder-2025-10-19-08-43-27-3500.mp4?ex=69966de3&is=69951c63&hm=787710a47caf145ed93ce3ec61d5aed2765dad8eac8c725f65bae61e56ad6b6d&",""
"766280136332410920","ekast237707","2025-10-19T01:57:29.5950000+00:00","https://youtu.be/sT9qF0kg5wQ?si=QlEy7jVVE1_Mvk-d","",""
"766280136332410920","ekast237707","2025-10-19T02:26:03.4140000+00:00","Mas Teddy loid rilis album wanna be rider","",""
"766280136332410920","ekast237707","2025-10-19T02:26:07.8280000+00:00","https://youtube.com/playlist?list=OLAK5uy_kpb1g10x_cXdSabFqZLnwFPA3EEctbeUw&si=zU0Z_oKXoquqVcZp","",""
"766280136332410920","ekast237707","2025-10-19T02:27:08.5210000+00:00","Contoh Legion of hell","",""
"766280136332410920","ekast237707","2025-10-19T02:27:10.9200000+00:00","https://youtu.be/TB0758uZZhc?si=E8VgkTvc2UR6vKAD","",""
"766280136332410920","ekast237707","2025-10-20T04:59:24.4610000+00:00","Anime classic Japan","",""
"766280136332410920","ekast237707","2025-10-20T05:00:55.7450000+00:00","Description

- Brilliant Anime Songs -

Professional classical musicians play anime songs for real!

We are developing a hybrid entertainment that combines the charm of classical instruments with the groove of anime songs!

- Anime Songs forever! -

Anime is already a part of Japanese culture, and there are many masterpieces in the ""anime songs"" that support the anime. 

***We don't want to just consume them as commercial music***

***we want to keep them in our memories #forever!***","",""
"766280136332410920","ekast237707","2025-10-20T05:01:06.8340000+00:00","Believe One Piece","",""
"766280136332410920","ekast237707","2025-10-20T05:01:21.6840000+00:00","https://youtu.be/tKQNvG8U6pM?si=ycAyoomVXITd3OCD","",""
"1064369916351889448","fellowmen","2025-10-20T14:05:33.2890000+00:00","https://youtu.be/MV31iuqCF-s?si=Oql6Asnvc1Il7NyX","",""
"1064369916351889448","fellowmen","2025-10-20T14:06:10.4790000+00:00","We are racing horces across United states guys","",""
"766280136332410920","ekast237707","2025-10-20T16:22:40.0130000+00:00","Hey guys, this is 7 days ago","",""
"766280136332410920","ekast237707","2025-10-20T16:23:03.5520000+00:00","Long ago before the woman 10 game to get to know me","",""
"766280136332410920","ekast237707","2025-10-20T16:23:15.6480000+00:00","10 manga to know me","",""
"766280136332410920","ekast237707","2025-10-20T16:23:57.9830000+00:00","Mas Sunny go, Nakama Podcast,very influential now... One Piece","",""
"766280136332410920","ekast237707","2025-10-20T16:24:04.9120000+00:00","https://www.instagram.com/p/DPxkOVNk7p7/?igsh=MWRmNHRpMDk1bGd2Nw==","",""
"766280136332410920","ekast237707","2025-10-20T16:24:13.7770000+00:00","","https://cdn.discordapp.com/attachments/1342873250354565150/1429867818937221210/IMG_20251020_230853.jpg?ex=6996906d&is=69953eed&hm=0cae9877c7c329becea959b235dbd1b5d1fc55f88cbbbea83d9f581e6cf35068&",""
"766280136332410920","ekast237707","2025-10-20T16:25:23.8060000+00:00","For me if asked soo suddenly

Planetes,Break Age,Vampire Game,Dandoh, Sanzoku Ou, Shanao Yoshitsune,A Bad Boy Drinks Tea!,Cheeky angel,I'am Doshiro,Hikaru no go","",""
"766280136332410920","ekast237707","2025-10-20T16:26:46.0940000+00:00","What yours Man Teman Budiman Sekalian, Menurut ku, Hobby, Selera itu dimana kita boleh memiliki Pilihan yang sama ataupun berbeda","",""
"766280136332410920","ekast237707","2025-10-21T04:33:34.6640000+00:00","Robert Egbert, sang kritikus film ternama, ternyata review animenya bagus, suka sekali Final Fantasy :Spirit within dan Studio Ghibli... Spirited Away, dll","",""
"766280136332410920","ekast237707","2025-10-21T04:34:22.8920000+00:00","Menurut ku juga harusnya Anime, JRPG, Manga dapat dilihat setara dengan medium penyampaian pesan lainnya","",""
"766280136332410920","ekast237707","2025-10-21T04:35:24.7230000+00:00","https://youtu.be/oMdddKTJnQ8?si=UcYgwFdNsHb9Hg8O","",""
"563984376585781268","rsnz09","2025-10-22T14:02:35.9710000+00:00","people defending the demons in frieren is like peak stupidity","",""
"563984376585781268","rsnz09","2025-10-22T14:02:37.6530000+00:00","lmao","",""
"766280136332410920","ekast237707","2025-10-22T21:43:30.1350000+00:00","What why?, are they Demon worshippers?","",""
"891545423238537236","murzzbow","2025-10-23T02:59:01.0920000+00:00","https://x.com/MangaMoguraRE/status/1980924096419381519?t=WScXm08TYI4QgSGLQ10IiA&s=19","",""
"563984376585781268","rsnz09","2025-10-23T07:31:16.0160000+00:00","nah they equated hating demons to discriminating against poc","",""
"563984376585781268","rsnz09","2025-10-23T07:31:20.0590000+00:00","people of color","",""
"766280136332410920","ekast237707","2025-10-23T07:33:50.5610000+00:00","The demon leader man is white..","",""
"766280136332410920","ekast237707","2025-10-23T07:34:56.3550000+00:00","But SouSou no frieren name frieren beyond the journey in japan isnt mean Frieren sang pembasmi","",""
"766280136332410920","ekast237707","2025-10-23T07:35:17.6540000+00:00","Because Frieren hated demon..?","",""
"766280136332410920","ekast237707","2025-10-23T07:36:19.7160000+00:00","From bottem of his heart, because the demon is not think and raised like human they will use any means Neccesary to win","",""
"766280136332410920","ekast237707","2025-10-23T07:37:11.0760000+00:00","So maybe demon =x poc","",""
"766280136332410920","ekast237707","2025-10-23T07:37:51.6220000+00:00","I think briefly","",""
"766280136332410920","ekast237707","2025-10-23T12:52:56.9170000+00:00","Different Storytelling in Western & Eastern","",""
"766280136332410920","ekast237707","2025-10-23T12:53:02.9440000+00:00","https://youtu.be/ZGiajG2g-Nc?si=8tSV3QwYOjg87_oX","",""
"766280136332410920","ekast237707","2025-10-23T12:53:49.8560000+00:00","Video game, anime, Saves Lives","",""
"766280136332410920","ekast237707","2025-10-23T12:53:59.7230000+00:00","https://youtu.be/I2XwGz9X8Ec?si=k9-5RCJjSc_YlYlR","",""
"766280136332410920","ekast237707","2025-10-23T12:54:25.8920000+00:00","The essence of Magnus Zero learning","",""
"766280136332410920","ekast237707","2025-10-23T12:54:37.0450000+00:00","","https://cdn.discordapp.com/attachments/1342873250354565150/1430902232194486282/IMG_20251023_173939.jpg?ex=69965f4d&is=69950dcd&hm=0a69ac70bafc14b3af43890f433a48b7490367d1dbc178129931acf53bd7b36c&",""
"766280136332410920","ekast237707","2025-10-23T12:57:35.9130000+00:00","Upper Left :Megaman X4
Upper right:Yusuke Urameshi, Yuyu hakusho(Anime) 
Lower left:Shining Force
Lower Right:Luke, Tales of Abbys","",""
"766280136332410920","ekast237707","2025-10-23T23:11:05.4280000+00:00","X-Man is Begin it All, I think, the Craft, frasing, framework is not forcing but subtle","",""
