AuthorID,Author,Date,Content,Attachments,Reactions
"1330390051351433288","shibol","2025-04-08T21:06:16.9600000+00:00","Been seeing a lot of acquaintances pass away, and see they have rather peculiar burial ceremony spending fortunes for their caskets and prayer ceremonies.

Personal favorites for me, I would sign a do not resuscitate and people can just throw my body to a river, cremate me, turn me into plant fertilizer, donate my body to science, sky burial, or maybe somehow my body gets to the black market and sold for bitcoin. By then maybe bitcoin will equal to the whole gdp of jabodetabek.

What about you?","",""
"1193335837916676269","dusman05","2025-04-08T22:54:54.6350000+00:00","Donate my organs to people who need it","",""
"235101362956795904","mazeltof404","2025-04-09T04:54:39.7510000+00:00","Ibid dusman. Then have my corpse reduced to ashes, use it as a fertilizer for planting cannabis. My grandchild can smoke OG Tota Genkai & relive my memory","","😂 (2),🤣 (1)"
"1129073789221753024","morphinegaming2007","2025-04-09T05:44:56.7750000+00:00","burn","",""
"843005270200156160","kaviarormonroe","2025-04-09T14:26:24.2690000+00:00","Donate some parts, cremate some parts, and i want the rest to be preserved and taxidermied to give to my friends","",""
"645277559935860736","petrachristalbert","2025-04-15T09:01:50.4080000+00:00","burnt","",""
