AuthorID,Author,Date,Content,Attachments,Reactions
"736550209068335135",".ayab","2025-03-23T01:38:16.1910000+00:00","A coveted revered concept, a unifier of the ungovernable, long stand as the ultimate form of the great Indonesian project; is but an empty vessel that symbolize the hopes of our founder, yet its soul is empty with naught to seek its beauty.

Our language, the thing we have duty to maintain and guard against the progress of time, is slipping away from our grasp like loose sand in our hand.

We do not have a mold to cement them into something corporeal that can be the axis of our language saga and journey. No great figure like Shakespeare and tolkien to be coveted, to be look upon with envy and reverence, no epic and sagas that is formed by the culture we have. 

Our classes just stand empty, never highlighting with great concise the figure within our literature to be taught as example for our students to learn form. 

What is a structure for a language if it's garden is desolate without life. 

A great tragedy for our nation","https://cdn.discordapp.com/attachments/1353181020568158241/1353181131729797150/images_10.jpg?ex=699669a2&is=69951822&hm=31922b2cf7e325105d4eb7b02759c84a2afecb9d80c833919bfeff4f128b825b&","😿 (1)"
"185435194746994690","adi_onysus","2025-03-23T03:38:09.8220000+00:00","We have words, yet few choose to mold them into lasting legacies. Our bookshelves gather dust while our eyes gleam at headlines, and they never linger long enough to even absorb the ideas to the depth of thought. The world no longer reads; it scrolls. Reading has never been a deeply ingrained habit amongst Indonesia's populace, and thus this decline is even more apparent.

Towering figure--Shakespeare, Mark Twain, Tolkien--have shaped English into what it is today. But our language lacks widely celebrated literary icons who praise its essence. Pramoedya, Sapardi, Chairil Anwar, these names remain unsung and not given the recognition they deserve. Our classrooms do not echo with their words, and so the students move on, unaware of the giants that walked before them, and even among them.

Perhaps this is simply the reality of our time. A world too fast, too fleeting, where the beauty of language is lost in the rush of information. But if a language is to endure beyond function--if it is to be more than just a means of speech--it must have its champions, its poets, its visionaries.","",""
"736550209068335135",".ayab","2025-03-23T03:55:56.1640000+00:00","What seeks in the fleeting time to find meaning in our language? What sorrows been written, what love and emotion yet to hold us in awe for our long standing fascination towards the fleeting that is beautiful. Those, the one who seeks it's majesty their song yet sunged as heroes of our age, not given the accolades and tribute they deserving of. The minds and the life of our people could fill the largest libraries in the world and yet it won't be enough. To look upon the state of our language, our literature, is to look upon a desolate place while a verdant garden is maintained and cherished next to you.

Great envy has already risen within me everytime i see how they, our enemies and foes, has been the gardener of their own roots, while we, famished with nothing to harvest.

When you said that the time for wonder of literature time to be forged and made already gone and never to return, I can't help but to hold out tears in my eyes, for your words are true and painful to admit","",""
"736550209068335135",".ayab","2025-03-23T04:03:53.6350000+00:00","And questions for the ages: how do we flame the passion to write in our language? To celebrate our culture and way of mind with no restraint.

To loom upon theaters as it it filled with eager watchers proud of their people creations.

To be proud of your language, to bragg it towards the world as you cherish all of its whole.

A love for the imagination of our people, a devotion towards more of its creation and evolution","",""
"736550209068335135",".ayab","2025-03-23T04:04:48.2300000+00:00","Yet time is cruel

What can you naught but do but just watch with great torment as the foundation of our very republic destroyed brick-by-brick","",""
"753466051869802556","island_doge","2025-03-23T07:11:26.7620000+00:00","The indonesians are mostly Literate but most of them are lazy to read a book, great books were purged during the new order and people opressed from making great things. Maybe we could've had a philosopher internationally recognized by people around the world, but opression did this to us, limiting the great imagination of our people and us lacking the good legacy of our literacy.","",""
"882111176006328440","nerosalt","2025-03-23T12:46:07.1250000+00:00","A stomach without food? A horse without hay? A mule without its carrot?

The simple ability to read is meaningless when you keep it as that.

Poets like Shelley and Keats, and Poe and legends like Dylan Thomas, to avant-garde icons such as Mayakovsky, even writers like Lovecraft and Orwell, one thing differentiates them from your disgraceful Tribune writer.
In the words they write, they carve a shard of their very soul into the thin paper. In every sentence a emotion, feeling, frozen in time. A memory, a window into their minds. Each letter piercing our skulls, painting a sight greater than what our eyes can see.
From the Fields of Elysium to the horrors beyond our comprehension, the words are more than mere shapes on a sheet of wood.","",""
"882111176006328440","nerosalt","2025-03-23T12:52:20.7710000+00:00","Our people have no need for this.","",""
"882111176006328440","nerosalt","2025-03-23T12:53:16.2370000+00:00","The simple fulfilment of their desires, shallow romance, their need and lust satiated.","",""
"882111176006328440","nerosalt","2025-03-23T12:54:27.1410000+00:00","It saddens me to see great writers from our beloved homeland, ignored and forgotten.","",""
"882111176006328440","nerosalt","2025-03-23T12:54:53.4670000+00:00","I guess their dreams will never come to fruition.","",""
"882111176006328440","nerosalt","2025-03-23T12:56:16.2670000+00:00","The writer oppressed by the state, and the reader surpressed by the society.","",""
"753466051869802556","island_doge","2025-03-23T13:52:00.5610000+00:00","We could've had an indonesian George orwell, Nietszche and many others","",""
"753466051869802556","island_doge","2025-03-23T13:53:11.1090000+00:00","Pramoedya is the closest to orwell imo","",""
"882111176006328440","nerosalt","2025-03-23T14:43:55.5480000+00:00","We have pretty good writers yk","",""
"882111176006328440","nerosalt","2025-03-23T14:44:07.3190000+00:00","Most recent read was Teh dan Pengkhianat","",""
"882111176006328440","nerosalt","2025-03-23T14:44:27.6900000+00:00","(bought it LAST YEAR but my friend borrowed it, didnt read it then gave it back february)","",""
"882111176006328440","nerosalt","2025-03-23T14:44:37.4620000+00:00","The quote in my bio is from the book","",""
"882111176006328440","nerosalt","2025-03-23T14:44:41.8810000+00:00","Short n sweet read","",""
"736550209068335135",".ayab","2025-03-23T14:49:44.1110000+00:00","We have good writers but they don't get the fame they deserve","",""
"882111176006328440","nerosalt","2025-03-23T14:50:01.8490000+00:00","yuh","",""
"882111176006328440","nerosalt","2025-03-23T14:50:07.9360000+00:00","look at my poem","",""
"882111176006328440","nerosalt","2025-03-23T14:50:54.7550000+00:00","ruu tni
people climb atop cars
yet
police shit out tear gas
and the police play inside the gas
now whos the pig?","",""
"753466051869802556","island_doge","2025-03-23T14:58:20.4600000+00:00","🔥","",""
"882111176006328440","nerosalt","2025-03-23T15:00:03.2490000+00:00","another poem, specifically for island doge","",""
"882111176006328440","nerosalt","2025-03-23T15:00:30.4380000+00:00","skibid toilet ohio rizz
ruu tni now ruu polisi?
skibidi toilet ohio rizz","",""
"882111176006328440","nerosalt","2025-03-23T15:00:36.0170000+00:00","its called a villanelle","",""
"753466051869802556","island_doge","2025-03-23T15:15:19.2500000+00:00","kelazz","",""
"753466051869802556","island_doge","2025-03-23T15:16:06.6590000+00:00","""Sepuluh 🗣🔥""","",""
"412926738298044431","jaxxxxxxyyyy","2025-03-23T15:24:42.0810000+00:00","Ohhh I have one too for that","",""
"412926738298044431","jaxxxxxxyyyy","2025-03-23T15:25:26.2850000+00:00","""skibidi gyatt rizz only in ohio duke dennis did you pray today livvy dunne rizzing up baby gronk sussy imposter pibby glitch in real life sigma alpha omega male grindset andrew tate goon cave freddy fazbear colleen ballinger smurf cat vs strawberry elephant blud dawg shmlawg ishowspeed a whole bunch of turbulence flabbergasted after that...can't even mew in oklahoma free robux gltich working 2025 we can go gyatt for gyatt is that a jojo reference ? oh my god wat da hail!!!! Admin uzoth caught doing thug shake on zioles before dragon rework its not gonna come out ? Oh really? I will edge on your face while mewing to femboy hooters, you can't stop the alpha now watermelon cat is my baby daddy, you're are my sunshine bro really said 💀 i wish I had a level 10 gyatt like you it boosts my aura auramaxxing heard of that ? blud thinks he's the main character ahh scene ! amogus when the imposter is sus 19 dollar fortnite card who wants it and yes I'm giving it way so share share shær shalabikariririrororoshubalabur oh so you're approaching me?""","",""
"736550209068335135",".ayab","2025-03-23T15:31:17.1580000+00:00","""YOLO,"" said Millennials, and ""yeet,"" the Zoomers cried
""Rizzler gyatt fanum tax,"" the Alphas then replied
And lo, there came a shaking as an ebon spire rose
Upon it writ the tongues of men, their generations' prose
And from the sky a thund'rous voice called out unto the stone,
As golden letters glowed upon its surface, newly shown:
""RIZZLER GYATT FANUM TAX, SIGMA OHIO SKIBIDI""
And all beheld the words embossed theron in great timidity
With shaking and with wavering voice, the grim refrain began
As all the generations sang the verse at its command
Their weeping and their running sores did nothing to delay
The chanting of that fevered song as night succumbed to day
But rose that morn a blighted sun whose light scoured like a flood
The sky was rent asunder and the rivers turned to blood
Their flesh peeled off in sickly strips, their bones were rendered bare
And still they chanted ever on, the words they uttered there
Until bone and flesh and earth and death were all forgotten things
And still unbidden, undesired, the blackened spire sings
Around it wind the whispers of the souls in its captivity:
""rizzler gyatt fanum tax... sigma ohio skibidi"".","",""
"753466051869802556","island_doge","2025-03-23T15:32:49.3420000+00:00","abc def ghi icl ts pmo 😭🙏💔💔","",""
"412926738298044431","jaxxxxxxyyyy","2025-03-23T15:32:53.8370000+00:00","If you don't drop the skibidi bop like you used to goon, I will break into your house in Goofyan State and fanum tax the golden dawg from your skibidi collection. You will not become immune to Spanish or English again after that sigma. Because between the skibidi and the kai cenat, I alone, am the brainrotted one. I will rizz your alpha wolf like the rizzmaxxing I am while skibidinaxxing across the entire mewing system of bomboclat.","",""
"736550209068335135",".ayab","2025-03-23T15:33:04.5350000+00:00","This is way out of topic","",""
"712671680324960316","pompompuringdom","2025-03-23T15:33:26.0840000+00:00","I’m sorry…… what","",""
"712671680324960316","pompompuringdom","2025-03-23T15:33:52.1300000+00:00","My died just braincells","","🤣 (1)"
"736550209068335135",".ayab","2025-03-23T15:34:16.1310000+00:00","At the start of thread we wrote elequont paragraph and now it turned into brainrot poems","","😂 (1)"
"753466051869802556","island_doge","2025-03-23T15:35:07.0760000+00:00","this statement removed some of my braincells","",""
"882111176006328440","nerosalt","2025-03-23T15:35:43.6610000+00:00","clearly someone here hasn't done their government mandated reading","",""
"753466051869802556","island_doge","2025-03-23T15:35:57.3110000+00:00","its satire bro","",""
"736550209068335135",".ayab","2025-03-23T15:36:26.1730000+00:00","Back to Shakespearean and overdramatic English? Or make it casual?","",""
"753466051869802556","island_doge","2025-03-23T15:36:47.0000000+00:00","back to the serious topic","",""
"736550209068335135",".ayab","2025-03-23T15:36:53.9470000+00:00","Alright then","",""
"882111176006328440","nerosalt","2025-03-23T15:37:25.1860000+00:00","we should move to overdramatic 1700s","",""
"736550209068335135",".ayab","2025-03-23T15:37:38.4220000+00:00","I agree good sir","",""
"736550209068335135",".ayab","2025-03-23T15:37:59.2010000+00:00","This rubbish words shall be left behind!","",""
"412926738298044431","jaxxxxxxyyyy","2025-03-23T15:38:01.1310000+00:00","Yeah so we are yapping about Indo lit and I’m guessing we need to squad up to revive it. Literacy is like as important as how the society sees it. And to make it skibidi, we gotta level up our learning and the rizz points for reading in the Gen Z gooners. Through that rizz, we can finally see the mini renaissance of Indo fanum scribblers.","",""
"736550209068335135",".ayab","2025-03-23T15:38:39.5130000+00:00","Huzzah, for making it educational and brain melting","",""
"712671680324960316","pompompuringdom","2025-03-23T15:39:55.4380000+00:00","I’m laughing","",""
"712671680324960316","pompompuringdom","2025-03-23T15:40:00.6230000+00:00","This is genuinely hilarious","",""
"753466051869802556","island_doge","2025-03-23T15:41:39.8670000+00:00","Damn is 😃🥳💥","",""
"882111176006328440","nerosalt","2025-03-23T15:43:21.7680000+00:00","In the spirit of the current discussion, I would like to bring up the somewhat hopeful increase of town criers, who continue to push our common agenda, which is to instill the habit of reading into the youths of our generation.","",""
"882111176006328440","nerosalt","2025-03-23T15:45:02.0600000+00:00","These town criers, such as the Neo-Historian, assist in the spreading of this habit in the ethereal-plane, I do think this method is efficient in reaching our youths, especially those enslaved by the tick-tock.","",""
"412926738298044431","jaxxxxxxyyyy","2025-03-23T15:45:17.8510000+00:00","Yuh, I'm just leveling up my sigma game thanks to my Zoomer squads in the bimbel live teaching me these skibidi brainrot codes. Lowkey believe I can goon so hard that I break the Skibbidi fourth wall and reach Shakespearan rizz, though my dude probably died twice from the sigma energy in this alien Gooniverse lingo.","",""
"712671680324960316","pompompuringdom","2025-03-23T15:45:45.3420000+00:00","you’re so good at this @Jax","",""
"412926738298044431","jaxxxxxxyyyy","2025-03-23T15:46:13.7210000+00:00","Thanks to my alpha students inside the class teaching me","",""
"882111176006328440","nerosalt","2025-03-23T15:47:09.1590000+00:00","Something about his short, I would even call catchy, short ethereal plays, seems to draw in our youth, they flock to these short ethereal plays like fish to bait.","",""
"736550209068335135",".ayab","2025-03-23T15:48:03.1470000+00:00","How can we make reading trendy","",""
"736550209068335135",".ayab","2025-03-23T15:48:35.1010000+00:00","Ngl, fanfiction might be the only way","",""
"712671680324960316","pompompuringdom","2025-03-23T15:48:49.4600000+00:00","I’ve talked about this in my episode ft. Adit MKM. We need to make people to feel FOMO for not reading.","",""
"712671680324960316","pompompuringdom","2025-03-23T15:49:05.9090000+00:00","No, it’s not fan fiction","",""
"712671680324960316","pompompuringdom","2025-03-23T15:49:11.7890000+00:00","We need to make reading a status symbol","",""
"712671680324960316","pompompuringdom","2025-03-23T15:49:25.2340000+00:00","We need it to be a COOL thing","",""
"882111176006328440","nerosalt","2025-03-23T15:49:40.4340000+00:00","sigma game is not proper, sigma is usually used as an adjective, sigma game can be made more efficient by simply saying rizz or if you really wanna bring home your statement, sigma rizz. skibidi brainrot codes are not a thing, do NOT spell skibidi with two Bs, lingo is NOT a gen z slang. your gen-z needs to be improved upon.","","😂 (1)"
"712671680324960316","pompompuringdom","2025-03-23T15:50:06.5050000+00:00","We need to talk about books we’re reading in social settings, in group gatherings","",""
"736550209068335135",".ayab","2025-03-23T15:50:19.5200000+00:00","We need book clubs","",""
"882111176006328440","nerosalt","2025-03-23T15:50:20.4240000+00:00","wouldn't that only work if we already have an existing large bunch of people who read?","",""
"882111176006328440","nerosalt","2025-03-23T15:50:46.3600000+00:00","kt dikucilkan","",""
"882111176006328440","nerosalt","2025-03-23T15:50:53.9940000+00:00","gk diajak ke arisan","",""
"882111176006328440","nerosalt","2025-03-23T15:51:28.0590000+00:00","wouldnt that be isolated and hence not increase the number of people reading?","",""
"712671680324960316","pompompuringdom","2025-03-23T15:53:06.2550000+00:00","I don’t think so, cause I think of it the way I look at why luxury items like Birkins sell so well — something becomes more desirable and attractive the more exclusive it is, but specifically, when it’s exclusive to the upperclass","",""
"882111176006328440","nerosalt","2025-03-23T15:53:28.0600000+00:00","so rich people need to start reading?","",""
"736550209068335135",".ayab","2025-03-23T15:53:37.0060000+00:00","Yep make reading books as an elitist activity","",""
"882111176006328440","nerosalt","2025-03-23T15:53:45.7850000+00:00","we need to get ayu ting ting to post a picture of herself reading makanya mikir","","😂 (1)"
"712671680324960316","pompompuringdom","2025-03-23T15:53:46.7290000+00:00","Yes, and furthermore, rich people need to TALK about reading","",""
"736550209068335135",".ayab","2025-03-23T15:54:06.6740000+00:00","Unfortunately when the aristocracy start something the common will always follows","","💯 (1)"
"882111176006328440","nerosalt","2025-03-23T15:54:13.7240000+00:00","idea","",""
"882111176006328440","nerosalt","2025-03-23T15:54:23.9120000+00:00","yk how","",""
"882111176006328440","nerosalt","2025-03-23T15:54:38.4580000+00:00","the sigma plague spread to our sosmed","",""
"736550209068335135",".ayab","2025-03-23T15:55:01.3300000+00:00","I think I know where this is going","",""
"882111176006328440","nerosalt","2025-03-23T15:55:09.3320000+00:00","there was a period where tiktok boys used american psycho or peaky blinders pfps","",""
"882111176006328440","nerosalt","2025-03-23T15:55:57.3690000+00:00","the infection has developed but plateaued","",""
"882111176006328440","nerosalt","2025-03-23T15:56:03.4010000+00:00","currently, its either ironic","",""
"882111176006328440","nerosalt","2025-03-23T15:56:14.0230000+00:00","or just "" 10 cara terlihat dingin ""","",""
"412926738298044431","jaxxxxxxyyyy","2025-03-23T15:56:27.4510000+00:00","Bet, Ohioamogussigma malegrimace fanum taxratioskibidisigmafanum tax skibidi rizzgrimacefanum tax skibidi rizzlerfanum taxskibidi rizz, skibidiskibidi rizzlersigma sigma malebussinamogusbaby gronk w rizzohioohio. Gyattgrimace shakeskibidi rizz skibidi rizzgrimacefanum tax gyattw rizzfortnitesigma skibidi rizzgrimaceskibidiskibidi rizz rizzamogusskibidi rizzlersigmasigma male skibidi rizzgrimacefanum tax rizzw rizzonly in ohio skibidi rizzamoguskai cenatgrimaceskibidi rizzrizzlertiktok.","",""
"882111176006328440","nerosalt","2025-03-23T15:56:40.0410000+00:00","what we can do is somehow reintroduce that sickness","",""
"882111176006328440","nerosalt","2025-03-23T15:56:44.3810000+00:00","stronger and harder","",""
"882111176006328440","nerosalt","2025-03-23T15:57:01.9420000+00:00","the brainrot vocab flexing is CRAZY","",""
"882111176006328440","nerosalt","2025-03-23T15:57:27.3780000+00:00","ts pmo icl gng dfw ts ong 🍷","",""
"882111176006328440","nerosalt","2025-03-23T15:57:51.1850000+00:00","this time, make them read the actual books regarding the topic","",""
"882111176006328440","nerosalt","2025-03-23T15:58:35.2960000+00:00","make "" Buku ini menceritakan cerita tentang Peaky Blinders di dunia nyata? "" or "" Buku ini mengajarkan psikologi gelap? "" videos","",""
"882111176006328440","nerosalt","2025-03-23T15:58:39.4310000+00:00","this is just one example","",""
"882111176006328440","nerosalt","2025-03-23T15:59:03.7030000+00:00","form a relation between books and their interests","",""
"736550209068335135",".ayab","2025-03-23T15:59:48.8060000+00:00","I knew it","",""
"882111176006328440","nerosalt","2025-03-23T15:59:54.2030000+00:00","maybe make a "" GOONic Kairi menang karena membaca buku ini? ""","",""
"882111176006328440","nerosalt","2025-03-23T16:00:06.2830000+00:00","yeah this already happened overseas","",""
"882111176006328440","nerosalt","2025-03-23T16:00:18.2040000+00:00","andrew tate n friends","",""
"736550209068335135",".ayab","2025-03-23T16:00:27.9810000+00:00","I mean this friend","",""
"882111176006328440","nerosalt","2025-03-23T16:00:29.5080000+00:00","people start reading 50 laws of power","",""
"412926738298044431","jaxxxxxxyyyy","2025-03-23T16:00:31.5770000+00:00","Why do I gyat a feeling that some rizzlers would make some baby gronk skibidi materials out of the fanum literacymaxxing then butchered the whole sigma verse with their brainrotted mini lit","",""
"882111176006328440","nerosalt","2025-03-23T16:00:52.8160000+00:00","what","",""
"882111176006328440","nerosalt","2025-03-23T16:01:02.1580000+00:00","enough.","",""
"882111176006328440","nerosalt","2025-03-23T16:01:24.1570000+00:00","Nomor satu, akhiri kalimat dengan tanda titik.","",""
"882111176006328440","nerosalt","2025-03-23T16:01:39.6830000+00:00","Nomor dua, hilangkan PP WA.","",""
"712671680324960316","pompompuringdom","2025-03-23T16:03:58.6500000+00:00","What are you guys currently reading?","",""
"736550209068335135",".ayab","2025-03-23T16:05:55.4150000+00:00","Korean villainess Manhwa","",""
"736550209068335135",".ayab","2025-03-23T16:06:08.1520000+00:00","Shoujo comic","",""
"412926738298044431","jaxxxxxxyyyy","2025-03-23T16:06:12.5890000+00:00","Blood Meridian","",""
"736550209068335135",".ayab","2025-03-23T16:06:17.2720000+00:00","Copious amount of shoujo comic","","👍 (1)"
"736550209068335135",".ayab","2025-03-23T16:06:42.6350000+00:00","Heard good things about it is it good?","",""
"736550209068335135",".ayab","2025-03-23T16:07:17.0700000+00:00","I don't want tho think outside of university lately","",""
"712671680324960316","pompompuringdom","2025-03-23T16:07:26.8790000+00:00","ah yeah @Buzzer beneran was telling me all about that","",""
"882111176006328440","nerosalt","2025-03-23T16:07:41.6710000+00:00","honestly not reading anything","","👍 (1)"
"882111176006328440","nerosalt","2025-03-23T16:07:50.8190000+00:00","finished, as i said before","",""
"882111176006328440","nerosalt","2025-03-23T16:07:58.7910000+00:00","teh dan pengkhianat last week","","👍 (1)"
"712671680324960316","pompompuringdom","2025-03-23T16:08:04.7960000+00:00","lol i have lashes coming out soon for my beauty brand, named ‘Shoujo’","",""
"882111176006328440","nerosalt","2025-03-23T16:08:05.4690000+00:00","idk what to read rn","",""
"882111176006328440","nerosalt","2025-03-23T16:08:44.5900000+00:00","maybe ill go finish dark night of the soul","",""
"882111176006328440","nerosalt","2025-03-23T16:08:55.0110000+00:00","someone gave it to me for my birthday","",""
"605452468284817427","buzzer9229","2025-03-23T16:09:08.7850000+00:00","Indah anime arc","",""
"736550209068335135",".ayab","2025-03-23T16:09:19.4680000+00:00","Guys don't need the product because we already have  beautiful natural eyelashes","","😂 (1)"
"882111176006328440","nerosalt","2025-03-23T16:09:35.2420000+00:00","not tryna intrude but are you both the same age?","",""
"712671680324960316","pompompuringdom","2025-03-23T16:10:00.9170000+00:00","you know what i miss the most from my miserable childhood? 

the only good memory i have of being a middle schooler was how genuinely excited i always was every time i got to read my collection of dark romance fictional novels","",""
"712671680324960316","pompompuringdom","2025-03-23T16:10:21.7850000+00:00","I’m 97, he’s 98, so pretty much yes","",""
"712671680324960316","pompompuringdom","2025-03-23T16:10:29.0670000+00:00","I’m April 97, he’s August 98","",""
"882111176006328440","nerosalt","2025-03-23T16:10:40.2950000+00:00","dark night of the soul was written by st. john of the cross 😭","","😭 (1)"
"882111176006328440","nerosalt","2025-03-23T16:10:51.3340000+00:00","but yes, reading fiction is amazing","",""
"712671680324960316","pompompuringdom","2025-03-23T16:10:54.0050000+00:00","oh","",""
"712671680324960316","pompompuringdom","2025-03-23T16:10:57.4700000+00:00","LMFAOOOOOOOOO","",""
"712671680324960316","pompompuringdom","2025-03-23T16:11:01.2230000+00:00","i’m laughing","",""
"712671680324960316","pompompuringdom","2025-03-23T16:11:15.4860000+00:00","i read “dark night” and i was like OMG","",""
"882111176006328440","nerosalt","2025-03-23T16:11:15.8400000+00:00","for me it was reading science fiction novels and or yk those","",""
"412926738298044431","jaxxxxxxyyyy","2025-03-23T16:11:20.2040000+00:00","It was edgy for the sake of edgy","",""
"712671680324960316","pompompuringdom","2025-03-23T16:11:21.4430000+00:00","house of night series","",""
"882111176006328440","nerosalt","2025-03-23T16:11:26.5650000+00:00","books","",""
"882111176006328440","nerosalt","2025-03-23T16:11:31.9410000+00:00","indonesian or english with that","",""
"882111176006328440","nerosalt","2025-03-23T16:11:43.0500000+00:00","specifically hand drawn covers","",""
"412926738298044431","jaxxxxxxyyyy","2025-03-23T16:11:46.1020000+00:00","Ye","",""
