AuthorID,Author,Date,Content,Attachments,Reactions
"575141979873083393","sukadeltoro","2025-12-03T12:02:29.5500000+00:00","Will write several methodologies, techniques, and tools to analyze and assess political risks and policies","","poggers (3),👍 (4)"
"712671680324960316","pompompuringdom","2025-12-03T15:30:36.5250000+00:00","i am sat","",""
"575141979873083393","sukadeltoro","2025-12-03T16:06:54.8370000+00:00","","https://cdn.discordapp.com/attachments/1445747017069629552/1445808526638448912/IMG_5408.png?ex=69968c5e&is=69953ade&hm=0b1a8841eb279483eb7334efe692b0de116a92b5c51dcf3326abf50039cf03da&,https://cdn.discordapp.com/attachments/1445747017069629552/1445808526986313899/IMG_5409.png?ex=69968c5e&is=69953ade&hm=fb5dd014c40f2782e7a7cb3dac657ebd00e6f35aeb06520a84b44e73acab6758&",""
"575141979873083393","sukadeltoro","2025-12-31T03:27:12.7570000+00:00","Levels of Analysis, basically to analyze the stakeholders who partakes in decision making systems:

***INDIVIDUAL-LEVEL***: Worldview, Aspiration, Interests, Area of Cooperation, Agenda, Action OR Interests, Substance, Influence, Stability

***GROUP-LEVEL***: 

Size: People, Groups, Organisations; Ecosystem of thinking, System of thinking, Action of thinking

Intent: Authority, Autonomy, Administration; Worldview, Key Aspirations, Key Interests, Areas of Cooperation, Key Issues, Key Agendas, Key Actions; Interests, Substance, Influence, Stability

Capabilities: SALUTE, ASCOPE, PMEESSII-PT, DOTMLPF

***SYSTEM-LEVEL***: Aware (Meta-Analysis and Morphological Analysis), Assess (Size, Intention, capabilities), Anticipate (Short, Medium, and long-term) + scenario planning","",""
